Transaction_ID,Date,Customer_ID,Product_Category,Product_Name,Price,Quantity,Payment_Status,order_date,unit_price,currency,unit_price_eur,quantity,gross_revenue_eur,returns_count,refund_amount,any_return_status,tickets_count,avg_sentiment,top_topic,is_returned,refund_rate
100236,2023-11-24,C0012,Electronics,Smartphone Z,919.20,1,Paid,2023-11-24,919.2,EUR,919.2,1,919.2,0,0.0,,0,0.0,no_ticket,0,0.0
100061,2023-11-17,C0002,Electronics,Laptop X,"1598,23 EUR",1,Paid,2023-11-17,1598.23,EUR,1598.23,1,1598.23,0,0.0,,0,0.0,no_ticket,0,0.0
101131,2023-12-14,C0008,Smart Home,NordPlug,23.86,1,Paid,2023-12-14,23.86,EUR,23.86,1,23.86,0,0.0,,4,-1.0,defect_quality,0,0.0
100391,28/11/2023,C0001,Smart Home,NordTherm,$101.68,1,Paid,2023-11-28,101.68,USD,93.54560000000001,1,93.54560000000001,0,0.0,,0,0.0,no_ticket,0,0.0
100319,2023-11-27,C0004,Accessories,Phone Case,"35,72 EUR",1,Paid,2023-11-27,35.72,EUR,35.72,1,35.72,0,0.0,,0,0.0,no_ticket,0,0.0
100889,2023-12-09,C0001,Electronics,NoiseCancel Headphones,230.36,1,Paid,2023-12-09,230.36,EUR,230.36,1,230.36,0,0.0,,0,0.0,no_ticket,0,0.0
100105,2023-11-19,C0056,Smart Home,NordCam Mini,"82,40 EUR",1,Paid,2023-11-19,82.4,EUR,82.4,1,82.4,0,0.0,,0,0.0,no_ticket,0,0.0
100603,2023-12-04,C0002,Electronics,Laptop X,"1771,94 EUR",1,Paid,2023-12-04,1771.94,EUR,1771.94,1,1771.94,0,0.0,,0,0.0,no_ticket,0,0.0
101189,2023-11-28,C0001,Smart Home,NordLock Pro,210.88,1,Paid,2023-11-28,210.88,EUR,210.88,1,210.88,0,0.0,,0,0.0,no_ticket,0,0.0
100563,2023-12-03,C0008,Electronics,Smartphone Z,855.14,1,Paid,2023-12-03,855.14,EUR,855.14,1,855.14,1,855.14,Processed,0,0.0,no_ticket,1,1.0
100366,2023-11-28,C0004,Electronics,Smartphone Z,1024.64,1,Paid,2023-11-28,1024.64,EUR,1024.64,1,1024.64,0,0.0,,0,0.0,no_ticket,0,0.0
100996,2023-12-12,C0003,Smart Home,NordLock Pro,222.61,1,Paid,2023-12-12,222.61,EUR,222.61,1,222.61,0,0.0,,0,0.0,no_ticket,0,0.0
100043,16/11/2023,C0002,Electronics,TV Pro,$1164.30,1,Paid,2023-11-16,1164.3,USD,1071.156,1,1071.156,0,0.0,,0,0.0,no_ticket,0,0.0
100725,2023-12-06,C0003,Accessories,Laptop Sleeve,27.13,2,Paid,2023-12-06,27.13,EUR,27.13,2,54.26,0,0.0,,0,0.0,no_ticket,0,0.0
100456,2023-11-30,C0001,Smart Home,NordTherm,"105,45 EUR",1,Paid,2023-11-30,105.45,EUR,105.45,1,105.45,0,0.0,,0,0.0,no_ticket,0,0.0
100537,2023-12-02,C0030,Electronics,NoiseCancel Headphones,"290,46 EUR",1,Paid,2023-12-02,290.46,EUR,290.46,1,290.46,0,0.0,,1,0.0,delivery,0,0.0
101176,2023-11-24,C0017,Accessories,Phone Case,"34,84 EUR",1,Paid,2023-11-24,34.84,EUR,34.84,1,34.84,0,0.0,,0,0.0,no_ticket,0,0.0
101058,2023-12-13,C0001,Electronics,Laptop X,"1504,82 EUR",1,Paid,2023-12-13,1504.82,EUR,1504.82,1,1504.82,0,0.0,,0,0.0,no_ticket,0,0.0
100032,2023-11-16,C0094,Electronics,Laptop X,$1585.05,1,Paid,2023-11-16,1585.05,USD,1458.246,1,1458.246,0,0.0,,0,0.0,no_ticket,0,0.0
100455,2023-11-30,C0117,Smart Home,NordLock Pro,205.04,2,Paid,2023-11-30,205.04,EUR,205.04,2,410.08,0,0.0,,3,-0.3333333333333333,defect_quality,0,0.0
100354,2023-11-28,C0002,Smart Home,NordLock Pro,"201,09 EUR",1,Paid,2023-11-28,201.09,EUR,201.09,1,201.09,0,0.0,,0,0.0,no_ticket,0,0.0
101181,08/12/2023,C0006,Accessories,Accessory Bundle,27.11,1,Paid,2023-12-08,27.11,EUR,27.11,1,27.11,0,0.0,,0,0.0,no_ticket,0,0.0
100062,17/11/2023,C0001,Smart Home,NordLock Pro,221.97,1,Paid,2023-11-17,221.97,EUR,221.97,1,221.97,0,0.0,,0,0.0,no_ticket,0,0.0
100858,09/12/2023,C0001,Electronics,TV Pro,1060.25,1,Failed,2023-12-09,1060.25,EUR,1060.25,1,1060.25,0,0.0,,0,0.0,no_ticket,0,0.0
101049,2023-12-13,C0001,Electronics,NoiseCancel Headphones,288,1,Paid,2023-12-13,288.0,EUR,288.0,1,288.0,0,0.0,,0,0.0,no_ticket,0,0.0
100686,2023-12-05,C0059,Electronics,Tablet A,753.90,1,Paid,2023-12-05,753.9,EUR,753.9,1,753.9,0,0.0,,2,-1.0,defect_quality,0,0.0
100233,24/11/2023,C0278,Electronics,TV Pro,1041.16,1,Paid,2023-11-24,1041.16,EUR,1041.16,1,1041.16,0,0.0,,0,0.0,no_ticket,0,0.0
100094,2023-11-18,C0076,Accessories,Charger,"28,32 EUR",3,Paid,2023-11-18,28.32,EUR,28.32,3,84.96000000000001,0,0.0,,0,0.0,no_ticket,0,0.0
100215,23/11/2023,C0063,Electronics,Smartphone Z,1077.99,1,Paid,2023-11-23,1077.99,EUR,1077.99,1,1077.99,0,0.0,,0,0.0,no_ticket,0,0.0
100310,2023-11-26,C0002,Electronics,TV Pro,1601.36,1,Paid,2023-11-26,1601.36,EUR,1601.36,1,1601.36,0,0.0,,0,0.0,no_ticket,0,0.0
100202,2023-11-23,C0002,Smart Home,NordLock Pro,$186.48,1,Pending,2023-11-23,186.48,USD,171.5616,1,171.5616,0,0.0,,0,0.0,no_ticket,0,0.0
100290,2023-11-25,C0002,Accessories,Phone Case,12.32,1,Paid,2023-11-25,12.32,EUR,12.32,1,12.32,0,0.0,,0,0.0,no_ticket,0,0.0
100737,2023-12-06,C0015,Electronics,Tablet A,672.16,1,Paid,2023-12-06,672.16,EUR,672.16,1,672.16,0,0.0,,0,0.0,no_ticket,0,0.0
100318,2023-11-27,C0005,Electronics,Smartphone Z,727.66,1,Paid,2023-11-27,727.66,EUR,727.66,1,727.66,0,0.0,,0,0.0,no_ticket,0,0.0
101141,01/12/2023,C0038,Accessories,Accessory Bundle,55.24,3,Paid,2023-12-01,55.24,EUR,55.24,3,165.72,0,0.0,,0,0.0,no_ticket,0,0.0
100891,2023-12-09,C0008,Smart Home,NordLock Pro,"212,31 EUR",2,Paid,2023-12-09,212.31,EUR,212.31,2,424.62,0,0.0,,0,0.0,no_ticket,0,0.0
101188,2023-12-10,C0062,Accessories,Wireless Mouse,32.09,1,Paid,2023-12-10,32.09,EUR,32.09,1,32.09,0,0.0,,0,0.0,no_ticket,0,0.0
100096,2023-11-18,C0001,Electronics,NoiseCancel Headphones,"166,52 EUR",1,Paid,2023-11-18,166.52,EUR,166.52,1,166.52,0,0.0,,0,0.0,no_ticket,0,0.0
100880,2023-12-09,C0001,Smart Home,NordLock Pro,231.50,1,Paid,2023-12-09,231.5,EUR,231.5,1,231.5,0,0.0,,0,0.0,no_ticket,0,0.0
100070,2023-11-17,C0124,Accessories,Accessory Bundle,"86,79 EUR",1,Paid,2023-11-17,86.79,EUR,86.79,1,86.79,0,0.0,,1,-3.0,defect_quality,0,0.0
100797,07/12/2023,C0097,Electronics,Tablet A,583.65,1,Paid,2023-12-07,583.65,EUR,583.65,1,583.65,0,0.0,,0,0.0,no_ticket,0,0.0
100721,2023-12-06,C0085,Smart Home,NordLock Pro,"200,26 EUR",1,Paid,2023-12-06,200.26,EUR,200.26,1,200.26,0,0.0,,2,-1.5,defect_quality,0,0.0
100796,2023-12-07,C0145,Accessories,Wireless Mouse,"43,57 EUR",1,Paid,2023-12-07,43.57,EUR,43.57,1,43.57,0,0.0,,2,-1.0,delivery,0,0.0
100353,28/11/2023,C0010,Electronics,NoiseCancel Headphones,"297,95 EUR",1,Failed,2023-11-28,297.95,EUR,297.95,1,297.95,0,0.0,,0,0.0,no_ticket,0,0.0
100352,2023-11-28,C0013,Electronics,Laptop X,1343,1,Paid,2023-11-28,1343.0,EUR,1343.0,1,1343.0,0,0.0,,0,0.0,no_ticket,0,0.0
100551,02/12/2023,C0200,Electronics,Tablet A,"445,23 EUR",1,Paid,2023-12-02,445.23,EUR,445.23,1,445.23,0,0.0,,0,0.0,no_ticket,0,0.0
100404,2023-11-29,C0017,Smart Home,NordTherm,"83,85 EUR",1,Paid,2023-11-29,83.85,EUR,83.85,1,83.85,0,0.0,,0,0.0,no_ticket,0,0.0
100715,06/12/2023,C0002,Electronics,NoiseCancel Headphones,"330,75 EUR",1,Paid,2023-12-06,330.75,EUR,330.75,1,330.75,0,0.0,,0,0.0,no_ticket,0,0.0
100170,2023-11-22,C0199,Electronics,TV Pro,"1 050,20 EUR",1,Failed,2023-11-22,50.2,EUR,50.2,1,50.2,0,0.0,,0,0.0,no_ticket,0,0.0
100431,29/11/2023,C0310,Smart Home,NordLock Pro,"193,31 EUR",1,Paid,2023-11-29,193.31,EUR,193.31,1,193.31,0,0.0,,0,0.0,no_ticket,0,0.0
100608,2023-12-04,C0024,Smart Home,NordTherm,"81,21 EUR",1,Paid,2023-12-04,81.21,EUR,81.21,1,81.21,0,0.0,,0,0.0,no_ticket,0,0.0
100648,2023-12-05,C0024,Electronics,Smartphone Z,834.38,1,Paid,2023-12-05,834.38,EUR,834.38,1,834.38,0,0.0,,0,0.0,no_ticket,0,0.0
100623,04/12/2023,C0002,Accessories,Laptop Sleeve,"43,96 EUR",2,Paid,2023-12-04,43.96,EUR,43.96,2,87.92,0,0.0,,0,0.0,no_ticket,0,0.0
100341,2023-11-27,C0006,Electronics,NoiseCancel Headphones,300.70,2,Paid,2023-11-27,300.7,EUR,300.7,2,601.4,0,0.0,,0,0.0,no_ticket,0,0.0
100742,2023-12-07,C0001,Accessories,USB-C Cable,"10,69 EUR",4,Paid,2023-12-07,10.69,EUR,10.69,4,42.76,0,0.0,,0,0.0,no_ticket,0,0.0
100873,2023-12-09,C0004,Electronics,Smartphone Z,"863,18 EUR",1,Paid,2023-12-09,863.18,EUR,863.18,1,863.18,0,0.0,,0,0.0,no_ticket,0,0.0
100078,18/11/2023,C0007,Electronics,Tablet A,"527,12 EUR",1,Paid,2023-11-18,527.12,EUR,527.12,1,527.12,0,0.0,,0,0.0,no_ticket,0,0.0
101143,2023-12-10,C0001,Electronics,TV Pro,"970,60 EUR",1,Paid,2023-12-10,970.6,EUR,970.6,1,970.6,0,0.0,,0,0.0,no_ticket,0,0.0
100910,10/12/2023,C0006,Smart Home,NordLock Pro,181.92,1,Failed,2023-12-10,181.92,EUR,181.92,1,181.92,0,0.0,,0,0.0,no_ticket,0,0.0
100432,2023-11-29,C0006,Smart Home,NordLock Pro,187.29,1,Failed,2023-11-29,187.29,EUR,187.29,1,187.29,0,0.0,,0,0.0,no_ticket,0,0.0
100272,25/11/2023,C0003,Electronics,TV Pro,1118.62,1,Paid,2023-11-25,1118.62,EUR,1118.62,1,1118.62,0,0.0,,0,0.0,no_ticket,0,0.0
100081,18/11/2023,C0091,Electronics,Tablet A,372.51,1,Paid,2023-11-18,372.51,EUR,372.51,1,372.51,0,0.0,,0,0.0,no_ticket,0,0.0
100280,2023-11-25,C0002,Accessories,Charger,"39,36 EUR",1,Paid,2023-11-25,39.36,EUR,39.36,1,39.36,0,0.0,,0,0.0,no_ticket,0,0.0
100837,08/12/2023,C0006,Electronics,Tablet A,"702,29 EUR",1,Paid,2023-12-08,702.29,EUR,702.29,1,702.29,0,0.0,,0,0.0,no_ticket,0,0.0
100506,2023-12-01,C0057,Accessories,Screen Protector,7.12,1,Paid,2023-12-01,7.12,EUR,7.12,1,7.12,0,0.0,,1,-3.0,defect_quality,0,0.0
100364,2023-11-28,C0003,Electronics,TV Pro,$1094.93,1,Paid,2023-11-28,1094.93,USD,1007.3356000000001,1,1007.3356000000001,0,0.0,,0,0.0,no_ticket,0,0.0
101173,2023-12-07,C0002,Electronics,Tablet A,$636.80,1,Paid,2023-12-07,636.8,USD,585.856,1,585.856,0,0.0,,0,0.0,no_ticket,0,0.0
100612,2023-12-04,C0052,Accessories,Charger,"35,09 EUR",3,Pending,2023-12-04,35.09,EUR,35.09,3,105.27000000000001,0,0.0,,0,0.0,no_ticket,0,0.0
100040,2023-11-16,C0238,Electronics,Laptop X,1653.40,1,Paid,2023-11-16,1653.4,EUR,1653.4,1,1653.4,0,0.0,,0,0.0,no_ticket,0,0.0
101085,2023-12-13,C0038,Smart Home,NordCam Mini,"91,86 EUR",2,Paid,2023-12-13,91.86,EUR,91.86,2,183.72,0,0.0,,0,0.0,no_ticket,0,0.0
100412,29/11/2023,C0053,Electronics,TV Pro,1261.41,1,Paid,2023-11-29,1261.41,EUR,1261.41,1,1261.41,0,0.0,,0,0.0,no_ticket,0,0.0
100278,25/11/2023,C0181,Smart Home,NordLock Pro,"247,91 EUR",1,Paid,2023-11-25,247.91,EUR,247.91,1,247.91,0,0.0,,0,0.0,no_ticket,0,0.0
101101,2023-12-14,C0004,Smart Home,NordLock Pro,211.15,1,Paid,2023-12-14,211.15,EUR,211.15,1,211.15,0,0.0,,2,-1.0,delivery,0,0.0
100565,2023-12-03,C0005,Smart Home,NordLock Pro,185,1,Paid,2023-12-03,185.0,EUR,185.0,1,185.0,0,0.0,,0,0.0,no_ticket,0,0.0
100827,2023-12-08,C0013,Electronics,Tablet A,$665.07,1,Paid,2023-12-08,665.07,USD,611.8644,1,611.8644,1,665.07,Processed,0,0.0,no_ticket,1,1.0869565217391304
100561,03/12/2023,C0002,Electronics,Tablet A,"771,78 EUR",1,Paid,2023-12-03,771.78,EUR,771.78,1,771.78,0,0.0,,0,0.0,no_ticket,0,0.0
101183,21/11/2023,C0170,Accessories,Charger,30.35,2,Paid,2023-11-21,30.35,EUR,30.35,2,60.7,0,0.0,,0,0.0,no_ticket,0,0.0
100426,2023-11-29,C0031,Accessories,Screen Protector,$8.99,2,Failed,2023-11-29,8.99,USD,8.270800000000001,2,16.541600000000003,0,0.0,,0,0.0,no_ticket,0,0.0
100345,2023-11-27,C0250,Electronics,TV Pro,1536.64,1,Paid,2023-11-27,1536.64,EUR,1536.64,1,1536.64,0,0.0,,0,0.0,no_ticket,0,0.0
100998,12/12/2023,C0001,Accessories,Laptop Sleeve,"23,36 EUR",1,Failed,2023-12-12,23.36,EUR,23.36,1,23.36,0,0.0,,0,0.0,no_ticket,0,0.0
101047,2023-12-13,C0023,Electronics,Tablet A,441.24,1,Paid,2023-12-13,441.24,EUR,441.24,1,441.24,0,0.0,,1,-4.0,defect_quality,0,0.0
100471,2023-11-30,C0019,Smart Home,NordLock Pro,$180.99,1,Paid,2023-11-30,180.99,USD,166.51080000000002,1,166.51080000000002,0,0.0,,0,0.0,no_ticket,0,0.0
100303,2023-11-26,C0003,Smart Home,NordLock Pro,224.82,1,Paid,2023-11-26,224.82,EUR,224.82,1,224.82,0,0.0,,0,0.0,no_ticket,0,0.0
101002,12/12/2023,C0008,Electronics,Tablet A,318.91,1,Paid,2023-12-12,318.91,EUR,318.91,1,318.91,0,0.0,,0,0.0,no_ticket,0,0.0
100570,2023-12-03,C0001,Accessories,Laptop Sleeve,"19,23 EUR",1,Paid,2023-12-03,19.23,EUR,19.23,1,19.23,0,0.0,,0,0.0,no_ticket,0,0.0
100058,2023-11-17,C0031,Electronics,TV Pro,"914,97 EUR",1,Paid,2023-11-17,914.97,EUR,914.97,1,914.97,0,0.0,,0,0.0,no_ticket,0,0.0
100395,2023-11-29,C0169,Electronics,NoiseCancel Headphones,"180,76 EUR",1,Paid,2023-11-29,180.76,EUR,180.76,1,180.76,0,0.0,,1,-1.0,delivery,0,0.0
100093,2023-11-18,C0004,Electronics,Smartphone Z,894.13,1,Paid,2023-11-18,894.13,EUR,894.13,1,894.13,0,0.0,,0,0.0,no_ticket,0,0.0
100798,2023-12-08,C0004,Accessories,Laptop Sleeve,41.56,1,Paid,2023-12-08,41.56,EUR,41.56,1,41.56,0,0.0,,0,0.0,no_ticket,0,0.0
100573,2023-12-03,C0008,Electronics,Laptop X,1597.38,1,Paid,2023-12-03,1597.38,EUR,1597.38,1,1597.38,0,0.0,,0,0.0,no_ticket,0,0.0
100484,2023-12-01,C0137,Smart Home,NordCam Mini,80,1,Paid,2023-12-01,80.0,EUR,80.0,1,80.0,0,0.0,,1,-1.0,delivery,0,0.0
100261,2023-11-25,C0010,Electronics,NoiseCancel Headphones,258.75,1,Paid,2023-11-25,258.75,EUR,258.75,1,258.75,1,258.75,Processed,2,-1.5,delivery,1,1.0
100084,2023-11-18,C0001,Accessories,Wireless Mouse,"56,31 EUR",1,Paid,2023-11-18,56.31,EUR,56.31,1,56.31,0,0.0,,0,0.0,no_ticket,0,0.0
100592,2023-12-03,C0024,Smart Home,NordLock Pro,"189,75 EUR",1,Paid,2023-12-03,189.75,EUR,189.75,1,189.75,0,0.0,,0,0.0,no_ticket,0,0.0
100003,2023-11-15,C0059,Electronics,Laptop X,1446.04,1,Paid,2023-11-15,1446.04,EUR,1446.04,1,1446.04,0,0.0,,0,0.0,no_ticket,0,0.0
100042,2023-11-16,C0002,Accessories,Charger,"18,80 EUR",3,Paid,2023-11-16,18.8,EUR,18.8,3,56.400000000000006,0,0.0,,0,0.0,no_ticket,0,0.0
100327,2023-11-27,C0002,Electronics,Laptop X,$1437.50,1,Paid,2023-11-27,1437.5,USD,1322.5,1,1322.5,0,0.0,,0,0.0,no_ticket,0,0.0
100087,18/11/2023,C0002,Accessories,Accessory Bundle,32.79,1,Paid,2023-11-18,32.79,EUR,32.79,1,32.79,0,0.0,,0,0.0,no_ticket,0,0.0
100457,30/11/2023,C0010,Accessories,Screen Protector,5,1,Paid,2023-11-30,5.0,EUR,5.0,1,5.0,0,0.0,,0,0.0,no_ticket,0,0.0
100965,2023-12-11,C0279,Accessories,Screen Protector,"12,26 EUR",1,Paid,2023-12-11,12.26,EUR,12.26,1,12.26,0,0.0,,1,-1.0,delivery,0,0.0
101028,2023-12-12,C0044,Accessories,Wireless Mouse,"31,71 EUR",1,Paid,2023-12-12,31.71,EUR,31.71,1,31.71,0,0.0,,1,0.0,app_connectivity,0,0.0
100731,06/12/2023,C0002,Electronics,TV Pro,"1405,31 EUR",2,Paid,2023-12-06,1405.31,EUR,1405.31,2,2810.62,0,0.0,,0,0.0,no_ticket,0,0.0
100852,09/12/2023,C0113,Accessories,USB-C Cable,"18,62 EUR",2,Paid,2023-12-09,18.62,EUR,18.62,2,37.24,0,0.0,,0,0.0,no_ticket,0,0.0
100916,2023-12-10,C0003,Electronics,Laptop X,"1608,63 EUR",1,Paid,2023-12-10,1608.63,EUR,1608.63,1,1608.63,0,0.0,,0,0.0,no_ticket,0,0.0
101071,2023-12-13,C0013,Accessories,Wireless Mouse,26.47,2,Paid,2023-12-13,26.47,EUR,26.47,2,52.94,0,0.0,,1,-1.0,delivery,0,0.0
101160,2023-11-25,C0004,Accessories,Phone Case,"19,93 EUR",2,Paid,2023-11-25,19.93,EUR,19.93,2,39.86,0,0.0,,0,0.0,no_ticket,0,0.0
100108,19/11/2023,C0008,Smart Home,NordPlug,$24.89,1,Paid,2023-11-19,24.89,USD,22.8988,1,22.8988,0,0.0,,0,0.0,no_ticket,0,0.0
100690,2023-12-06,C0003,Smart Home,NordLock Pro,$192.91,1,Paid,2023-12-06,192.91,USD,177.4772,1,177.4772,0,0.0,,0,0.0,no_ticket,0,0.0
100986,2023-12-11,C0178,Accessories,Charger,45.19,4,Paid,2023-12-11,45.19,EUR,45.19,4,180.76,0,0.0,,1,0.0,delivery,0,0.0
100747,07/12/2023,C0006,Accessories,Screen Protector,$11.32,4,Paid,2023-12-07,11.32,USD,10.4144,4,41.6576,0,0.0,,0,0.0,no_ticket,0,0.0
101059,2023-12-13,C0002,Smart Home,NordLock Pro,202.54,1,Paid,2023-12-13,202.54,EUR,202.54,1,202.54,0,0.0,,0,0.0,no_ticket,0,0.0
101184,2023-11-28,C0001,Smart Home,NordLock Pro,210.88,1,Paid,2023-11-28,210.88,EUR,210.88,1,210.88,0,0.0,,0,0.0,no_ticket,0,0.0
100165,22/11/2023,C0001,Electronics,Smartphone Z,$771.06,1,Paid,2023-11-22,771.06,USD,709.3752,1,709.3752,0,0.0,,0,0.0,no_ticket,0,0.0
100779,2023-12-07,C0001,Electronics,TV Pro,916.41,1,Paid,2023-12-07,916.41,EUR,916.41,1,916.41,0,0.0,,0,0.0,no_ticket,0,0.0
100039,2023-11-16,C0003,Accessories,Accessory Bundle,"91,93 EUR",2,Paid,2023-11-16,91.93,EUR,91.93,2,183.86,0,0.0,,0,0.0,no_ticket,0,0.0
100149,2023-11-21,C0001,Electronics,Tablet A,"475,44 EUR",1,Paid,2023-11-21,475.44,EUR,475.44,1,475.44,0,0.0,,0,0.0,no_ticket,0,0.0
100068,17/11/2023,C0004,Accessories,Accessory Bundle,84.63,2,Paid,2023-11-17,84.63,EUR,84.63,2,169.26,0,0.0,,0,0.0,no_ticket,0,0.0
100260,2023-11-25,C0003,Electronics,Smartphone Z,"706,61 EUR",2,Paid,2023-11-25,706.61,EUR,706.61,2,1413.22,0,0.0,,0,0.0,no_ticket,0,0.0
100558,03/12/2023,C0008,Electronics,Tablet A,$356.42,1,Paid,2023-12-03,356.42,USD,327.9064,1,327.9064,0,0.0,,0,0.0,no_ticket,0,0.0
100184,22/11/2023,C0028,Smart Home,NordLock Pro,"210,27 EUR",2,Paid,2023-11-22,210.27,EUR,210.27,2,420.54,0,0.0,,0,0.0,no_ticket,0,0.0
101079,13/12/2023,C0003,Accessories,Charger,"40,81 EUR",1,Paid,2023-12-13,40.81,EUR,40.81,1,40.81,0,0.0,,0,0.0,no_ticket,0,0.0
101094,2023-12-14,C0030,Electronics,Laptop X,"1326,30 EUR",2,Paid,2023-12-14,1326.3,EUR,1326.3,2,2652.6,0,0.0,,3,-1.0,defect_quality,0,0.0
100944,2023-12-11,C0289,Electronics,NoiseCancel Headphones,157.39,1,Paid,2023-12-11,157.39,EUR,157.39,1,157.39,0,0.0,,0,0.0,no_ticket,0,0.0
100054,2023-11-17,C0011,Electronics,Laptop X,"1 798,82 EUR",1,Paid,2023-11-17,798.82,EUR,798.82,1,798.82,0,0.0,,0,0.0,no_ticket,0,0.0
100617,2023-12-04,C0002,Electronics,Tablet A,$351.21,1,Paid,2023-12-04,351.21,USD,323.1132,1,323.1132,0,0.0,,0,0.0,no_ticket,0,0.0
100136,20/11/2023,C0256,Smart Home,NordTherm,85,2,Paid,2023-11-20,85.0,EUR,85.0,2,170.0,0,0.0,,0,0.0,no_ticket,0,0.0
100974,2023-12-11,C0031,Accessories,Accessory Bundle,68.13,3,Paid,2023-12-11,68.13,EUR,68.13,3,204.39,0,0.0,,2,-1.5,defect_quality,0,0.0
100955,2023-12-11,C0002,Accessories,Screen Protector,"5,43 EUR",1,Paid,2023-12-11,5.43,EUR,5.43,1,5.43,0,0.0,,0,0.0,no_ticket,0,0.0
100221,2023-11-24,C0001,Electronics,TV Pro,"1 386,66 EUR",1,Paid,2023-11-24,386.66,EUR,386.66,1,386.66,0,0.0,,0,0.0,no_ticket,0,0.0
101060,2023-12-13,C0001,Electronics,TV Pro,1293.65,1,Paid,2023-12-13,1293.65,EUR,1293.65,1,1293.65,0,0.0,,0,0.0,no_ticket,0,0.0
100726,2023-12-06,C0001,Electronics,NoiseCancel Headphones,$302.52,1,Paid,2023-12-06,302.52,USD,278.3184,1,278.3184,0,0.0,,0,0.0,no_ticket,0,0.0
101151,2023-12-11,C0007,Accessories,Accessory Bundle,"44,45 EUR",1,Paid,2023-12-11,44.45,EUR,44.45,1,44.45,0,0.0,,0,0.0,no_ticket,0,0.0
100861,2023-12-09,C0046,Smart Home,NordLock Pro,201,1,Paid,2023-12-09,201.0,EUR,201.0,1,201.0,0,0.0,,2,-1.5,defect_quality,0,0.0
100329,2023-11-27,C0001,Accessories,Phone Case,"12,21 EUR",2,Paid,2023-11-27,12.21,EUR,12.21,2,24.42,0,0.0,,0,0.0,no_ticket,0,0.0
100835,08/12/2023,C0023,Electronics,Laptop X,"1 517,20 EUR",1,Paid,2023-12-08,517.2,EUR,517.2,1,517.2,0,0.0,,0,0.0,no_ticket,0,0.0
100312,26/11/2023,C0148,Electronics,Laptop X,$1691.90,1,Paid,2023-11-26,1691.9,USD,1556.5480000000002,1,1556.5480000000002,0,0.0,,0,0.0,no_ticket,0,0.0
100377,2023-11-28,C0009,Accessories,USB-C Cable,"19,51 EUR",1,Paid,2023-11-28,19.51,EUR,19.51,1,19.51,0,0.0,,0,0.0,no_ticket,0,0.0
100639,04/12/2023,C0042,Smart Home,NordLock Pro,"223,67 EUR",2,Paid,2023-12-04,223.67,EUR,223.67,2,447.34,0,0.0,,0,0.0,no_ticket,0,0.0
101098,2023-12-14,C0001,Accessories,Charger,"22,04 EUR",1,Paid,2023-12-14,22.04,EUR,22.04,1,22.04,0,0.0,,0,0.0,no_ticket,0,0.0
100173,22/11/2023,C0008,Electronics,Smartphone Z,"1043,81 EUR",1,Paid,2023-11-22,1043.81,EUR,1043.81,1,1043.81,0,0.0,,0,0.0,no_ticket,0,0.0
100883,2023-12-09,C0002,Electronics,Laptop X,1389.38,1,Paid,2023-12-09,1389.38,EUR,1389.38,1,1389.38,0,0.0,,0,0.0,no_ticket,0,0.0
100560,03/12/2023,C0196,Electronics,Smartphone Z,$840.55,1,Paid,2023-12-03,840.55,USD,773.306,1,773.306,0,0.0,,0,0.0,no_ticket,0,0.0
100289,2023-11-25,C0005,Smart Home,NordLock Pro,249.63,2,Paid,2023-11-25,249.63,EUR,249.63,2,499.26,0,0.0,,0,0.0,no_ticket,0,0.0
100294,25/11/2023,C0002,Accessories,USB-C Cable,13.57,2,Paid,2023-11-25,13.57,EUR,13.57,2,27.14,0,0.0,,0,0.0,no_ticket,0,0.0
100435,2023-11-29,C0008,Accessories,Screen Protector,8.41,3,Paid,2023-11-29,8.41,EUR,8.41,3,25.23,0,0.0,,0,0.0,no_ticket,0,0.0
101154,2023-12-11,C0015,Smart Home,NordLock Pro,"241,95 EUR",1,Paid,2023-12-11,241.95,EUR,241.95,1,241.95,0,0.0,,0,0.0,no_ticket,0,0.0
100666,05/12/2023,C0001,Accessories,Laptop Sleeve,22.57,4,Paid,2023-12-05,22.57,EUR,22.57,4,90.28,0,0.0,,0,0.0,no_ticket,0,0.0
100270,25/11/2023,C0031,Accessories,Laptop Sleeve,$17.02,2,Paid,2023-11-25,17.02,USD,15.6584,2,31.3168,0,0.0,,0,0.0,no_ticket,0,0.0
101087,2023-12-14,C0009,Electronics,Tablet A,484.26,1,Paid,2023-12-14,484.26,EUR,484.26,1,484.26,0,0.0,,0,0.0,no_ticket,0,0.0
100321,2023-11-27,C0004,Accessories,Accessory Bundle,"51,76 EUR",1,Paid,2023-11-27,51.76,EUR,51.76,1,51.76,0,0.0,,0,0.0,no_ticket,0,0.0
100462,2023-11-30,C0009,Electronics,Laptop X,"1389,57 EUR",1,Paid,2023-11-30,1389.57,EUR,1389.57,1,1389.57,0,0.0,,0,0.0,no_ticket,0,0.0
100370,2023-11-28,C0217,Accessories,USB-C Cable,"19,89 EUR",2,Failed,2023-11-28,19.89,EUR,19.89,2,39.78,0,0.0,,0,0.0,no_ticket,0,0.0
100218,2023-11-23,C0004,Electronics,Smartphone Z,"989,29 EUR",2,Paid,2023-11-23,989.29,EUR,989.29,2,1978.58,0,0.0,,0,0.0,no_ticket,0,0.0
100083,18/11/2023,C0002,Smart Home,NordLock Pro,215,1,Paid,2023-11-18,215.0,EUR,215.0,1,215.0,0,0.0,,0,0.0,no_ticket,0,0.0
100273,2023-11-25,C0002,Electronics,Laptop X,"1374,89 EUR",1,Paid,2023-11-25,1374.89,EUR,1374.89,1,1374.89,0,0.0,,0,0.0,no_ticket,0,0.0
100637,2023-12-04,C0003,Electronics,Smartphone Z,713,1,Paid,2023-12-04,713.0,EUR,713.0,1,713.0,0,0.0,,0,0.0,no_ticket,0,0.0
101103,2023-12-14,C0103,Accessories,Accessory Bundle,63.95,1,Paid,2023-12-14,63.95,EUR,63.95,1,63.95,0,0.0,,2,-1.5,defect_quality,0,0.0
100178,2023-11-22,C0025,Electronics,NoiseCancel Headphones,"252,35 EUR",1,Paid,2023-11-22,252.35,EUR,252.35,1,252.35,0,0.0,,0,0.0,no_ticket,0,0.0
100593,2023-12-03,C0297,Accessories,Laptop Sleeve,27.83,1,Paid,2023-12-03,27.83,EUR,27.83,1,27.83,0,0.0,,0,0.0,no_ticket,0,0.0
100410,2023-11-29,C0026,Accessories,Accessory Bundle,"35,78 EUR",1,Pending,2023-11-29,35.78,EUR,35.78,1,35.78,0,0.0,,0,0.0,no_ticket,0,0.0
100401,2023-11-29,C0017,Accessories,Phone Case,10,1,Paid,2023-11-29,10.0,EUR,10.0,1,10.0,0,0.0,,0,0.0,no_ticket,0,0.0
100438,2023-11-30,C0010,Accessories,Charger,$20.58,1,Paid,2023-11-30,20.58,USD,18.9336,1,18.9336,0,0.0,,0,0.0,no_ticket,0,0.0
100600,04/12/2023,C0043,Accessories,Phone Case,"32,88 EUR",1,Paid,2023-12-04,32.88,EUR,32.88,1,32.88,0,0.0,,0,0.0,no_ticket,0,0.0
100753,2023-12-07,C0040,Electronics,Tablet A,"436,32 EUR",1,Paid,2023-12-07,436.32,EUR,436.32,1,436.32,0,0.0,,1,0.0,defect_quality,0,0.0
100765,2023-12-07,C0080,Electronics,Laptop X,"1361,87 EUR",1,Paid,2023-12-07,1361.87,EUR,1361.87,1,1361.87,0,0.0,,0,0.0,no_ticket,0,0.0
100782,2023-12-07,C0001,Smart Home,NordLock Pro,201,2,Paid,2023-12-07,201.0,EUR,201.0,2,402.0,0,0.0,,0,0.0,no_ticket,0,0.0
101064,13/12/2023,C0002,Accessories,Phone Case,16.39,3,Paid,2023-12-13,16.39,EUR,16.39,3,49.17,0,0.0,,0,0.0,no_ticket,0,0.0
100477,30/11/2023,C0001,Smart Home,NordLock Pro,$195.76,1,Pending,2023-11-30,195.76,USD,180.0992,1,180.0992,0,0.0,,0,0.0,no_ticket,0,0.0
100936,2023-12-11,C0151,Electronics,TV Pro,"1641,80 EUR",1,Paid,2023-12-11,1641.8,EUR,1641.8,1,1641.8,0,0.0,,2,0.0,delivery,0,0.0
100489,2023-12-01,C0015,Electronics,Tablet A,559,2,Paid,2023-12-01,559.0,EUR,559.0,2,1118.0,0,0.0,,0,0.0,no_ticket,0,0.0
100238,2023-11-24,C0270,Accessories,USB-C Cable,17,1,Paid,2023-11-24,17.0,EUR,17.0,1,17.0,0,0.0,,0,0.0,no_ticket,0,0.0
100026,16/11/2023,C0091,Electronics,NoiseCancel Headphones,"192,39 EUR",1,Paid,2023-11-16,192.39,EUR,192.39,1,192.39,0,0.0,,0,0.0,no_ticket,0,0.0
100244,2023-11-24,C0002,Electronics,NoiseCancel Headphones,229.51,1,Paid,2023-11-24,229.51,EUR,229.51,1,229.51,0,0.0,,0,0.0,no_ticket,0,0.0
100828,2023-12-08,C0001,Accessories,Screen Protector,"13,81 EUR",2,Paid,2023-12-08,13.81,EUR,13.81,2,27.62,0,0.0,,0,0.0,no_ticket,0,0.0
100976,2023-12-11,C0008,Electronics,Tablet A,"365,96 EUR",1,Paid,2023-12-11,365.96,EUR,365.96,1,365.96,0,0.0,,1,-2.0,defect_quality,0,0.0
100427,2023-11-29,C0001,Electronics,TV Pro,"1187,16 EUR",1,Paid,2023-11-29,1187.16,EUR,1187.16,1,1187.16,0,0.0,,0,0.0,no_ticket,0,0.0
100023,16/11/2023,C0016,Accessories,Accessory Bundle,30.78,1,Paid,2023-11-16,30.78,EUR,30.78,1,30.78,0,0.0,,0,0.0,no_ticket,0,0.0
100256,2023-11-24,C0002,Smart Home,NordLock Pro,$235.74,1,Paid,2023-11-24,235.74,USD,216.88080000000002,1,216.88080000000002,0,0.0,,0,0.0,no_ticket,0,0.0
100293,2023-11-25,C0001,Accessories,Charger,$40.76,1,Paid,2023-11-25,40.76,USD,37.4992,1,37.4992,0,0.0,,0,0.0,no_ticket,0,0.0
100811,2023-12-08,C0008,Electronics,NoiseCancel Headphones,"161,34 EUR",1,Paid,2023-12-08,161.34,EUR,161.34,1,161.34,0,0.0,,0,0.0,no_ticket,0,0.0
100295,2023-11-25,C0001,Electronics,Smartphone Z,"789,49 EUR",1,Paid,2023-11-25,789.49,EUR,789.49,1,789.49,0,0.0,,0,0.0,no_ticket,0,0.0
100785,2023-12-07,C0034,Electronics,Smartphone Z,"1072,68 EUR",1,Paid,2023-12-07,1072.68,EUR,1072.68,1,1072.68,0,0.0,,0,0.0,no_ticket,0,0.0
100122,2023-11-20,C0113,Accessories,Phone Case,33.56,1,Paid,2023-11-20,33.56,EUR,33.56,1,33.56,0,0.0,,1,-2.0,defect_quality,0,0.0
100807,2023-12-08,C0007,Accessories,USB-C Cable,"12,72 EUR",1,Paid,2023-12-08,12.72,EUR,12.72,1,12.72,0,0.0,,0,0.0,no_ticket,0,0.0
100953,2023-12-11,C0015,Smart Home,NordLock Pro,"241,95 EUR",1,Paid,2023-12-11,241.95,EUR,241.95,1,241.95,0,0.0,,0,0.0,no_ticket,0,0.0
101084,2023-12-13,C0225,Accessories,Laptop Sleeve,$20.38,2,Paid,2023-12-13,20.38,USD,18.7496,2,37.4992,0,0.0,,0,0.0,no_ticket,0,0.0
100317,2023-11-27,C0001,Electronics,Smartphone Z,"724,77 EUR",1,Paid,2023-11-27,724.77,EUR,724.77,1,724.77,0,0.0,,0,0.0,no_ticket,0,0.0
100679,05/12/2023,C0001,Smart Home,NordLock Pro,197.29,1,Pending,2023-12-05,197.29,EUR,197.29,1,197.29,0,0.0,,0,0.0,no_ticket,0,0.0
100503,2023-12-01,C0122,Smart Home,NordLock Pro,207.18,1,Paid,2023-12-01,207.18,EUR,207.18,1,207.18,0,0.0,,6,-0.8333333333333334,refund_return,0,0.0
100190,2023-11-22,C0215,Electronics,Smartphone Z,"846,71 EUR",2,Paid,2023-11-22,846.71,EUR,846.71,2,1693.42,0,0.0,,0,0.0,no_ticket,0,0.0
100763,07/12/2023,C0001,Accessories,USB-C Cable,"16,94 EUR",1,Paid,2023-12-07,16.94,EUR,16.94,1,16.94,0,0.0,,0,0.0,no_ticket,0,0.0
100171,2023-11-22,C0090,Accessories,Charger,$28.87,4,Paid,2023-11-22,28.87,USD,26.5604,4,106.2416,0,0.0,,1,-1.0,defect_quality,0,0.0
100155,21/11/2023,C0003,Electronics,TV Pro,"1019,81 EUR",1,Paid,2023-11-21,1019.81,EUR,1019.81,1,1019.81,0,0.0,,0,0.0,no_ticket,0,0.0
100177,22/11/2023,C0002,Electronics,NoiseCancel Headphones,309,1,Paid,2023-11-22,309.0,EUR,309.0,1,309.0,0,0.0,,0,0.0,no_ticket,0,0.0
100350,2023-11-27,C0038,Accessories,Charger,$34.12,2,Paid,2023-11-27,34.12,USD,31.3904,2,62.7808,0,0.0,,1,1.0,app_connectivity,0,0.0
100991,2023-12-12,C0107,Electronics,Tablet A,$427.39,1,Failed,2023-12-12,427.39,USD,393.1988,1,393.1988,0,0.0,,0,0.0,no_ticket,0,0.0
101066,2023-12-13,C0007,Electronics,NoiseCancel Headphones,258.62,1,Pending,2023-12-13,258.62,EUR,258.62,1,258.62,0,0.0,,0,0.0,no_ticket,0,0.0
100583,2023-12-03,C0001,Electronics,TV Pro,"1181,73 EUR",1,Paid,2023-12-03,1181.73,EUR,1181.73,1,1181.73,0,0.0,,0,0.0,no_ticket,0,0.0
101191,2023-11-15,C0002,Electronics,Tablet A,"488,25 EUR",1,Paid,2023-11-15,488.25,EUR,488.25,1,488.25,0,0.0,,0,0.0,no_ticket,0,0.0
101035,2023-12-12,C0001,Smart Home,NordLock Pro,"195,28 EUR",2,Paid,2023-12-12,195.28,EUR,195.28,2,390.56,0,0.0,,1,0.0,delivery,0,0.0
100578,2023-12-03,C0012,Accessories,Wireless Mouse,"51,21 EUR",1,Pending,2023-12-03,51.21,EUR,51.21,1,51.21,0,0.0,,0,0.0,no_ticket,0,0.0
101031,12/12/2023,C0020,Smart Home,NordLock Pro,"205,55 EUR",1,Paid,2023-12-12,205.55,EUR,205.55,1,205.55,0,0.0,,0,0.0,no_ticket,0,0.0
100524,2023-12-02,C0104,Accessories,Wireless Mouse,"18,15 EUR",1,Paid,2023-12-02,18.15,EUR,18.15,1,18.15,0,0.0,,0,0.0,no_ticket,0,0.0
100777,2023-12-07,C0206,Accessories,Phone Case,"16,43 EUR",1,Paid,2023-12-07,16.43,EUR,16.43,1,16.43,0,0.0,,0,0.0,no_ticket,0,0.0
101175,2023-12-07,C0004,Electronics,Smartphone Z,"893,14 EUR",1,Paid,2023-12-07,893.14,EUR,893.14,1,893.14,0,0.0,,0,0.0,no_ticket,0,0.0
100607,2023-12-04,C0054,Electronics,Laptop X,1698.65,1,Paid,2023-12-04,1698.65,EUR,1698.65,1,1698.65,0,0.0,,1,-2.0,refund_return,0,0.0
100983,2023-12-11,C0038,Accessories,Laptop Sleeve,"38,52 EUR",2,Paid,2023-12-11,38.52,EUR,38.52,2,77.04,0,0.0,,0,0.0,no_ticket,0,0.0
100562,03/12/2023,C0142,Accessories,USB-C Cable,"17,33 EUR",1,Paid,2023-12-03,17.33,EUR,17.33,1,17.33,0,0.0,,0,0.0,no_ticket,0,0.0
100842,2023-12-08,C0007,Electronics,Laptop X,"1714,94 EUR",1,Paid,2023-12-08,1714.94,EUR,1714.94,1,1714.94,1,1714.94,Processed,0,0.0,no_ticket,1,1.0
101187,2023-11-29,C0017,Smart Home,NordTherm,"83,85 EUR",1,Paid,2023-11-29,83.85,EUR,83.85,1,83.85,0,0.0,,0,0.0,no_ticket,0,0.0
100630,2023-12-04,C0069,Accessories,Wireless Mouse,13.89,1,Paid,2023-12-04,13.89,EUR,13.89,1,13.89,0,0.0,,1,0.0,app_connectivity,0,0.0
100898,2023-12-10,C0001,Smart Home,NordLock Pro,"241,97 EUR",1,Paid,2023-12-10,241.97,EUR,241.97,1,241.97,0,0.0,,0,0.0,no_ticket,0,0.0
100067,2023-11-17,C0003,Accessories,Wireless Mouse,56.08,1,Paid,2023-11-17,56.08,EUR,56.08,1,56.08,1,56.08,Processed,0,0.0,no_ticket,1,1.0
100714,06/12/2023,C0001,Accessories,Screen Protector,12.92,1,Paid,2023-12-06,12.92,EUR,12.92,1,12.92,0,0.0,,0,0.0,no_ticket,0,0.0
100182,2023-11-22,C0001,Electronics,TV Pro,$1046.88,1,Failed,2023-11-22,1046.88,USD,963.1296000000001,1,963.1296000000001,0,0.0,,0,0.0,no_ticket,0,0.0
100958,2023-12-11,C0001,Accessories,Charger,43,3,Paid,2023-12-11,43.0,EUR,43.0,3,129.0,0,0.0,,0,0.0,no_ticket,0,0.0
100696,2023-12-06,C0135,Smart Home,NordLock Pro,225,2,Paid,2023-12-06,225.0,EUR,225.0,2,450.0,0,0.0,,3,-1.3333333333333333,defect_quality,0,0.0
100334,2023-11-27,C0005,Electronics,Tablet A,322.05,1,Paid,2023-11-27,322.05,EUR,322.05,1,322.05,0,0.0,,0,0.0,no_ticket,0,0.0
100938,11/12/2023,C0014,Electronics,Smartphone Z,"782,74 EUR",1,Failed,2023-12-11,782.74,EUR,782.74,1,782.74,0,0.0,,0,0.0,no_ticket,0,0.0
100733,2023-12-06,C0050,Accessories,Charger,48.23,3,Paid,2023-12-06,48.23,EUR,48.23,3,144.69,0,0.0,,0,0.0,no_ticket,0,0.0
100913,2023-12-10,C0001,Accessories,Wireless Mouse,"19,15 EUR",1,Paid,2023-12-10,19.15,EUR,19.15,1,19.15,0,0.0,,1,0.0,defect_quality,0,0.0
100644,2023-12-04,C0301,Accessories,USB-C Cable,"9,53 EUR",2,Paid,2023-12-04,9.53,EUR,9.53,2,19.06,0,0.0,,3,-1.0,app_connectivity,0,0.0
100541,2023-12-02,C0020,Accessories,Wireless Mouse,"58,32 EUR",1,Paid,2023-12-02,58.32,EUR,58.32,1,58.32,0,0.0,,0,0.0,no_ticket,0,0.0
100621,04/12/2023,C0003,Electronics,Laptop X,"1 776,33 EUR",1,Paid,2023-12-04,776.33,EUR,776.33,1,776.33,0,0.0,,0,0.0,no_ticket,0,0.0
100577,2023-12-03,C0002,Smart Home,NordLock Pro,$213.50,2,Paid,2023-12-03,213.5,USD,196.42000000000002,2,392.84000000000003,1,427.0,Processed,0,0.0,no_ticket,1,1.0869565217391304
100045,2023-11-17,C0115,Electronics,TV Pro,1532.19,1,Paid,2023-11-17,1532.19,EUR,1532.19,1,1532.19,0,0.0,,0,0.0,no_ticket,0,0.0
100080,18/11/2023,C0002,Accessories,Accessory Bundle,"35,86 EUR",2,Paid,2023-11-18,35.86,EUR,35.86,2,71.72,0,0.0,,0,0.0,no_ticket,0,0.0
100911,2023-12-10,C0003,Electronics,NoiseCancel Headphones,254.21,1,Paid,2023-12-10,254.21,EUR,254.21,1,254.21,0,0.0,,0,0.0,no_ticket,0,0.0
100820,2023-12-08,C0001,Accessories,Accessory Bundle,61.58,3,Failed,2023-12-08,61.58,EUR,61.58,3,184.74,0,0.0,,0,0.0,no_ticket,0,0.0
100990,2023-12-12,C0157,Electronics,NoiseCancel Headphones,"328,41 EUR",2,Paid,2023-12-12,328.41,EUR,328.41,2,656.82,0,0.0,,1,1.0,delivery,0,0.0
100634,04/12/2023,C0002,Electronics,Smartphone Z,"810,82 EUR",1,Paid,2023-12-04,810.82,EUR,810.82,1,810.82,0,0.0,,0,0.0,no_ticket,0,0.0
100118,2023-11-19,C0068,Accessories,Laptop Sleeve,38,1,Paid,2023-11-19,38.0,EUR,38.0,1,38.0,0,0.0,,0,0.0,no_ticket,0,0.0
100906,10/12/2023,C0048,Electronics,NoiseCancel Headphones,$158.01,1,Paid,2023-12-10,158.01,USD,145.3692,1,145.3692,0,0.0,,0,0.0,no_ticket,0,0.0
100332,2023-11-27,C0002,Electronics,Laptop X,1608.06,1,Paid,2023-11-27,1608.06,EUR,1608.06,1,1608.06,0,0.0,,0,0.0,no_ticket,0,0.0
101117,2023-12-14,C0018,Accessories,Charger,27,2,Paid,2023-12-14,27.0,EUR,27.0,2,54.0,0,0.0,,0,0.0,no_ticket,0,0.0
100755,2023-12-07,C0003,Accessories,Accessory Bundle,76.30,2,Paid,2023-12-07,76.3,EUR,76.3,2,152.6,0,0.0,,0,0.0,no_ticket,0,0.0
100483,2023-12-01,C0001,Smart Home,NordLock Pro,"216,17 EUR",1,Paid,2023-12-01,216.17,EUR,216.17,1,216.17,0,0.0,,0,0.0,no_ticket,0,0.0
100047,2023-11-17,C0006,Smart Home,NordLock Pro,208.67,1,Paid,2023-11-17,208.67,EUR,208.67,1,208.67,0,0.0,,0,0.0,no_ticket,0,0.0
100605,2023-12-04,C0013,Smart Home,NordTherm,"142,49 EUR",1,Paid,2023-12-04,142.49,EUR,142.49,1,142.49,0,0.0,,0,0.0,no_ticket,0,0.0
100124,2023-11-20,C0004,Electronics,NoiseCancel Headphones,"233,73 EUR",1,Paid,2023-11-20,233.73,EUR,233.73,1,233.73,0,0.0,,0,0.0,no_ticket,0,0.0
100240,2023-11-24,C0018,Accessories,USB-C Cable,"13,43 EUR",2,Paid,2023-11-24,13.43,EUR,13.43,2,26.86,0,0.0,,1,-1.0,delivery,0,0.0
100027,16/11/2023,C0004,Electronics,NoiseCancel Headphones,170.89,1,Paid,2023-11-16,170.89,EUR,170.89,1,170.89,0,0.0,,0,0.0,no_ticket,0,0.0
101168,28/11/2023,C0004,Smart Home,NordLock Pro,"246,71 EUR",1,Paid,2023-11-28,246.71,EUR,246.71,1,246.71,0,0.0,,0,0.0,no_ticket,0,0.0
100057,2023-11-17,C0061,Electronics,TV Pro,1046.02,1,Paid,2023-11-17,1046.02,EUR,1046.02,1,1046.02,0,0.0,,0,0.0,no_ticket,0,0.0
101072,2023-12-13,C0001,Smart Home,NordLock Pro,212.32,1,Paid,2023-12-13,212.32,EUR,212.32,1,212.32,0,0.0,,0,0.0,no_ticket,0,0.0
100709,2023-12-06,C0001,Accessories,Wireless Mouse,54.54,3,Paid,2023-12-06,54.54,EUR,54.54,3,163.62,0,0.0,,0,0.0,no_ticket,0,0.0
101045,2023-12-13,C0027,Smart Home,NordPlug,"32,53 EUR",2,Paid,2023-12-13,32.53,EUR,32.53,2,65.06,0,0.0,,0,0.0,no_ticket,0,0.0
100379,2023-11-28,C0001,Accessories,Accessory Bundle,67.03,2,Paid,2023-11-28,67.03,EUR,67.03,2,134.06,0,0.0,,0,0.0,no_ticket,0,0.0
100316,2023-11-26,C0002,Electronics,Tablet A,597.79,1,Paid,2023-11-26,597.79,EUR,597.79,1,597.79,0,0.0,,0,0.0,no_ticket,0,0.0
100907,10/12/2023,C0005,Electronics,TV Pro,"1352,21 EUR",1,Paid,2023-12-10,1352.21,EUR,1352.21,1,1352.21,0,0.0,,0,0.0,no_ticket,0,0.0
100180,2023-11-22,C0006,Electronics,NoiseCancel Headphones,"228,54 EUR",1,Paid,2023-11-22,228.54,EUR,228.54,1,228.54,0,0.0,,0,0.0,no_ticket,0,0.0
101018,12/12/2023,C0002,Accessories,USB-C Cable,15.31,2,Paid,2023-12-12,15.31,EUR,15.31,2,30.62,0,0.0,,0,0.0,no_ticket,0,0.0
101088,2023-12-14,C0006,Accessories,USB-C Cable,"14,75 EUR",1,Paid,2023-12-14,14.75,EUR,14.75,1,14.75,0,0.0,,1,-2.0,defect_quality,0,0.0
100515,02/12/2023,C0243,Electronics,Tablet A,533,1,Paid,2023-12-02,533.0,EUR,533.0,1,533.0,0,0.0,,0,0.0,no_ticket,0,0.0
100693,2023-12-06,C0001,Accessories,Laptop Sleeve,26.83,2,Paid,2023-12-06,26.83,EUR,26.83,2,53.66,0,0.0,,0,0.0,no_ticket,0,0.0
100682,2023-12-05,C0223,Accessories,Screen Protector,"7,50 EUR",2,Paid,2023-12-05,7.5,EUR,7.5,2,15.0,0,0.0,,2,-2.5,defect_quality,0,0.0
101037,2023-12-12,C0003,Electronics,NoiseCancel Headphones,"308,13 EUR",1,Paid,2023-12-12,308.13,EUR,308.13,1,308.13,1,308.13,Processed,0,0.0,no_ticket,1,1.0
100106,19/11/2023,C0020,Accessories,USB-C Cable,14.99,2,Paid,2023-11-19,14.99,EUR,14.99,2,29.98,0,0.0,,0,0.0,no_ticket,0,0.0
100786,2023-12-07,C0112,Smart Home,NordLock Pro,"245,31 EUR",1,Paid,2023-12-07,245.31,EUR,245.31,1,245.31,1,245.31,Processed,1,0.0,app_connectivity,1,1.0
100915,2023-12-10,C0028,Accessories,USB-C Cable,"15,71 EUR",1,Failed,2023-12-10,15.71,EUR,15.71,1,15.71,0,0.0,,0,0.0,no_ticket,0,0.0
100821,08/12/2023,C0001,Accessories,Screen Protector,"6,18 EUR",1,Paid,2023-12-08,6.18,EUR,6.18,1,6.18,0,0.0,,0,0.0,no_ticket,0,0.0
100268,2023-11-25,C0005,Electronics,TV Pro,1187.59,1,Pending,2023-11-25,1187.59,EUR,1187.59,1,1187.59,0,0.0,,0,0.0,no_ticket,0,0.0
101148,27/11/2023,C0220,Accessories,Phone Case,"31,01 EUR",4,Paid,2023-11-27,31.01,EUR,31.01,4,124.04,0,0.0,,0,0.0,no_ticket,0,0.0
100789,2023-12-07,C0030,Electronics,Laptop X,1363,1,Paid,2023-12-07,1363.0,EUR,1363.0,1,1363.0,0,0.0,,0,0.0,no_ticket,0,0.0
100967,2023-12-11,C0002,Accessories,Screen Protector,"14,65 EUR",2,Pending,2023-12-11,14.65,EUR,14.65,2,29.3,0,0.0,,0,0.0,no_ticket,0,0.0
100448,30/11/2023,C0001,Accessories,Screen Protector,13.04,2,Paid,2023-11-30,13.04,EUR,13.04,2,26.08,0,0.0,,0,0.0,no_ticket,0,0.0
100041,2023-11-16,C0007,Accessories,Accessory Bundle,"96,52 EUR",1,Paid,2023-11-16,96.52,EUR,96.52,1,96.52,0,0.0,,0,0.0,no_ticket,0,0.0
100533,2023-12-02,C0034,Accessories,Laptop Sleeve,"32,30 EUR",3,Paid,2023-12-02,32.3,EUR,32.3,3,96.89999999999999,0,0.0,,0,0.0,no_ticket,0,0.0
100301,2023-11-26,C0046,Accessories,Charger,15.37,1,Paid,2023-11-26,15.37,EUR,15.37,1,15.37,1,15.37,Processed,0,0.0,no_ticket,1,1.0
100434,2023-11-29,C0005,Electronics,NoiseCancel Headphones,$344.00,1,Paid,2023-11-29,344.0,USD,316.48,1,316.48,0,0.0,,0,0.0,no_ticket,0,0.0
100802,2023-12-08,C0183,Smart Home,NordLock Pro,"200,86 EUR",1,Paid,2023-12-08,200.86,EUR,200.86,1,200.86,1,200.86,Processed,1,-1.0,defect_quality,1,1.0
101126,14/12/2023,C0001,Smart Home,NordLock Pro,"206,17 EUR",1,Paid,2023-12-14,206.17,EUR,206.17,1,206.17,0,0.0,,0,0.0,no_ticket,0,0.0
100269,2023-11-25,C0070,Electronics,Laptop X,"1466,72 EUR",1,Pending,2023-11-25,1466.72,EUR,1466.72,1,1466.72,0,0.0,,0,0.0,no_ticket,0,0.0
100619,04/12/2023,C0001,Electronics,TV Pro,1574.14,1,Paid,2023-12-04,1574.14,EUR,1574.14,1,1574.14,0,0.0,,0,0.0,no_ticket,0,0.0
100633,2023-12-04,C0040,Accessories,USB-C Cable,13,3,Paid,2023-12-04,13.0,EUR,13.0,3,39.0,0,0.0,,0,0.0,no_ticket,0,0.0
101029,2023-12-12,C0001,Accessories,Laptop Sleeve,"37,26 EUR",2,Paid,2023-12-12,37.26,EUR,37.26,2,74.52,0,0.0,,0,0.0,no_ticket,0,0.0
101081,2023-12-13,C0004,Smart Home,NordPlug,$21.26,1,Paid,2023-12-13,21.26,USD,19.5592,1,19.5592,0,0.0,,0,0.0,no_ticket,0,0.0
100297,26/11/2023,C0015,Smart Home,NordLock Pro,248,1,Paid,2023-11-26,248.0,EUR,248.0,1,248.0,0,0.0,,0,0.0,no_ticket,0,0.0
101155,08/12/2023,C0042,Electronics,Laptop X,1620.72,1,Paid,2023-12-08,1620.72,EUR,1620.72,1,1620.72,0,0.0,,0,0.0,no_ticket,0,0.0
100703,06/12/2023,C0001,Smart Home,NordLock Pro,225.82,1,Paid,2023-12-06,225.82,EUR,225.82,1,225.82,0,0.0,,0,0.0,no_ticket,0,0.0
100594,2023-12-03,C0147,Electronics,Tablet A,"724,89 EUR",1,Paid,2023-12-03,724.89,EUR,724.89,1,724.89,0,0.0,,1,0.0,app_connectivity,0,0.0
100971,2023-12-11,C0002,Electronics,TV Pro,1667.73,1,Paid,2023-12-11,1667.73,EUR,1667.73,1,1667.73,0,0.0,,0,0.0,no_ticket,0,0.0
100299,2023-11-26,C0018,Electronics,NoiseCancel Headphones,281.50,1,Paid,2023-11-26,281.5,EUR,281.5,1,281.5,0,0.0,,0,0.0,no_ticket,0,0.0
101095,2023-12-14,C0002,Smart Home,NordLock Pro,"238,51 EUR",1,Paid,2023-12-14,238.51,EUR,238.51,1,238.51,0,0.0,,0,0.0,no_ticket,0,0.0
100905,2023-12-10,C0311,Electronics,TV Pro,1080,1,Paid,2023-12-10,1080.0,EUR,1080.0,1,1080.0,0,0.0,,0,0.0,no_ticket,0,0.0
100208,23/11/2023,C0002,Accessories,USB-C Cable,$11.04,1,Paid,2023-11-23,11.04,USD,10.1568,1,10.1568,0,0.0,,0,0.0,no_ticket,0,0.0
100704,06/12/2023,C0010,Smart Home,NordLock Pro,241,1,Paid,2023-12-06,241.0,EUR,241.0,1,241.0,0,0.0,,0,0.0,no_ticket,0,0.0
100896,2023-12-10,C0001,Accessories,USB-C Cable,"18,60 EUR",1,Paid,2023-12-10,18.6,EUR,18.6,1,18.6,0,0.0,,0,0.0,no_ticket,0,0.0
101132,2023-12-14,C0001,Electronics,Tablet A,$589.01,1,Paid,2023-12-14,589.01,USD,541.8892,1,541.8892,0,0.0,,0,0.0,no_ticket,0,0.0
100144,2023-11-21,C0001,Accessories,Laptop Sleeve,31.36,3,Paid,2023-11-21,31.36,EUR,31.36,3,94.08,0,0.0,,0,0.0,no_ticket,0,0.0
100251,24/11/2023,C0001,Accessories,Charger,41.99,3,Paid,2023-11-24,41.99,EUR,41.99,3,125.97,0,0.0,,0,0.0,no_ticket,0,0.0
100514,01/12/2023,C0095,Electronics,Laptop X,1623,1,Paid,2023-12-01,1623.0,EUR,1623.0,1,1623.0,0,0.0,,0,0.0,no_ticket,0,0.0
100978,2023-12-11,C0003,Electronics,NoiseCancel Headphones,279.88,1,Paid,2023-12-11,279.88,EUR,279.88,1,279.88,0,0.0,,0,0.0,no_ticket,0,0.0
100824,2023-12-08,C0007,Electronics,Tablet A,524.82,1,Paid,2023-12-08,524.82,EUR,524.82,1,524.82,0,0.0,,0,0.0,no_ticket,0,0.0
101082,2023-12-13,C0014,Smart Home,NordLock Pro,"231,99 EUR",1,Paid,2023-12-13,231.99,EUR,231.99,1,231.99,0,0.0,,0,0.0,no_ticket,0,0.0
100717,2023-12-06,C0001,Accessories,Phone Case,"39,48 EUR",1,Paid,2023-12-06,39.48,EUR,39.48,1,39.48,0,0.0,,0,0.0,no_ticket,0,0.0
100732,2023-12-06,C0001,Electronics,TV Pro,$1144.44,1,Paid,2023-12-06,1144.44,USD,1052.8848,1,1052.8848,0,0.0,,0,0.0,no_ticket,0,0.0
100164,2023-11-22,C0015,Electronics,Smartphone Z,"845,23 EUR",1,Paid,2023-11-22,845.23,EUR,845.23,1,845.23,0,0.0,,0,0.0,no_ticket,0,0.0
100501,2023-12-01,C0002,Electronics,NoiseCancel Headphones,$255.15,1,Paid,2023-12-01,255.15,USD,234.73800000000003,1,234.73800000000003,0,0.0,,0,0.0,no_ticket,0,0.0
100264,2023-11-25,C0316,Smart Home,NordLock Pro,"208,11 EUR",1,Paid,2023-11-25,208.11,EUR,208.11,1,208.11,0,0.0,,0,0.0,no_ticket,0,0.0
100082,2023-11-18,C0001,Electronics,Laptop X,1457.02,2,Paid,2023-11-18,1457.02,EUR,1457.02,2,2914.04,0,0.0,,0,0.0,no_ticket,0,0.0
101142,2023-11-17,C0061,Electronics,TV Pro,1046.02,1,Paid,2023-11-17,1046.02,EUR,1046.02,1,1046.02,0,0.0,,0,0.0,no_ticket,0,0.0
100768,2023-12-07,C0001,Accessories,Accessory Bundle,"55,24 EUR",1,Paid,2023-12-07,55.24,EUR,55.24,1,55.24,0,0.0,,0,0.0,no_ticket,0,0.0
100325,2023-11-27,C0125,Smart Home,NordLock Pro,220.55,1,Paid,2023-11-27,220.55,EUR,220.55,1,220.55,0,0.0,,1,0.0,delivery,0,0.0
100473,2023-11-30,C0004,Electronics,NoiseCancel Headphones,"316,19 EUR",1,Paid,2023-11-30,316.19,EUR,316.19,1,316.19,0,0.0,,0,0.0,no_ticket,0,0.0
100564,2023-12-03,C0001,Smart Home,NordLock Pro,223.08,1,Paid,2023-12-03,223.08,EUR,223.08,1,223.08,0,0.0,,0,0.0,no_ticket,0,0.0
100145,21/11/2023,C0170,Accessories,Charger,30.35,2,Paid,2023-11-21,30.35,EUR,30.35,2,60.7,0,0.0,,0,0.0,no_ticket,0,0.0
100663,2023-12-05,C0066,Smart Home,NordLock Pro,200.01,1,Paid,2023-12-05,200.01,EUR,200.01,1,200.01,1,200.01,Processed,3,-0.3333333333333333,app_connectivity,1,1.0
100814,08/12/2023,C0001,Smart Home,NordLock Pro,"181,89 EUR",1,Paid,2023-12-08,181.89,EUR,181.89,1,181.89,0,0.0,,0,0.0,no_ticket,0,0.0
100275,2023-11-25,C0004,Accessories,Phone Case,"19,93 EUR",2,Paid,2023-11-25,19.93,EUR,19.93,2,39.86,0,0.0,,0,0.0,no_ticket,0,0.0
100972,11/12/2023,C0005,Smart Home,NordLock Pro,216.12,2,Pending,2023-12-11,216.12,EUR,216.12,2,432.24,0,0.0,,0,0.0,no_ticket,0,0.0
100673,2023-12-05,C0016,Electronics,Tablet A,507.23,1,Paid,2023-12-05,507.23,EUR,507.23,1,507.23,0,0.0,,0,0.0,no_ticket,0,0.0
100793,07/12/2023,C0083,Accessories,USB-C Cable,19.69,2,Paid,2023-12-07,19.69,EUR,19.69,2,39.38,0,0.0,,0,0.0,no_ticket,0,0.0
100752,2023-12-07,C0271,Smart Home,NordLock Pro,212.22,2,Paid,2023-12-07,212.22,EUR,212.22,2,424.44,0,0.0,,2,0.0,app_connectivity,0,0.0
100730,2023-12-06,C0115,Accessories,Wireless Mouse,58.87,1,Paid,2023-12-06,58.87,EUR,58.87,1,58.87,0,0.0,,1,0.0,defect_quality,0,0.0
100609,2023-12-04,C0004,Smart Home,NordCam Mini,62,1,Paid,2023-12-04,62.0,EUR,62.0,1,62.0,0,0.0,,0,0.0,no_ticket,0,0.0
100825,08/12/2023,C0021,Electronics,Tablet A,652.84,1,Paid,2023-12-08,652.84,EUR,652.84,1,652.84,0,0.0,,0,0.0,no_ticket,0,0.0
100088,2023-11-18,C0027,Accessories,Charger,"20,20 EUR",1,Paid,2023-11-18,20.2,EUR,20.2,1,20.2,0,0.0,,0,0.0,no_ticket,0,0.0
100945,2023-12-11,C0012,Electronics,Tablet A,"736,42 EUR",2,Paid,2023-12-11,736.42,EUR,736.42,2,1472.84,0,0.0,,0,0.0,no_ticket,0,0.0
100853,09/12/2023,C0042,Electronics,Smartphone Z,1004,1,Paid,2023-12-09,1004.0,EUR,1004.0,1,1004.0,0,0.0,,0,0.0,no_ticket,0,0.0
100307,2023-11-26,C0003,Electronics,Smartphone Z,912.54,1,Paid,2023-11-26,912.54,EUR,912.54,1,912.54,0,0.0,,0,0.0,no_ticket,0,0.0
100552,2023-12-02,C0145,Electronics,TV Pro,1419,1,Paid,2023-12-02,1419.0,EUR,1419.0,1,1419.0,0,0.0,,0,0.0,no_ticket,0,0.0
100188,2023-11-22,C0001,Electronics,Smartphone Z,"851,41 EUR",1,Paid,2023-11-22,851.41,EUR,851.41,1,851.41,0,0.0,,0,0.0,no_ticket,0,0.0
100892,2023-12-10,C0009,Accessories,Wireless Mouse,25.68,1,Paid,2023-12-10,25.68,EUR,25.68,1,25.68,0,0.0,,0,0.0,no_ticket,0,0.0
100288,2023-11-25,C0003,Accessories,Charger,$29.37,1,Paid,2023-11-25,29.37,USD,27.020400000000002,1,27.020400000000002,0,0.0,,0,0.0,no_ticket,0,0.0
100871,2023-12-09,C0075,Smart Home,NordLock Pro,185.47,1,Paid,2023-12-09,185.47,EUR,185.47,1,185.47,0,0.0,,2,0.5,defect_quality,0,0.0
100668,2023-12-05,C0030,Electronics,Laptop X,$1686.77,1,Paid,2023-12-05,1686.77,USD,1551.8284,1,1551.8284,0,0.0,,0,0.0,no_ticket,0,0.0
101001,12/12/2023,C0004,Smart Home,NordLock Pro,$186.38,1,Pending,2023-12-12,186.38,USD,171.4696,1,171.4696,0,0.0,,0,0.0,no_ticket,0,0.0
101061,2023-12-13,C0001,Accessories,Screen Protector,8.08,2,Paid,2023-12-13,8.08,EUR,8.08,2,16.16,0,0.0,,0,0.0,no_ticket,0,0.0
100756,2023-12-07,C0001,Accessories,Charger,43.27,1,Paid,2023-12-07,43.27,EUR,43.27,1,43.27,0,0.0,,0,0.0,no_ticket,0,0.0
100372,2023-11-28,C0005,Accessories,Accessory Bundle,$36.70,2,Paid,2023-11-28,36.7,USD,33.764,2,67.528,0,0.0,,0,0.0,no_ticket,0,0.0
100050,2023-11-17,C0003,Electronics,Tablet A,336.05,2,Paid,2023-11-17,336.05,EUR,336.05,2,672.1,0,0.0,,0,0.0,no_ticket,0,0.0
100454,2023-11-30,C0006,Electronics,Smartphone Z,$1061.74,1,Paid,2023-11-30,1061.74,USD,976.8008000000001,1,976.8008000000001,0,0.0,,0,0.0,no_ticket,0,0.0
100549,02/12/2023,C0001,Smart Home,NordLock Pro,190.10,1,Paid,2023-12-02,190.1,EUR,190.1,1,190.1,0,0.0,,0,0.0,no_ticket,0,0.0
100248,2023-11-24,C0001,Accessories,Wireless Mouse,26.62,1,Paid,2023-11-24,26.62,EUR,26.62,1,26.62,0,0.0,,0,0.0,no_ticket,0,0.0
101195,2023-11-23,C0002,Electronics,Laptop X,1577,1,Paid,2023-11-23,1577.0,EUR,1577.0,1,1577.0,0,0.0,,0,0.0,no_ticket,0,0.0
100398,2023-11-29,C0019,Smart Home,NordLock Pro,201.64,1,Paid,2023-11-29,201.64,EUR,201.64,1,201.64,0,0.0,,0,0.0,no_ticket,0,0.0
100865,2023-12-09,C0055,Electronics,Tablet A,"772,98 EUR",1,Paid,2023-12-09,772.98,EUR,772.98,1,772.98,0,0.0,,1,0.0,app_connectivity,0,0.0
100601,2023-12-04,C0001,Accessories,Wireless Mouse,32,1,Pending,2023-12-04,32.0,EUR,32.0,1,32.0,0,0.0,,0,0.0,no_ticket,0,0.0
100662,2023-12-05,C0004,Smart Home,NordLock Pro,"238,67 EUR",1,Paid,2023-12-05,238.67,EUR,238.67,1,238.67,0,0.0,,0,0.0,no_ticket,0,0.0
100833,2023-12-08,C0027,Electronics,NoiseCancel Headphones,"248,37 EUR",1,Paid,2023-12-08,248.37,EUR,248.37,1,248.37,0,0.0,,0,0.0,no_ticket,0,0.0
101124,14/12/2023,C0197,Accessories,Screen Protector,"12,14 EUR",1,Paid,2023-12-14,12.14,EUR,12.14,1,12.14,0,0.0,,0,0.0,no_ticket,0,0.0
100838,2023-12-08,C0003,Smart Home,NordLock Pro,$188.83,1,Paid,2023-12-08,188.83,USD,173.72360000000003,1,173.72360000000003,1,0.0,Rejected,1,-2.0,defect_quality,1,0.0
100034,16/11/2023,C0001,Accessories,Accessory Bundle,$34.22,2,Paid,2023-11-16,34.22,USD,31.482400000000002,2,62.964800000000004,0,0.0,,0,0.0,no_ticket,0,0.0
100089,2023-11-18,C0002,Accessories,Screen Protector,12.91,1,Paid,2023-11-18,12.91,EUR,12.91,1,12.91,0,0.0,,0,0.0,no_ticket,0,0.0
100357,2023-11-28,C0208,Electronics,Smartphone Z,1034.43,1,Paid,2023-11-28,1034.43,EUR,1034.43,1,1034.43,0,0.0,,1,-3.0,defect_quality,0,0.0
100567,2023-12-03,C0001,Electronics,Tablet A,631.82,1,Paid,2023-12-03,631.82,EUR,631.82,1,631.82,0,0.0,,0,0.0,no_ticket,0,0.0
100918,2023-12-10,C0035,Accessories,Accessory Bundle,98.54,1,Paid,2023-12-10,98.54,EUR,98.54,1,98.54,1,98.54,Processed,2,-1.5,defect_quality,1,1.0
100517,02/12/2023,C0117,Accessories,Phone Case,33.43,1,Paid,2023-12-02,33.43,EUR,33.43,1,33.43,0,0.0,,0,0.0,no_ticket,0,0.0
100085,18/11/2023,C0020,Accessories,Charger,$45.43,2,Paid,2023-11-18,45.43,USD,41.7956,2,83.5912,0,0.0,,0,0.0,no_ticket,0,0.0
100773,2023-12-07,C0004,Electronics,Smartphone Z,"893,14 EUR",1,Paid,2023-12-07,893.14,EUR,893.14,1,893.14,0,0.0,,0,0.0,no_ticket,0,0.0
100347,27/11/2023,C0006,Electronics,TV Pro,937.66,2,Paid,2023-11-27,937.66,EUR,937.66,2,1875.32,0,0.0,,0,0.0,no_ticket,0,0.0
100539,2023-12-02,C0008,Electronics,TV Pro,$1441.81,1,Paid,2023-12-02,1441.81,USD,1326.4652,1,1326.4652,0,0.0,,0,0.0,no_ticket,0,0.0
100132,2023-11-20,C0001,Electronics,Laptop X,"1612,31 EUR",2,Paid,2023-11-20,1612.31,EUR,1612.31,2,3224.62,0,0.0,,0,0.0,no_ticket,0,0.0
100376,2023-11-28,C0006,Smart Home,NordLock Pro,224.20,1,Paid,2023-11-28,224.2,EUR,224.2,1,224.2,0,0.0,,0,0.0,no_ticket,0,0.0
101034,12/12/2023,C0214,Accessories,Charger,15.36,2,Paid,2023-12-12,15.36,EUR,15.36,2,30.72,0,0.0,,0,0.0,no_ticket,0,0.0
100616,2023-12-04,C0005,Accessories,Screen Protector,$5.04,1,Failed,2023-12-04,5.04,USD,4.6368,1,4.6368,0,0.0,,0,0.0,no_ticket,0,0.0
100822,2023-12-08,C0242,Smart Home,NordLock Pro,200.64,1,Paid,2023-12-08,200.64,EUR,200.64,1,200.64,0,0.0,,0,0.0,no_ticket,0,0.0
100362,2023-11-28,C0004,Accessories,Charger,43.85,2,Paid,2023-11-28,43.85,EUR,43.85,2,87.7,0,0.0,,0,0.0,no_ticket,0,0.0
100428,2023-11-29,C0027,Accessories,Accessory Bundle,"69,78 EUR",1,Paid,2023-11-29,69.78,EUR,69.78,1,69.78,0,0.0,,0,0.0,no_ticket,0,0.0
101032,2023-12-12,C0125,Accessories,Phone Case,"38,23 EUR",2,Paid,2023-12-12,38.23,EUR,38.23,2,76.46,0,0.0,,1,0.0,defect_quality,0,0.0
100342,2023-11-27,C0024,Accessories,Phone Case,"36,96 EUR",2,Paid,2023-11-27,36.96,EUR,36.96,2,73.92,0,0.0,,0,0.0,no_ticket,0,0.0
100498,2023-12-01,C0013,Accessories,Screen Protector,9.20,1,Paid,2023-12-01,9.2,EUR,9.2,1,9.2,0,0.0,,0,0.0,no_ticket,0,0.0
100758,2023-12-07,C0057,Smart Home,NordLock Pro,$239.23,1,Paid,2023-12-07,239.23,USD,220.0916,1,220.0916,0,0.0,,2,-1.0,defect_quality,0,0.0
101020,12/12/2023,C0013,Accessories,Screen Protector,12.92,1,Paid,2023-12-12,12.92,EUR,12.92,1,12.92,0,0.0,,0,0.0,no_ticket,0,0.0
101146,03/12/2023,C0002,Smart Home,NordLock Pro,"192,26 EUR",1,Paid,2023-12-03,192.26,EUR,192.26,1,192.26,0,0.0,,0,0.0,no_ticket,0,0.0
100734,06/12/2023,C0009,Smart Home,NordTherm,106.57,1,Failed,2023-12-06,106.57,EUR,106.57,1,106.57,0,0.0,,0,0.0,no_ticket,0,0.0
100063,17/11/2023,C0046,Electronics,TV Pro,1698.27,1,Paid,2023-11-17,1698.27,EUR,1698.27,1,1698.27,0,0.0,,0,0.0,no_ticket,0,0.0
100636,04/12/2023,C0008,Accessories,Accessory Bundle,37.42,4,Paid,2023-12-04,37.42,EUR,37.42,4,149.68,0,0.0,,0,0.0,no_ticket,0,0.0
100914,2023-12-10,C0118,Accessories,USB-C Cable,"14,98 EUR",1,Paid,2023-12-10,14.98,EUR,14.98,1,14.98,0,0.0,,2,-2.0,refund_return,0,0.0
100468,2023-11-30,C0001,Electronics,TV Pro,"958,27 EUR",1,Paid,2023-11-30,958.27,EUR,958.27,1,958.27,0,0.0,,0,0.0,no_ticket,0,0.0
100220,2023-11-24,C0073,Accessories,Accessory Bundle,"44,98 EUR",2,Paid,2023-11-24,44.98,EUR,44.98,2,89.96,0,0.0,,1,-1.0,delivery,0,0.0
100443,30/11/2023,C0009,Electronics,Tablet A,487.70,1,Paid,2023-11-30,487.7,EUR,487.7,1,487.7,0,0.0,,0,0.0,no_ticket,0,0.0
100153,2023-11-21,C0106,Electronics,Laptop X,1426.23,1,Paid,2023-11-21,1426.23,EUR,1426.23,1,1426.23,0,0.0,,0,0.0,no_ticket,0,0.0
100326,2023-11-27,C0019,Smart Home,NordLock Pro,"238,66 EUR",1,Paid,2023-11-27,238.66,EUR,238.66,1,238.66,0,0.0,,0,0.0,no_ticket,0,0.0
100308,2023-11-26,C0301,Accessories,Charger,42,1,Paid,2023-11-26,42.0,EUR,42.0,1,42.0,0,0.0,,0,0.0,no_ticket,0,0.0
100859,2023-12-09,C0047,Electronics,TV Pro,1295.10,1,Paid,2023-12-09,1295.1,EUR,1295.1,1,1295.1,0,0.0,,2,-2.5,defect_quality,0,0.0
100613,2023-12-04,C0005,Electronics,Smartphone Z,"701,94 EUR",1,Paid,2023-12-04,701.94,EUR,701.94,1,701.94,0,0.0,,0,0.0,no_ticket,0,0.0
100585,2023-12-03,C0067,Smart Home,NordTherm,84.35,1,Paid,2023-12-03,84.35,EUR,84.35,1,84.35,0,0.0,,0,0.0,no_ticket,0,0.0
100606,2023-12-04,C0003,Accessories,Screen Protector,5,2,Paid,2023-12-04,5.0,EUR,5.0,2,10.0,1,10.0,Processed,0,0.0,no_ticket,1,1.0
100204,23/11/2023,C0239,Electronics,NoiseCancel Headphones,204.43,1,Paid,2023-11-23,204.43,EUR,204.43,1,204.43,0,0.0,,0,0.0,no_ticket,0,0.0
100772,07/12/2023,C0001,Accessories,Charger,43.23,1,Paid,2023-12-07,43.23,EUR,43.23,1,43.23,0,0.0,,0,0.0,no_ticket,0,0.0
100399,29/11/2023,C0262,Electronics,NoiseCancel Headphones,186.48,1,Paid,2023-11-29,186.48,EUR,186.48,1,186.48,0,0.0,,0,0.0,no_ticket,0,0.0
100005,15/11/2023,C0003,Electronics,Tablet A,"553,75 EUR",1,Paid,2023-11-15,553.75,EUR,553.75,1,553.75,0,0.0,,0,0.0,no_ticket,0,0.0
101147,2023-11-24,C0276,Smart Home,NordLock Pro,205.21,1,Paid,2023-11-24,205.21,EUR,205.21,1,205.21,1,205.21,Processed,4,-1.25,defect_quality,1,1.0
100893,2023-12-10,C0224,Accessories,Accessory Bundle,47.39,1,Paid,2023-12-10,47.39,EUR,47.39,1,47.39,0,0.0,,0,0.0,no_ticket,0,0.0
100900,2023-12-10,C0001,Accessories,USB-C Cable,"11,88 EUR",1,Paid,2023-12-10,11.88,EUR,11.88,1,11.88,0,0.0,,0,0.0,no_ticket,0,0.0
100130,2023-11-20,C0271,Electronics,Laptop X,"1 394,09 EUR",1,Paid,2023-11-20,394.09,EUR,394.09,1,394.09,0,0.0,,0,0.0,no_ticket,0,0.0
100701,06/12/2023,C0120,Accessories,USB-C Cable,"17,86 EUR",2,Paid,2023-12-06,17.86,EUR,17.86,2,35.72,0,0.0,,0,0.0,no_ticket,0,0.0
100845,09/12/2023,C0001,Smart Home,NordLock Pro,"202,58 EUR",1,Paid,2023-12-09,202.58,EUR,202.58,1,202.58,0,0.0,,0,0.0,no_ticket,0,0.0
100994,12/12/2023,C0023,Smart Home,NordLock Pro,$192.70,1,Paid,2023-12-12,192.7,USD,177.284,1,177.284,0,0.0,,0,0.0,no_ticket,0,0.0
100458,2023-11-30,C0030,Smart Home,NordLock Pro,$214.91,1,Paid,2023-11-30,214.91,USD,197.71720000000002,1,197.71720000000002,0,0.0,,0,0.0,no_ticket,0,0.0
100072,2023-11-18,C0001,Accessories,Phone Case,25,1,Paid,2023-11-18,25.0,EUR,25.0,1,25.0,0,0.0,,0,0.0,no_ticket,0,0.0
101053,13/12/2023,C0004,Electronics,TV Pro,"1 346,87 EUR",1,Paid,2023-12-13,346.87,EUR,346.87,1,346.87,0,0.0,,0,0.0,no_ticket,0,0.0
100672,2023-12-05,C0007,Electronics,NoiseCancel Headphones,196,1,Paid,2023-12-05,196.0,EUR,196.0,1,196.0,0,0.0,,0,0.0,no_ticket,0,0.0
100656,05/12/2023,C0001,Smart Home,NordLock Pro,210,1,Paid,2023-12-05,210.0,EUR,210.0,1,210.0,0,0.0,,0,0.0,no_ticket,0,0.0
101164,29/11/2023,C0296,Accessories,Accessory Bundle,"52,01 EUR",2,Paid,2023-11-29,52.01,EUR,52.01,2,104.02,0,0.0,,0,0.0,no_ticket,0,0.0
100262,2023-11-25,C0033,Electronics,Smartphone Z,948.32,1,Paid,2023-11-25,948.32,EUR,948.32,1,948.32,1,948.32,Processed,0,0.0,no_ticket,1,1.0
101043,13/12/2023,C0002,Accessories,Accessory Bundle,"46,99 EUR",2,Paid,2023-12-13,46.99,EUR,46.99,2,93.98,0,0.0,,0,0.0,no_ticket,0,0.0
100538,02/12/2023,C0007,Accessories,Accessory Bundle,"82,45 EUR",2,Paid,2023-12-02,82.45,EUR,82.45,2,164.9,0,0.0,,0,0.0,no_ticket,0,0.0
100203,23/11/2023,C0079,Accessories,USB-C Cable,11.15,1,Paid,2023-11-23,11.15,EUR,11.15,1,11.15,0,0.0,,0,0.0,no_ticket,0,0.0
101152,2023-11-24,C0126,Accessories,USB-C Cable,"9,10 EUR",1,Paid,2023-11-24,9.1,EUR,9.1,1,9.1,0,0.0,,0,0.0,no_ticket,0,0.0
100071,2023-11-17,C0035,Accessories,USB-C Cable,15,4,Paid,2023-11-17,15.0,EUR,15.0,4,60.0,0,0.0,,0,0.0,no_ticket,0,0.0
101128,14/12/2023,C0283,Electronics,TV Pro,1490.50,1,Paid,2023-12-14,1490.5,EUR,1490.5,1,1490.5,0,0.0,,0,0.0,no_ticket,0,0.0
100954,2023-12-11,C0187,Accessories,Accessory Bundle,"97,99 EUR",2,Paid,2023-12-11,97.99,EUR,97.99,2,195.98,0,0.0,,1,-1.0,delivery,0,0.0
100128,2023-11-20,C0120,Accessories,Phone Case,33.65,1,Paid,2023-11-20,33.65,EUR,33.65,1,33.65,0,0.0,,0,0.0,no_ticket,0,0.0
100371,28/11/2023,C0013,Electronics,Smartphone Z,"922,19 EUR",1,Paid,2023-11-28,922.19,EUR,922.19,1,922.19,0,0.0,,0,0.0,no_ticket,0,0.0
100135,20/11/2023,C0098,Electronics,Laptop X,1417.96,1,Paid,2023-11-20,1417.96,EUR,1417.96,1,1417.96,0,0.0,,0,0.0,no_ticket,0,0.0
100485,01/12/2023,C0060,Electronics,NoiseCancel Headphones,327.51,1,Paid,2023-12-01,327.51,EUR,327.51,1,327.51,0,0.0,,0,0.0,no_ticket,0,0.0
100816,2023-12-08,C0031,Smart Home,NordLock Pro,"207,28 EUR",1,Paid,2023-12-08,207.28,EUR,207.28,1,207.28,1,207.28,Processed,1,0.0,delivery,1,1.0
100222,2023-11-24,C0070,Accessories,Wireless Mouse,"39,86 EUR",1,Paid,2023-11-24,39.86,EUR,39.86,1,39.86,0,0.0,,0,0.0,no_ticket,0,0.0
101093,2023-12-14,C0001,Electronics,NoiseCancel Headphones,"307,32 EUR",1,Paid,2023-12-14,307.32,EUR,307.32,1,307.32,0,0.0,,0,0.0,no_ticket,0,0.0
101050,13/12/2023,C0012,Electronics,NoiseCancel Headphones,"223,42 EUR",1,Paid,2023-12-13,223.42,EUR,223.42,1,223.42,0,0.0,,0,0.0,no_ticket,0,0.0
101129,2023-12-14,C0001,Electronics,TV Pro,$932.28,1,Paid,2023-12-14,932.28,USD,857.6976,1,857.6976,0,0.0,,0,0.0,no_ticket,0,0.0
100697,06/12/2023,C0001,Electronics,TV Pro,$1320.84,2,Paid,2023-12-06,1320.84,USD,1215.1728,2,2430.3456,0,0.0,,0,0.0,no_ticket,0,0.0
100657,2023-12-05,C0001,Smart Home,NordPlug,31.03,1,Failed,2023-12-05,31.03,EUR,31.03,1,31.03,0,0.0,,0,0.0,no_ticket,0,0.0
100406,2023-11-29,C0143,Electronics,Tablet A,349.95,1,Paid,2023-11-29,349.95,EUR,349.95,1,349.95,0,0.0,,0,0.0,no_ticket,0,0.0
100736,2023-12-06,C0002,Smart Home,NordTherm,"85,29 EUR",1,Paid,2023-12-06,85.29,EUR,85.29,1,85.29,0,0.0,,0,0.0,no_ticket,0,0.0
100531,02/12/2023,C0004,Accessories,Wireless Mouse,23.82,1,Paid,2023-12-02,23.82,EUR,23.82,1,23.82,0,0.0,,0,0.0,no_ticket,0,0.0
101090,14/12/2023,C0002,Smart Home,NordLock Pro,219.32,1,Paid,2023-12-14,219.32,EUR,219.32,1,219.32,0,0.0,,0,0.0,no_ticket,0,0.0
100602,2023-12-04,C0007,Electronics,Tablet A,"529,46 EUR",1,Paid,2023-12-04,529.46,EUR,529.46,1,529.46,0,0.0,,0,0.0,no_ticket,0,0.0
100211,2023-11-23,C0005,Electronics,Smartphone Z,988,1,Paid,2023-11-23,988.0,EUR,988.0,1,988.0,0,0.0,,0,0.0,no_ticket,0,0.0
100388,28/11/2023,C0001,Electronics,Tablet A,$599.27,2,Paid,2023-11-28,599.27,USD,551.3284,2,1102.6568,0,0.0,,0,0.0,no_ticket,0,0.0
101158,2023-12-04,C0040,Accessories,USB-C Cable,13,3,Paid,2023-12-04,13.0,EUR,13.0,3,39.0,0,0.0,,1,0.0,defect_quality,0,0.0
100711,2023-12-06,C0010,Accessories,Wireless Mouse,"29,11 EUR",1,Paid,2023-12-06,29.11,EUR,29.11,1,29.11,0,0.0,,0,0.0,no_ticket,0,0.0
100848,2023-12-09,C0007,Accessories,Accessory Bundle,83,2,Paid,2023-12-09,83.0,EUR,83.0,2,166.0,0,0.0,,0,0.0,no_ticket,0,0.0
100263,2023-11-25,C0001,Electronics,Smartphone Z,"740,02 EUR",1,Paid,2023-11-25,740.02,EUR,740.02,1,740.02,0,0.0,,0,0.0,no_ticket,0,0.0
100305,2023-11-26,C0160,Accessories,Charger,17.05,3,Paid,2023-11-26,17.05,EUR,17.05,3,51.150000000000006,0,0.0,,2,-1.5,defect_quality,0,0.0
100283,25/11/2023,C0003,Electronics,NoiseCancel Headphones,$343.43,1,Paid,2023-11-25,343.43,USD,315.9556,1,315.9556,0,0.0,,0,0.0,no_ticket,0,0.0
100997,12/12/2023,C0001,Electronics,Smartphone Z,"706,88 EUR",1,Paid,2023-12-12,706.88,EUR,706.88,1,706.88,0,0.0,,0,0.0,no_ticket,0,0.0
101119,14/12/2023,C0064,Smart Home,NordLock Pro,188.97,2,Paid,2023-12-14,188.97,EUR,188.97,2,377.94,0,0.0,,0,0.0,no_ticket,0,0.0
100465,30/11/2023,C0081,Accessories,Accessory Bundle,62.27,1,Paid,2023-11-30,62.27,EUR,62.27,1,62.27,0,0.0,,0,0.0,no_ticket,0,0.0
100340,27/11/2023,C0059,Accessories,Accessory Bundle,26.09,2,Paid,2023-11-27,26.09,EUR,26.09,2,52.18,0,0.0,,0,0.0,no_ticket,0,0.0
100337,2023-11-27,C0009,Accessories,Screen Protector,"6,38 EUR",1,Pending,2023-11-27,6.38,EUR,6.38,1,6.38,0,0.0,,0,0.0,no_ticket,0,0.0
100156,2023-11-21,C0003,Electronics,TV Pro,1131.22,1,Failed,2023-11-21,1131.22,EUR,1131.22,1,1131.22,0,0.0,,0,0.0,no_ticket,0,0.0
100513,2023-12-01,C0001,Smart Home,NordPlug,18.39,1,Paid,2023-12-01,18.39,EUR,18.39,1,18.39,0,0.0,,0,0.0,no_ticket,0,0.0
100808,08/12/2023,C0028,Smart Home,NordLock Pro,"193,67 EUR",1,Paid,2023-12-08,193.67,EUR,193.67,1,193.67,0,0.0,,0,0.0,no_ticket,0,0.0
100646,2023-12-04,C0102,Accessories,USB-C Cable,"18,98 EUR",1,Paid,2023-12-04,18.98,EUR,18.98,1,18.98,0,0.0,,0,0.0,no_ticket,0,0.0
100540,02/12/2023,C0035,Electronics,TV Pro,978.66,1,Paid,2023-12-02,978.66,EUR,978.66,1,978.66,0,0.0,,0,0.0,no_ticket,0,0.0
100074,2023-11-18,C0129,Smart Home,NordLock Pro,227.10,1,Paid,2023-11-18,227.1,EUR,227.1,1,227.1,0,0.0,,1,0.0,defect_quality,0,0.0
100044,2023-11-16,C0003,Electronics,NoiseCancel Headphones,207.57,1,Paid,2023-11-16,207.57,EUR,207.57,1,207.57,0,0.0,,0,0.0,no_ticket,0,0.0
101198,2023-12-13,C0013,Accessories,Wireless Mouse,26.47,2,Paid,2023-12-13,26.47,EUR,26.47,2,52.94,0,0.0,,0,0.0,no_ticket,0,0.0
100776,2023-12-07,C0093,Accessories,Screen Protector,10.13,3,Paid,2023-12-07,10.13,EUR,10.13,3,30.39,0,0.0,,0,0.0,no_ticket,0,0.0
100801,08/12/2023,C0318,Accessories,Phone Case,30.35,4,Paid,2023-12-08,30.35,EUR,30.35,4,121.4,0,0.0,,0,0.0,no_ticket,0,0.0
100627,2023-12-04,C0022,Accessories,Screen Protector,8.38,1,Paid,2023-12-04,8.38,EUR,8.38,1,8.38,0,0.0,,1,-2.0,defect_quality,0,0.0
100795,2023-12-07,C0002,Accessories,USB-C Cable,"9,83 EUR",1,Paid,2023-12-07,9.83,EUR,9.83,1,9.83,0,0.0,,0,0.0,no_ticket,0,0.0
100569,2023-12-03,C0001,Accessories,Charger,28,1,Paid,2023-12-03,28.0,EUR,28.0,1,28.0,0,0.0,,0,0.0,no_ticket,0,0.0
100254,2023-11-24,C0084,Electronics,Smartphone Z,906.32,1,Paid,2023-11-24,906.32,EUR,906.32,1,906.32,0,0.0,,0,0.0,no_ticket,0,0.0
101003,2023-12-12,C0003,Smart Home,NordLock Pro,217.71,2,Paid,2023-12-12,217.71,EUR,217.71,2,435.42,0,0.0,,0,0.0,no_ticket,0,0.0
100097,19/11/2023,C0001,Smart Home,NordLock Pro,$205.02,1,Paid,2023-11-19,205.02,USD,188.6184,1,188.6184,0,0.0,,0,0.0,no_ticket,0,0.0
100279,25/11/2023,C0002,Electronics,Tablet A,"791,92 EUR",1,Paid,2023-11-25,791.92,EUR,791.92,1,791.92,0,0.0,,0,0.0,no_ticket,0,0.0
100710,2023-12-06,C0181,Electronics,Laptop X,$1439.35,1,Paid,2023-12-06,1439.35,USD,1324.202,1,1324.202,0,0.0,,0,0.0,no_ticket,0,0.0
100296,2023-11-26,C0028,Electronics,TV Pro,1020.82,1,Paid,2023-11-26,1020.82,EUR,1020.82,1,1020.82,0,0.0,,0,0.0,no_ticket,0,0.0
100723,2023-12-06,C0020,Accessories,Laptop Sleeve,"15,59 EUR",2,Paid,2023-12-06,15.59,EUR,15.59,2,31.18,0,0.0,,0,0.0,no_ticket,0,0.0
100346,2023-11-27,C0001,Smart Home,NordLock Pro,210.90,1,Paid,2023-11-27,210.9,EUR,210.9,1,210.9,0,0.0,,0,0.0,no_ticket,0,0.0
100655,2023-12-05,C0023,Accessories,Accessory Bundle,"59,55 EUR",1,Paid,2023-12-05,59.55,EUR,59.55,1,59.55,1,0.0,Rejected,1,-2.0,defect_quality,1,0.0
100099,2023-11-19,C0001,Electronics,TV Pro,$926.93,1,Paid,2023-11-19,926.93,USD,852.7755999999999,1,852.7755999999999,0,0.0,,0,0.0,no_ticket,0,0.0
100470,2023-11-30,C0200,Smart Home,NordLock Pro,"189,66 EUR",1,Paid,2023-11-30,189.66,EUR,189.66,1,189.66,0,0.0,,3,-2.0,defect_quality,0,0.0
100504,2023-12-01,C0037,Accessories,Charger,42.66,1,Paid,2023-12-01,42.66,EUR,42.66,1,42.66,0,0.0,,1,-1.0,delivery,0,0.0
100075,2023-11-18,C0022,Accessories,Wireless Mouse,"44,32 EUR",2,Paid,2023-11-18,44.32,EUR,44.32,2,88.64,0,0.0,,0,0.0,no_ticket,0,0.0
100266,25/11/2023,C0007,Smart Home,NordCam Mini,"94,60 EUR",1,Paid,2023-11-25,94.6,EUR,94.6,1,94.6,0,0.0,,0,0.0,no_ticket,0,0.0
101004,12/12/2023,C0030,Accessories,Charger,"19,80 EUR",3,Paid,2023-12-12,19.8,EUR,19.8,3,59.400000000000006,0,0.0,,0,0.0,no_ticket,0,0.0
100131,20/11/2023,C0004,Accessories,Screen Protector,12.93,1,Paid,2023-11-20,12.93,EUR,12.93,1,12.93,0,0.0,,0,0.0,no_ticket,0,0.0
100509,2023-12-01,C0015,Accessories,USB-C Cable,16.14,1,Paid,2023-12-01,16.14,EUR,16.14,1,16.14,0,0.0,,1,-1.0,delivery,0,0.0
100064,17/11/2023,C0012,Accessories,Phone Case,12,1,Paid,2023-11-17,12.0,EUR,12.0,1,12.0,0,0.0,,0,0.0,no_ticket,0,0.0
100012,2023-11-15,C0005,Electronics,Laptop X,1546,2,Paid,2023-11-15,1546.0,EUR,1546.0,2,3092.0,0,0.0,,0,0.0,no_ticket,0,0.0
101192,2023-11-25,C0003,Electronics,Smartphone Z,1056.70,1,Paid,2023-11-25,1056.7,EUR,1056.7,1,1056.7,0,0.0,,0,0.0,no_ticket,0,0.0
100356,2023-11-28,C0037,Electronics,Tablet A,"556,99 EUR",1,Paid,2023-11-28,556.99,EUR,556.99,1,556.99,0,0.0,,0,0.0,no_ticket,0,0.0
100028,2023-11-16,C0253,Accessories,Laptop Sleeve,29.42,1,Paid,2023-11-16,29.42,EUR,29.42,1,29.42,0,0.0,,1,0.0,defect_quality,0,0.0
100923,2023-12-10,C0022,Electronics,Smartphone Z,"711,15 EUR",1,Paid,2023-12-10,711.15,EUR,711.15,1,711.15,0,0.0,,1,-2.0,defect_quality,0,0.0
100766,07/12/2023,C0034,Electronics,Tablet A,715,1,Paid,2023-12-07,715.0,EUR,715.0,1,715.0,0,0.0,,0,0.0,no_ticket,0,0.0
100784,2023-12-07,C0019,Accessories,USB-C Cable,19.73,1,Paid,2023-12-07,19.73,EUR,19.73,1,19.73,0,0.0,,3,-1.3333333333333333,defect_quality,0,0.0
100425,2023-11-29,C0002,Accessories,USB-C Cable,$9.35,1,Pending,2023-11-29,9.35,USD,8.602,1,8.602,0,0.0,,0,0.0,no_ticket,0,0.0
100025,16/11/2023,C0001,Electronics,TV Pro,"929,16 EUR",1,Paid,2023-11-16,929.16,EUR,929.16,1,929.16,0,0.0,,0,0.0,no_ticket,0,0.0
100959,2023-12-11,C0028,Electronics,TV Pro,1060.75,1,Paid,2023-12-11,1060.75,EUR,1060.75,1,1060.75,0,0.0,,1,0.0,app_connectivity,0,0.0
100331,2023-11-27,C0058,Electronics,TV Pro,"1 145,46 EUR",1,Paid,2023-11-27,145.46,EUR,145.46,1,145.46,0,0.0,,0,0.0,no_ticket,0,0.0
101196,29/11/2023,C0003,Accessories,Laptop Sleeve,36.68,2,Paid,2023-11-29,36.68,EUR,36.68,2,73.36,0,0.0,,0,0.0,no_ticket,0,0.0
100403,2023-11-29,C0025,Smart Home,NordLock Pro,190.38,1,Paid,2023-11-29,190.38,EUR,190.38,1,190.38,0,0.0,,0,0.0,no_ticket,0,0.0
100192,2023-11-23,C0003,Accessories,Wireless Mouse,"56,45 EUR",1,Paid,2023-11-23,56.45,EUR,56.45,1,56.45,0,0.0,,0,0.0,no_ticket,0,0.0
100626,04/12/2023,C0001,Electronics,Tablet A,"503,52 EUR",1,Failed,2023-12-04,503.52,EUR,503.52,1,503.52,0,0.0,,0,0.0,no_ticket,0,0.0
100651,2023-12-05,C0002,Electronics,Smartphone Z,966.41,1,Paid,2023-12-05,966.41,EUR,966.41,1,966.41,0,0.0,,0,0.0,no_ticket,0,0.0
100129,20/11/2023,C0051,Smart Home,NordLock Pro,$247.01,1,Paid,2023-11-20,247.01,USD,227.2492,1,227.2492,0,0.0,,0,0.0,no_ticket,0,0.0
100678,2023-12-05,C0033,Smart Home,NordLock Pro,229.79,1,Paid,2023-12-05,229.79,EUR,229.79,1,229.79,0,0.0,,0,0.0,no_ticket,0,0.0
101133,14/12/2023,C0042,Electronics,TV Pro,1610.06,1,Paid,2023-12-14,1610.06,EUR,1610.06,1,1610.06,0,0.0,,0,0.0,no_ticket,0,0.0
100169,2023-11-22,C0006,Electronics,NoiseCancel Headphones,"333,41 EUR",1,Paid,2023-11-22,333.41,EUR,333.41,1,333.41,0,0.0,,0,0.0,no_ticket,0,0.0
100287,25/11/2023,C0072,Accessories,Charger,$17.47,1,Paid,2023-11-25,17.47,USD,16.0724,1,16.0724,0,0.0,,0,0.0,no_ticket,0,0.0
100383,2023-11-28,C0237,Smart Home,NordLock Pro,$208.61,2,Paid,2023-11-28,208.61,USD,191.92120000000003,2,383.84240000000005,0,0.0,,2,0.5,defect_quality,0,0.0
100940,2023-12-11,C0002,Electronics,TV Pro,"1 465,79 EUR",1,Paid,2023-12-11,465.79,EUR,465.79,1,465.79,0,0.0,,0,0.0,no_ticket,0,0.0
100924,2023-12-10,C0087,Accessories,Accessory Bundle,"77,62 EUR",2,Paid,2023-12-10,77.62,EUR,77.62,2,155.24,0,0.0,,0,0.0,no_ticket,0,0.0
101102,14/12/2023,C0002,Electronics,NoiseCancel Headphones,"227,69 EUR",1,Paid,2023-12-14,227.69,EUR,227.69,1,227.69,0,0.0,,0,0.0,no_ticket,0,0.0
100857,2023-12-09,C0001,Electronics,NoiseCancel Headphones,150.30,1,Paid,2023-12-09,150.3,EUR,150.3,1,150.3,0,0.0,,0,0.0,no_ticket,0,0.0
101086,2023-12-14,C0007,Smart Home,NordLock Pro,220.54,1,Paid,2023-12-14,220.54,EUR,220.54,1,220.54,0,0.0,,0,0.0,no_ticket,0,0.0
100536,2023-12-02,C0001,Accessories,USB-C Cable,14,1,Paid,2023-12-02,14.0,EUR,14.0,1,14.0,0,0.0,,0,0.0,no_ticket,0,0.0
100015,15/11/2023,C0013,Accessories,Laptop Sleeve,"28,15 EUR",1,Paid,2023-11-15,28.15,EUR,28.15,1,28.15,0,0.0,,0,0.0,no_ticket,0,0.0
100420,2023-11-29,C0001,Accessories,Phone Case,"18,25 EUR",4,Paid,2023-11-29,18.25,EUR,18.25,4,73.0,0,0.0,,0,0.0,no_ticket,0,0.0
100189,22/11/2023,C0001,Electronics,Laptop X,1507.54,2,Paid,2023-11-22,1507.54,EUR,1507.54,2,3015.08,0,0.0,,0,0.0,no_ticket,0,0.0
101107,14/12/2023,C0003,Electronics,NoiseCancel Headphones,183.96,1,Paid,2023-12-14,183.96,EUR,183.96,1,183.96,0,0.0,,0,0.0,no_ticket,0,0.0
101024,2023-12-12,C0003,Smart Home,NordLock Pro,226.20,1,Paid,2023-12-12,226.2,EUR,226.2,1,226.2,0,0.0,,1,0.0,defect_quality,0,0.0
100437,2023-11-30,C0008,Electronics,Tablet A,$355.20,1,Paid,2023-11-30,355.2,USD,326.784,1,326.784,0,0.0,,0,0.0,no_ticket,0,0.0
101025,12/12/2023,C0120,Accessories,Charger,29,1,Paid,2023-12-12,29.0,EUR,29.0,1,29.0,0,0.0,,0,0.0,no_ticket,0,0.0
100769,07/12/2023,C0050,Electronics,NoiseCancel Headphones,"282,69 EUR",1,Paid,2023-12-07,282.69,EUR,282.69,1,282.69,0,0.0,,0,0.0,no_ticket,0,0.0
100375,2023-11-28,C0009,Accessories,Phone Case,"35,08 EUR",3,Paid,2023-11-28,35.08,EUR,35.08,3,105.24,0,0.0,,0,0.0,no_ticket,0,0.0
100373,2023-11-28,C0024,Accessories,USB-C Cable,$17.66,1,Paid,2023-11-28,17.66,USD,16.2472,1,16.2472,0,0.0,,0,0.0,no_ticket,0,0.0
100591,2023-12-03,C0017,Smart Home,NordLock Pro,"239,52 EUR",1,Paid,2023-12-03,239.52,EUR,239.52,1,239.52,1,239.52,Processed,0,0.0,no_ticket,1,1.0
100675,05/12/2023,C0002,Accessories,Charger,46.60,1,Paid,2023-12-05,46.6,EUR,46.6,1,46.6,0,0.0,,0,0.0,no_ticket,0,0.0
100417,2023-11-29,C0078,Accessories,Screen Protector,"6,53 EUR",1,Paid,2023-11-29,6.53,EUR,6.53,1,6.53,0,0.0,,1,-1.0,delivery,0,0.0
100195,23/11/2023,C0037,Smart Home,NordLock Pro,"181,85 EUR",1,Paid,2023-11-23,181.85,EUR,181.85,1,181.85,0,0.0,,0,0.0,no_ticket,0,0.0
100450,30/11/2023,C0002,Accessories,Screen Protector,11.57,2,Paid,2023-11-30,11.57,EUR,11.57,2,23.14,0,0.0,,0,0.0,no_ticket,0,0.0
100810,08/12/2023,C0002,Smart Home,NordLock Pro,180.92,1,Paid,2023-12-08,180.92,EUR,180.92,1,180.92,0,0.0,,0,0.0,no_ticket,0,0.0
100775,2023-12-07,C0001,Accessories,USB-C Cable,"13,71 EUR",1,Paid,2023-12-07,13.71,EUR,13.71,1,13.71,0,0.0,,0,0.0,no_ticket,0,0.0
100962,2023-12-11,C0006,Smart Home,NordLock Pro,190.08,1,Paid,2023-12-11,190.08,EUR,190.08,1,190.08,1,0.0,Rejected,0,0.0,no_ticket,1,0.0
101039,2023-12-12,C0001,Smart Home,NordLock Pro,"219,18 EUR",1,Paid,2023-12-12,219.18,EUR,219.18,1,219.18,0,0.0,,0,0.0,no_ticket,0,0.0
100408,29/11/2023,C0005,Accessories,Laptop Sleeve,44.52,3,Paid,2023-11-29,44.52,EUR,44.52,3,133.56,0,0.0,,0,0.0,no_ticket,0,0.0
100397,29/11/2023,C0007,Smart Home,NordLock Pro,199.29,1,Pending,2023-11-29,199.29,EUR,199.29,1,199.29,0,0.0,,0,0.0,no_ticket,0,0.0
100615,04/12/2023,C0011,Electronics,NoiseCancel Headphones,$262.06,1,Paid,2023-12-04,262.06,USD,241.0952,1,241.0952,0,0.0,,0,0.0,no_ticket,0,0.0
100963,2023-12-11,C0024,Smart Home,NordLock Pro,206,1,Paid,2023-12-11,206.0,EUR,206.0,1,206.0,1,206.0,Processed,0,0.0,no_ticket,1,1.0
100749,07/12/2023,C0256,Accessories,Phone Case,"14,51 EUR",4,Paid,2023-12-07,14.51,EUR,14.51,4,58.04,0,0.0,,0,0.0,no_ticket,0,0.0
100863,09/12/2023,C0011,Smart Home,NordLock Pro,"192,18 EUR",1,Paid,2023-12-09,192.18,EUR,192.18,1,192.18,0,0.0,,0,0.0,no_ticket,0,0.0
100193,23/11/2023,C0010,Electronics,Tablet A,"752,45 EUR",1,Paid,2023-11-23,752.45,EUR,752.45,1,752.45,0,0.0,,0,0.0,no_ticket,0,0.0
100150,2023-11-21,C0002,Electronics,NoiseCancel Headphones,"227,04 EUR",1,Paid,2023-11-21,227.04,EUR,227.04,1,227.04,0,0.0,,0,0.0,no_ticket,0,0.0
100688,05/12/2023,C0006,Electronics,Tablet A,"644,02 EUR",1,Paid,2023-12-05,644.02,EUR,644.02,1,644.02,0,0.0,,0,0.0,no_ticket,0,0.0
100791,2023-12-07,C0002,Electronics,Tablet A,$636.80,1,Paid,2023-12-07,636.8,USD,585.856,1,585.856,0,0.0,,0,0.0,no_ticket,0,0.0
100740,07/12/2023,C0047,Electronics,Smartphone Z,712.48,1,Paid,2023-12-07,712.48,EUR,712.48,1,712.48,0,0.0,,0,0.0,no_ticket,0,0.0
100300,2023-11-26,C0009,Accessories,Phone Case,"18,67 EUR",3,Paid,2023-11-26,18.67,EUR,18.67,3,56.010000000000005,0,0.0,,0,0.0,no_ticket,0,0.0
100708,2023-12-06,C0003,Electronics,Tablet A,"612,79 EUR",1,Paid,2023-12-06,612.79,EUR,612.79,1,612.79,0,0.0,,0,0.0,no_ticket,0,0.0
100950,2023-12-11,C0258,Electronics,NoiseCancel Headphones,"200,27 EUR",1,Paid,2023-12-11,200.27,EUR,200.27,1,200.27,0,0.0,,0,0.0,no_ticket,0,0.0
100241,2023-11-24,C0065,Smart Home,NordPlug,32.73,1,Paid,2023-11-24,32.73,EUR,32.73,1,32.73,0,0.0,,0,0.0,no_ticket,0,0.0
100200,2023-11-23,C0063,Electronics,Tablet A,714.86,1,Paid,2023-11-23,714.86,EUR,714.86,1,714.86,0,0.0,,0,0.0,no_ticket,0,0.0
100046,2023-11-17,C0009,Electronics,TV Pro,$1312.23,1,Paid,2023-11-17,1312.23,USD,1207.2516,1,1207.2516,0,0.0,,0,0.0,no_ticket,0,0.0
100713,2023-12-06,C0030,Smart Home,NordLock Pro,239,1,Paid,2023-12-06,239.0,EUR,239.0,1,239.0,1,239.0,Processed,0,0.0,no_ticket,1,1.0
100588,2023-12-03,C0016,Accessories,Wireless Mouse,40,1,Paid,2023-12-03,40.0,EUR,40.0,1,40.0,0,0.0,,0,0.0,no_ticket,0,0.0
100138,20/11/2023,C0001,Accessories,Wireless Mouse,"59,52 EUR",1,Paid,2023-11-20,59.52,EUR,59.52,1,59.52,0,0.0,,0,0.0,no_ticket,0,0.0
101099,2023-12-14,C0008,Electronics,Laptop X,1431.88,1,Pending,2023-12-14,1431.88,EUR,1431.88,1,1431.88,0,0.0,,0,0.0,no_ticket,0,0.0
100534,2023-12-02,C0018,Accessories,Screen Protector,$14.10,1,Paid,2023-12-02,14.1,USD,12.972,1,12.972,0,0.0,,1,-2.0,defect_quality,0,0.0
100661,2023-12-05,C0029,Smart Home,NordLock Pro,247,2,Paid,2023-12-05,247.0,EUR,247.0,2,494.0,0,0.0,,0,0.0,no_ticket,0,0.0
100781,2023-12-07,C0003,Accessories,Charger,$36.62,2,Paid,2023-12-07,36.62,USD,33.6904,2,67.3808,0,0.0,,0,0.0,no_ticket,0,0.0
100665,2023-12-05,C0004,Accessories,Screen Protector,"5,76 EUR",1,Paid,2023-12-05,5.76,EUR,5.76,1,5.76,0,0.0,,0,0.0,no_ticket,0,0.0
101120,2023-12-14,C0001,Smart Home,NordLock Pro,226,1,Paid,2023-12-14,226.0,EUR,226.0,1,226.0,0,0.0,,0,0.0,no_ticket,0,0.0
100382,28/11/2023,C0147,Accessories,Charger,"39,53 EUR",2,Paid,2023-11-28,39.53,EUR,39.53,2,79.06,0,0.0,,0,0.0,no_ticket,0,0.0
100642,2023-12-04,C0022,Accessories,Phone Case,"19,39 EUR",3,Paid,2023-12-04,19.39,EUR,19.39,3,58.17,0,0.0,,0,0.0,no_ticket,0,0.0
101182,2023-11-30,C0303,Accessories,Wireless Mouse,23,1,Paid,2023-11-30,23.0,EUR,23.0,1,23.0,0,0.0,,0,0.0,no_ticket,0,0.0
100449,2023-11-30,C0003,Smart Home,NordLock Pro,239.22,1,Paid,2023-11-30,239.22,EUR,239.22,1,239.22,0,0.0,,0,0.0,no_ticket,0,0.0
100511,2023-12-01,C0001,Accessories,Laptop Sleeve,"42,01 EUR",2,Paid,2023-12-01,42.01,EUR,42.01,2,84.02,0,0.0,,0,0.0,no_ticket,0,0.0
100424,2023-11-29,C0006,Accessories,USB-C Cable,"8,80 EUR",1,Paid,2023-11-29,8.8,EUR,8.8,1,8.8,0,0.0,,0,0.0,no_ticket,0,0.0
100007,15/11/2023,C0003,Accessories,Phone Case,28.53,1,Paid,2023-11-15,28.53,EUR,28.53,1,28.53,0,0.0,,0,0.0,no_ticket,0,0.0
100098,2023-11-19,C0019,Electronics,TV Pro,$1266.38,1,Paid,2023-11-19,1266.38,USD,1165.0696000000003,1,1165.0696000000003,0,0.0,,0,0.0,no_ticket,0,0.0
100411,2023-11-29,C0065,Electronics,Tablet A,"440,32 EUR",1,Pending,2023-11-29,440.32,EUR,440.32,1,440.32,0,0.0,,0,0.0,no_ticket,0,0.0
100159,2023-11-21,C0012,Electronics,Tablet A,"394,06 EUR",1,Paid,2023-11-21,394.06,EUR,394.06,1,394.06,0,0.0,,0,0.0,no_ticket,0,0.0
100919,2023-12-10,C0001,Electronics,TV Pro,"970,60 EUR",1,Paid,2023-12-10,970.6,EUR,970.6,1,970.6,0,0.0,,0,0.0,no_ticket,0,0.0
100653,2023-12-05,C0020,Accessories,Screen Protector,9.37,2,Paid,2023-12-05,9.37,EUR,9.37,2,18.74,0,0.0,,0,0.0,no_ticket,0,0.0
100033,2023-11-16,C0007,Electronics,Tablet A,615,1,Paid,2023-11-16,615.0,EUR,615.0,1,615.0,0,0.0,,0,0.0,no_ticket,0,0.0
100799,2023-12-08,C0011,Smart Home,NordPlug,"24,63 EUR",1,Paid,2023-12-08,24.63,EUR,24.63,1,24.63,0,0.0,,1,-1.0,defect_quality,0,0.0
100760,2023-12-07,C0002,Electronics,Tablet A,"520,14 EUR",1,Paid,2023-12-07,520.14,EUR,520.14,1,520.14,0,0.0,,0,0.0,no_ticket,0,0.0
100522,2023-12-02,C0003,Accessories,Charger,"39,36 EUR",1,Paid,2023-12-02,39.36,EUR,39.36,1,39.36,0,0.0,,0,0.0,no_ticket,0,0.0
100335,2023-11-27,C0040,Electronics,Smartphone Z,1004.81,1,Paid,2023-11-27,1004.81,EUR,1004.81,1,1004.81,0,0.0,,0,0.0,no_ticket,0,0.0
100491,01/12/2023,C0001,Accessories,Accessory Bundle,45.49,2,Paid,2023-12-01,45.49,EUR,45.49,2,90.98,0,0.0,,0,0.0,no_ticket,0,0.0
100259,2023-11-24,C0013,Electronics,Smartphone Z,718.54,1,Paid,2023-11-24,718.54,EUR,718.54,1,718.54,0,0.0,,0,0.0,no_ticket,0,0.0
100172,2023-11-22,C0007,Accessories,Laptop Sleeve,39.84,1,Paid,2023-11-22,39.84,EUR,39.84,1,39.84,0,0.0,,0,0.0,no_ticket,0,0.0
101108,2023-12-14,C0024,Accessories,Laptop Sleeve,"19,89 EUR",4,Pending,2023-12-14,19.89,EUR,19.89,4,79.56,0,0.0,,0,0.0,no_ticket,0,0.0
100548,2023-12-02,C0001,Electronics,TV Pro,"1184,65 EUR",1,Paid,2023-12-02,1184.65,EUR,1184.65,1,1184.65,0,0.0,,0,0.0,no_ticket,0,0.0
100237,2023-11-24,C0301,Accessories,Laptop Sleeve,38.99,1,Paid,2023-11-24,38.99,EUR,38.99,1,38.99,0,0.0,,0,0.0,no_ticket,0,0.0
100385,2023-11-28,C0015,Accessories,Laptop Sleeve,"24,00 EUR",3,Paid,2023-11-28,24.0,EUR,24.0,3,72.0,0,0.0,,0,0.0,no_ticket,0,0.0
100659,2023-12-05,C0008,Accessories,Charger,"40,01 EUR",1,Paid,2023-12-05,40.01,EUR,40.01,1,40.01,0,0.0,,0,0.0,no_ticket,0,0.0
100024,2023-11-16,C0002,Accessories,Charger,"25,01 EUR",1,Paid,2023-11-16,25.01,EUR,25.01,1,25.01,0,0.0,,0,0.0,no_ticket,0,0.0
100809,2023-12-08,C0158,Electronics,Laptop X,"1 730,99 EUR",1,Paid,2023-12-08,730.99,EUR,730.99,1,730.99,0,0.0,,0,0.0,no_ticket,0,0.0
101012,2023-12-12,C0001,Electronics,Laptop X,"1535,84 EUR",1,Failed,2023-12-12,1535.84,EUR,1535.84,1,1535.84,0,0.0,,0,0.0,no_ticket,0,0.0
100885,09/12/2023,C0010,Electronics,TV Pro,"947,14 EUR",1,Paid,2023-12-09,947.14,EUR,947.14,1,947.14,0,0.0,,0,0.0,no_ticket,0,0.0
100546,02/12/2023,C0079,Accessories,USB-C Cable,"9,98 EUR",1,Paid,2023-12-02,9.98,EUR,9.98,1,9.98,0,0.0,,0,0.0,no_ticket,0,0.0
100641,04/12/2023,C0015,Accessories,Laptop Sleeve,33.86,3,Paid,2023-12-04,33.86,EUR,33.86,3,101.58,0,0.0,,0,0.0,no_ticket,0,0.0
100478,2023-11-30,C0003,Electronics,TV Pro,"1393,62 EUR",1,Paid,2023-11-30,1393.62,EUR,1393.62,1,1393.62,0,0.0,,0,0.0,no_ticket,0,0.0
101178,2023-12-13,C0001,Accessories,Charger,46.12,2,Paid,2023-12-13,46.12,EUR,46.12,2,92.24,0,0.0,,0,0.0,no_ticket,0,0.0
100680,2023-12-05,C0001,Electronics,Laptop X,1719,1,Paid,2023-12-05,1719.0,EUR,1719.0,1,1719.0,0,0.0,,0,0.0,no_ticket,0,0.0
100830,2023-12-08,C0016,Accessories,Laptop Sleeve,39,1,Paid,2023-12-08,39.0,EUR,39.0,1,39.0,0,0.0,,1,-1.0,app_connectivity,0,0.0
100154,21/11/2023,C0014,Accessories,Accessory Bundle,46.00,1,Paid,2023-11-21,46.0,EUR,46.0,1,46.0,0,0.0,,0,0.0,no_ticket,0,0.0
100123,2023-11-20,C0314,Accessories,Laptop Sleeve,"33,17 EUR",1,Paid,2023-11-20,33.17,EUR,33.17,1,33.17,0,0.0,,0,0.0,no_ticket,0,0.0
100698,2023-12-06,C0001,Electronics,TV Pro,1205,1,Paid,2023-12-06,1205.0,EUR,1205.0,1,1205.0,0,0.0,,0,0.0,no_ticket,0,0.0
100121,19/11/2023,C0113,Smart Home,NordPlug,"23,36 EUR",2,Paid,2023-11-19,23.36,EUR,23.36,2,46.72,0,0.0,,0,0.0,no_ticket,0,0.0
100904,10/12/2023,C0149,Electronics,TV Pro,1184.42,1,Paid,2023-12-10,1184.42,EUR,1184.42,1,1184.42,0,0.0,,0,0.0,no_ticket,0,0.0
100464,2023-11-30,C0001,Accessories,Laptop Sleeve,20,2,Paid,2023-11-30,20.0,EUR,20.0,2,40.0,0,0.0,,0,0.0,no_ticket,0,0.0
101121,14/12/2023,C0067,Electronics,TV Pro,"928,65 EUR",1,Paid,2023-12-14,928.65,EUR,928.65,1,928.65,0,0.0,,0,0.0,no_ticket,0,0.0
100628,2023-12-04,C0187,Accessories,Wireless Mouse,"19,96 EUR",1,Paid,2023-12-04,19.96,EUR,19.96,1,19.96,0,0.0,,1,-3.0,defect_quality,0,0.0
101075,2023-12-13,C0002,Smart Home,NordCam Mini,"62,13 EUR",1,Paid,2023-12-13,62.13,EUR,62.13,1,62.13,0,0.0,,0,0.0,no_ticket,0,0.0
100985,2023-12-11,C0086,Electronics,Tablet A,"783,57 EUR",1,Paid,2023-12-11,783.57,EUR,783.57,1,783.57,0,0.0,,0,0.0,no_ticket,0,0.0
100520,2023-12-02,C0021,Accessories,USB-C Cable,10.00,1,Paid,2023-12-02,10.0,EUR,10.0,1,10.0,0,0.0,,0,0.0,no_ticket,0,0.0
100951,11/12/2023,C0054,Accessories,Accessory Bundle,"96,87 EUR",2,Paid,2023-12-11,96.87,EUR,96.87,2,193.74,0,0.0,,0,0.0,no_ticket,0,0.0
100966,2023-12-11,C0035,Accessories,Phone Case,"16,30 EUR",1,Paid,2023-12-11,16.3,EUR,16.3,1,16.3,0,0.0,,0,0.0,no_ticket,0,0.0
101177,2023-11-28,C0037,Electronics,Tablet A,"556,99 EUR",1,Paid,2023-11-28,556.99,EUR,556.99,1,556.99,0,0.0,,0,0.0,no_ticket,0,0.0
100587,2023-12-03,C0001,Accessories,Screen Protector,$10.14,2,Paid,2023-12-03,10.14,USD,9.328800000000001,2,18.657600000000002,0,0.0,,0,0.0,no_ticket,0,0.0
101046,13/12/2023,C0273,Accessories,Charger,"34,08 EUR",1,Paid,2023-12-13,34.08,EUR,34.08,1,34.08,0,0.0,,0,0.0,no_ticket,0,0.0
100787,2023-12-07,C0003,Electronics,NoiseCancel Headphones,"273,02 EUR",1,Pending,2023-12-07,273.02,EUR,273.02,1,273.02,0,0.0,,0,0.0,no_ticket,0,0.0
100523,2023-12-02,C0025,Electronics,Smartphone Z,940.92,1,Paid,2023-12-02,940.92,EUR,940.92,1,940.92,0,0.0,,3,0.0,delivery,0,0.0
100358,2023-11-28,C0001,Accessories,Wireless Mouse,56.52,1,Paid,2023-11-28,56.52,EUR,56.52,1,56.52,0,0.0,,0,0.0,no_ticket,0,0.0
100949,11/12/2023,C0046,Smart Home,NordLock Pro,204.69,1,Paid,2023-12-11,204.69,EUR,204.69,1,204.69,0,0.0,,0,0.0,no_ticket,0,0.0
101041,13/12/2023,C0002,Smart Home,NordLock Pro,219.45,1,Paid,2023-12-13,219.45,EUR,219.45,1,219.45,0,0.0,,0,0.0,no_ticket,0,0.0
100151,2023-11-21,C0002,Electronics,Smartphone Z,"752,21 EUR",1,Paid,2023-11-21,752.21,EUR,752.21,1,752.21,0,0.0,,0,0.0,no_ticket,0,0.0
100529,2023-12-02,C0017,Electronics,Tablet A,326,1,Paid,2023-12-02,326.0,EUR,326.0,1,326.0,0,0.0,,0,0.0,no_ticket,0,0.0
100181,2023-11-22,C0001,Electronics,NoiseCancel Headphones,185.90,1,Pending,2023-11-22,185.9,EUR,185.9,1,185.9,0,0.0,,0,0.0,no_ticket,0,0.0
100292,2023-11-25,C0082,Electronics,NoiseCancel Headphones,"258,19 EUR",2,Paid,2023-11-25,258.19,EUR,258.19,2,516.38,0,0.0,,1,-1.0,defect_quality,0,0.0
100650,2023-12-05,C0054,Smart Home,NordLock Pro,213.11,1,Paid,2023-12-05,213.11,EUR,213.11,1,213.11,1,213.11,Processed,0,0.0,no_ticket,1,1.0
100867,2023-12-09,C0029,Smart Home,NordLock Pro,"209,05 EUR",1,Paid,2023-12-09,209.05,EUR,209.05,1,209.05,0,0.0,,0,0.0,no_ticket,0,0.0
100175,2023-11-22,C0002,Accessories,Laptop Sleeve,"27,74 EUR",1,Paid,2023-11-22,27.74,EUR,27.74,1,27.74,0,0.0,,0,0.0,no_ticket,0,0.0
100743,2023-12-07,C0097,Accessories,Laptop Sleeve,20.81,1,Paid,2023-12-07,20.81,EUR,20.81,1,20.81,0,0.0,,1,0.0,delivery,0,0.0
100258,2023-11-24,C0099,Smart Home,NordLock Pro,"214,74 EUR",1,Paid,2023-11-24,214.74,EUR,214.74,1,214.74,0,0.0,,1,-1.0,delivery,0,0.0
100692,2023-12-06,C0206,Electronics,Laptop X,"1 379,55 EUR",1,Paid,2023-12-06,379.55,EUR,379.55,1,379.55,0,0.0,,0,0.0,no_ticket,0,0.0
100862,2023-12-09,C0003,Accessories,USB-C Cable,"17,87 EUR",1,Paid,2023-12-09,17.87,EUR,17.87,1,17.87,0,0.0,,0,0.0,no_ticket,0,0.0
100022,2023-11-16,C0003,Electronics,NoiseCancel Headphones,"176,57 EUR",1,Paid,2023-11-16,176.57,EUR,176.57,1,176.57,0,0.0,,0,0.0,no_ticket,0,0.0
101013,2023-12-12,C0001,Accessories,USB-C Cable,13,3,Paid,2023-12-12,13.0,EUR,13.0,3,39.0,0,0.0,,0,0.0,no_ticket,0,0.0
101149,06/12/2023,C0009,Smart Home,NordTherm,106.57,1,Failed,2023-12-06,106.57,EUR,106.57,1,106.57,0,0.0,,0,0.0,no_ticket,0,0.0
100783,2023-12-07,C0211,Smart Home,NordLock Pro,"183,60 EUR",1,Pending,2023-12-07,183.6,EUR,183.6,1,183.6,0,0.0,,0,0.0,no_ticket,0,0.0
100482,30/11/2023,C0007,Electronics,NoiseCancel Headphones,"176,13 EUR",1,Paid,2023-11-30,176.13,EUR,176.13,1,176.13,0,0.0,,0,0.0,no_ticket,0,0.0
100475,2023-11-30,C0222,Electronics,NoiseCancel Headphones,"254,73 EUR",1,Paid,2023-11-30,254.73,EUR,254.73,1,254.73,0,0.0,,0,0.0,no_ticket,0,0.0
100804,2023-12-08,C0006,Accessories,Laptop Sleeve,"29,83 EUR",3,Paid,2023-12-08,29.83,EUR,29.83,3,89.49,0,0.0,,0,0.0,no_ticket,0,0.0
100119,2023-11-19,C0001,Accessories,Accessory Bundle,27,2,Paid,2023-11-19,27.0,EUR,27.0,2,54.0,0,0.0,,0,0.0,no_ticket,0,0.0
100179,2023-11-22,C0004,Electronics,Laptop X,1755.32,2,Paid,2023-11-22,1755.32,EUR,1755.32,2,3510.64,0,0.0,,0,0.0,no_ticket,0,0.0
101159,2023-12-12,C0003,Electronics,NoiseCancel Headphones,"308,13 EUR",1,Paid,2023-12-12,308.13,EUR,308.13,1,308.13,0,0.0,,0,0.0,no_ticket,0,0.0
100338,27/11/2023,C0003,Electronics,NoiseCancel Headphones,"321,06 EUR",1,Paid,2023-11-27,321.06,EUR,321.06,1,321.06,0,0.0,,0,0.0,no_ticket,0,0.0
101019,12/12/2023,C0002,Accessories,Accessory Bundle,75,2,Paid,2023-12-12,75.0,EUR,75.0,2,150.0,0,0.0,,0,0.0,no_ticket,0,0.0
100298,2023-11-26,C0006,Electronics,NoiseCancel Headphones,236.41,1,Paid,2023-11-26,236.41,EUR,236.41,1,236.41,0,0.0,,0,0.0,no_ticket,0,0.0
101200,2023-12-11,C0024,Smart Home,NordLock Pro,206,1,Paid,2023-12-11,206.0,EUR,206.0,1,206.0,0,0.0,,1,-2.0,defect_quality,0,0.0
101118,2023-12-14,C0001,Accessories,Accessory Bundle,"78,76 EUR",2,Paid,2023-12-14,78.76,EUR,78.76,2,157.52,0,0.0,,0,0.0,no_ticket,0,0.0
100110,2023-11-19,C0001,Electronics,Smartphone Z,"1007,22 EUR",1,Paid,2023-11-19,1007.22,EUR,1007.22,1,1007.22,0,0.0,,0,0.0,no_ticket,0,0.0
100414,2023-11-29,C0001,Accessories,Screen Protector,8.16,3,Paid,2023-11-29,8.16,EUR,8.16,3,24.48,0,0.0,,0,0.0,no_ticket,0,0.0
101111,2023-12-14,C0002,Smart Home,NordLock Pro,227,1,Paid,2023-12-14,227.0,EUR,227.0,1,227.0,0,0.0,,0,0.0,no_ticket,0,0.0
100543,02/12/2023,C0270,Smart Home,NordLock Pro,"190,15 EUR",1,Paid,2023-12-02,190.15,EUR,190.15,1,190.15,0,0.0,,0,0.0,no_ticket,0,0.0
100888,2023-12-09,C0001,Electronics,Smartphone Z,"897,04 EUR",1,Paid,2023-12-09,897.04,EUR,897.04,1,897.04,0,0.0,,0,0.0,no_ticket,0,0.0
100306,2023-11-26,C0012,Smart Home,NordCam Mini,75,2,Paid,2023-11-26,75.0,EUR,75.0,2,150.0,0,0.0,,1,-2.0,defect_quality,0,0.0
100968,2023-12-11,C0106,Electronics,Laptop X,1406.83,1,Paid,2023-12-11,1406.83,EUR,1406.83,1,1406.83,0,0.0,,2,-0.5,defect_quality,0,0.0
100921,10/12/2023,C0002,Smart Home,NordPlug,16.05,1,Paid,2023-12-10,16.05,EUR,16.05,1,16.05,0,0.0,,0,0.0,no_ticket,0,0.0
100021,2023-11-15,C0006,Smart Home,NordTherm,138.07,1,Paid,2023-11-15,138.07,EUR,138.07,1,138.07,0,0.0,,0,0.0,no_ticket,0,0.0
100981,11/12/2023,C0014,Electronics,Tablet A,543.89,1,Paid,2023-12-11,543.89,EUR,543.89,1,543.89,0,0.0,,0,0.0,no_ticket,0,0.0
100671,2023-12-05,C0010,Smart Home,NordLock Pro,$228.29,1,Paid,2023-12-05,228.29,USD,210.0268,1,210.0268,0,0.0,,0,0.0,no_ticket,0,0.0
101130,14/12/2023,C0002,Accessories,Laptop Sleeve,19,1,Paid,2023-12-14,19.0,EUR,19.0,1,19.0,0,0.0,,0,0.0,no_ticket,0,0.0
100102,2023-11-19,C0010,Accessories,Laptop Sleeve,"24,31 EUR",1,Paid,2023-11-19,24.31,EUR,24.31,1,24.31,0,0.0,,0,0.0,no_ticket,0,0.0
100140,2023-11-21,C0199,Smart Home,NordLock Pro,"222,11 EUR",1,Paid,2023-11-21,222.11,EUR,222.11,1,222.11,1,222.11,Processed,4,-0.75,defect_quality,1,1.0
100224,2023-11-24,C0001,Electronics,TV Pro,"1 442,67 EUR",1,Paid,2023-11-24,442.67,EUR,442.67,1,442.67,0,0.0,,0,0.0,no_ticket,0,0.0
100922,10/12/2023,C0053,Accessories,Charger,35.94,3,Paid,2023-12-10,35.94,EUR,35.94,3,107.82,0,0.0,,0,0.0,no_ticket,0,0.0
100553,2023-12-02,C0019,Smart Home,NordLock Pro,188.09,1,Paid,2023-12-02,188.09,EUR,188.09,1,188.09,0,0.0,,0,0.0,no_ticket,0,0.0
100394,28/11/2023,C0016,Electronics,TV Pro,"1256,68 EUR",1,Paid,2023-11-28,1256.68,EUR,1256.68,1,1256.68,0,0.0,,0,0.0,no_ticket,0,0.0
100461,2023-11-30,C0076,Electronics,Smartphone Z,989.24,2,Paid,2023-11-30,989.24,EUR,989.24,2,1978.48,0,0.0,,0,0.0,no_ticket,0,0.0
100856,2023-12-09,C0001,Accessories,Accessory Bundle,40.96,1,Paid,2023-12-09,40.96,EUR,40.96,1,40.96,0,0.0,,0,0.0,no_ticket,0,0.0
100720,2023-12-06,C0002,Smart Home,NordLock Pro,208,1,Failed,2023-12-06,208.0,EUR,208.0,1,208.0,0,0.0,,0,0.0,no_ticket,0,0.0
100206,2023-11-23,C0002,Electronics,Laptop X,1577,1,Paid,2023-11-23,1577.0,EUR,1577.0,1,1577.0,0,0.0,,0,0.0,no_ticket,0,0.0
100912,10/12/2023,C0001,Electronics,Tablet A,342.14,1,Paid,2023-12-10,342.14,EUR,342.14,1,342.14,0,0.0,,0,0.0,no_ticket,0,0.0
100589,03/12/2023,C0320,Accessories,USB-C Cable,"12,34 EUR",1,Paid,2023-12-03,12.34,EUR,12.34,1,12.34,0,0.0,,0,0.0,no_ticket,0,0.0
100038,2023-11-16,C0002,Accessories,Phone Case,$12.88,2,Paid,2023-11-16,12.88,USD,11.8496,2,23.6992,0,0.0,,0,0.0,no_ticket,0,0.0
101017,12/12/2023,C0002,Accessories,Laptop Sleeve,$21.14,1,Failed,2023-12-12,21.14,USD,19.448800000000002,1,19.448800000000002,0,0.0,,0,0.0,no_ticket,0,0.0
100361,28/11/2023,C0004,Smart Home,NordLock Pro,"246,71 EUR",1,Paid,2023-11-28,246.71,EUR,246.71,1,246.71,0,0.0,,0,0.0,no_ticket,0,0.0
101069,2023-12-13,C0004,Accessories,Accessory Bundle,"82,41 EUR",1,Paid,2023-12-13,82.41,EUR,82.41,1,82.41,0,0.0,,0,0.0,no_ticket,0,0.0
100574,2023-12-03,C0071,Electronics,Smartphone Z,819.94,1,Paid,2023-12-03,819.94,EUR,819.94,1,819.94,0,0.0,,1,0.0,app_connectivity,0,0.0
101089,2023-12-14,C0107,Electronics,TV Pro,"1 209,60 EUR",1,Paid,2023-12-14,209.6,EUR,209.6,1,209.6,0,0.0,,0,0.0,no_ticket,0,0.0
100596,2023-12-04,C0158,Accessories,Charger,19.56,1,Paid,2023-12-04,19.56,EUR,19.56,1,19.56,0,0.0,,1,0.0,app_connectivity,0,0.0
100125,20/11/2023,C0001,Accessories,Accessory Bundle,"52,50 EUR",2,Paid,2023-11-20,52.5,EUR,52.5,2,105.0,0,0.0,,0,0.0,no_ticket,0,0.0
100624,2023-12-04,C0001,Smart Home,NordCam Mini,91,1,Paid,2023-12-04,91.0,EUR,91.0,1,91.0,0,0.0,,0,0.0,no_ticket,0,0.0
100396,29/11/2023,C0296,Accessories,Accessory Bundle,"52,01 EUR",2,Paid,2023-11-29,52.01,EUR,52.01,2,104.02,0,0.0,,0,0.0,no_ticket,0,0.0
100897,10/12/2023,C0110,Smart Home,NordLock Pro,$245.24,1,Paid,2023-12-10,245.24,USD,225.62080000000003,1,225.62080000000003,0,0.0,,0,0.0,no_ticket,0,0.0
100185,22/11/2023,C0001,Smart Home,NordTherm,127.55,1,Paid,2023-11-22,127.55,EUR,127.55,1,127.55,0,0.0,,0,0.0,no_ticket,0,0.0
100056,17/11/2023,C0014,Accessories,Charger,"15,88 EUR",3,Paid,2023-11-17,15.88,EUR,15.88,3,47.64,0,0.0,,0,0.0,no_ticket,0,0.0
100882,2023-12-09,C0003,Electronics,TV Pro,$1195.36,1,Paid,2023-12-09,1195.36,USD,1099.7312,1,1099.7312,0,0.0,,0,0.0,no_ticket,0,0.0
101027,2023-12-12,C0001,Smart Home,NordLock Pro,244,1,Paid,2023-12-12,244.0,EUR,244.0,1,244.0,0,0.0,,0,0.0,no_ticket,0,0.0
101112,14/12/2023,C0001,Accessories,Laptop Sleeve,23.93,1,Paid,2023-12-14,23.93,EUR,23.93,1,23.93,0,0.0,,0,0.0,no_ticket,0,0.0
100166,2023-11-22,C0203,Accessories,USB-C Cable,16.30,3,Paid,2023-11-22,16.3,EUR,16.3,3,48.900000000000006,0,0.0,,0,0.0,no_ticket,0,0.0
101014,12/12/2023,C0291,Smart Home,NordLock Pro,200,2,Paid,2023-12-12,200.0,EUR,200.0,2,400.0,0,0.0,,0,0.0,no_ticket,0,0.0
100116,2023-11-19,C0009,Electronics,Smartphone Z,"1065,43 EUR",1,Paid,2023-11-19,1065.43,EUR,1065.43,1,1065.43,0,0.0,,0,0.0,no_ticket,0,0.0
100311,2023-11-26,C0191,Electronics,NoiseCancel Headphones,318,1,Paid,2023-11-26,318.0,EUR,318.0,1,318.0,0,0.0,,2,-0.5,delivery,0,0.0
100909,2023-12-10,C0080,Electronics,TV Pro,"1355,85 EUR",1,Paid,2023-12-10,1355.85,EUR,1355.85,1,1355.85,0,0.0,,0,0.0,no_ticket,0,0.0
100476,2023-11-30,C0016,Smart Home,NordLock Pro,"223,28 EUR",1,Paid,2023-11-30,223.28,EUR,223.28,1,223.28,0,0.0,,0,0.0,no_ticket,0,0.0
100421,2023-11-29,C0003,Accessories,Screen Protector,"14,39 EUR",1,Paid,2023-11-29,14.39,EUR,14.39,1,14.39,0,0.0,,0,0.0,no_ticket,0,0.0
100199,23/11/2023,C0003,Electronics,NoiseCancel Headphones,234,1,Paid,2023-11-23,234.0,EUR,234.0,1,234.0,0,0.0,,0,0.0,no_ticket,0,0.0
100555,2023-12-02,C0038,Electronics,NoiseCancel Headphones,"246,91 EUR",1,Paid,2023-12-02,246.91,EUR,246.91,1,246.91,0,0.0,,0,0.0,no_ticket,0,0.0
101174,2023-11-29,C0008,Accessories,Screen Protector,8.41,3,Paid,2023-11-29,8.41,EUR,8.41,3,25.23,1,25.23,Processed,0,0.0,no_ticket,1,1.0
100219,2023-11-23,C0249,Electronics,Smartphone Z,903,1,Paid,2023-11-23,903.0,EUR,903.0,1,903.0,0,0.0,,2,-1.0,refund_return,0,0.0
100212,2023-11-23,C0014,Accessories,Screen Protector,6.11,2,Paid,2023-11-23,6.11,EUR,6.11,2,12.22,0,0.0,,0,0.0,no_ticket,0,0.0
100635,04/12/2023,C0003,Electronics,Laptop X,$1648.66,1,Paid,2023-12-04,1648.66,USD,1516.7672000000002,1,1516.7672000000002,0,0.0,,0,0.0,no_ticket,0,0.0
100840,2023-12-08,C0004,Accessories,Wireless Mouse,18.18,1,Paid,2023-12-08,18.18,EUR,18.18,1,18.18,0,0.0,,0,0.0,no_ticket,0,0.0
100727,2023-12-06,C0050,Electronics,Laptop X,1588.34,1,Paid,2023-12-06,1588.34,EUR,1588.34,1,1588.34,1,1588.34,Processed,0,0.0,no_ticket,1,1.0
100055,2023-11-17,C0002,Accessories,Accessory Bundle,"94,78 EUR",1,Pending,2023-11-17,94.78,EUR,94.78,1,94.78,0,0.0,,0,0.0,no_ticket,0,0.0
100532,02/12/2023,C0078,Smart Home,NordLock Pro,185.66,2,Failed,2023-12-02,185.66,EUR,185.66,2,371.32,0,0.0,,0,0.0,no_ticket,0,0.0
100815,2023-12-08,C0282,Smart Home,NordLock Pro,210.20,1,Paid,2023-12-08,210.2,EUR,210.2,1,210.2,1,210.2,Processed,5,-0.6,app_connectivity,1,1.0
100649,2023-12-05,C0300,Accessories,Phone Case,16.63,1,Paid,2023-12-05,16.63,EUR,16.63,1,16.63,0,0.0,,0,0.0,no_ticket,0,0.0
100908,2023-12-10,C0021,Accessories,Phone Case,17.63,1,Paid,2023-12-10,17.63,EUR,17.63,1,17.63,0,0.0,,0,0.0,no_ticket,0,0.0
100571,2023-12-03,C0023,Electronics,Tablet A,$370.25,2,Paid,2023-12-03,370.25,USD,340.63,2,681.26,0,0.0,,1,-1.0,delivery,0,0.0
100927,2023-12-10,C0062,Accessories,Wireless Mouse,32.09,1,Paid,2023-12-10,32.09,EUR,32.09,1,32.09,0,0.0,,1,1.0,app_connectivity,0,0.0
100330,2023-11-27,C0006,Smart Home,NordLock Pro,$180.97,1,Paid,2023-11-27,180.97,USD,166.4924,1,166.4924,0,0.0,,0,0.0,no_ticket,0,0.0
100493,2023-12-01,C0260,Accessories,Charger,"36,46 EUR",2,Paid,2023-12-01,36.46,EUR,36.46,2,72.92,0,0.0,,0,0.0,no_ticket,0,0.0
100691,06/12/2023,C0003,Electronics,Smartphone Z,901.62,1,Paid,2023-12-06,901.62,EUR,901.62,1,901.62,0,0.0,,0,0.0,no_ticket,0,0.0
100751,07/12/2023,C0001,Accessories,Phone Case,"13,03 EUR",1,Paid,2023-12-07,13.03,EUR,13.03,1,13.03,0,0.0,,0,0.0,no_ticket,0,0.0
100832,08/12/2023,C0051,Accessories,Accessory Bundle,40.78,1,Paid,2023-12-08,40.78,EUR,40.78,1,40.78,0,0.0,,0,0.0,no_ticket,0,0.0
100148,2023-11-21,C0001,Electronics,Smartphone Z,935.86,1,Pending,2023-11-21,935.86,EUR,935.86,1,935.86,0,0.0,,0,0.0,no_ticket,0,0.0
100255,2023-11-24,C0034,Electronics,NoiseCancel Headphones,"264,94 EUR",1,Paid,2023-11-24,264.94,EUR,264.94,1,264.94,0,0.0,,0,0.0,no_ticket,0,0.0
100829,2023-12-08,C0013,Smart Home,NordLock Pro,"209,14 EUR",1,Paid,2023-12-08,209.14,EUR,209.14,1,209.14,0,0.0,,1,-2.0,delivery,0,0.0
100566,2023-12-03,C0064,Electronics,Laptop X,1695.77,1,Paid,2023-12-03,1695.77,EUR,1695.77,1,1695.77,0,0.0,,3,-1.6666666666666667,defect_quality,0,0.0
100393,2023-11-28,C0238,Electronics,TV Pro,"1338,77 EUR",1,Paid,2023-11-28,1338.77,EUR,1338.77,1,1338.77,0,0.0,,1,0.0,delivery,0,0.0
100836,2023-12-08,C0181,Smart Home,NordCam Mini,"53,95 EUR",1,Paid,2023-12-08,53.95,EUR,53.95,1,53.95,0,0.0,,0,0.0,no_ticket,0,0.0
101051,2023-12-13,C0002,Electronics,Laptop X,$1696.76,1,Paid,2023-12-13,1696.76,USD,1561.0192,1,1561.0192,0,0.0,,0,0.0,no_ticket,0,0.0
100231,24/11/2023,C0001,Electronics,NoiseCancel Headphones,"182,17 EUR",2,Paid,2023-11-24,182.17,EUR,182.17,2,364.34,0,0.0,,0,0.0,no_ticket,0,0.0
100147,2023-11-21,C0006,Electronics,TV Pro,1399.86,1,Paid,2023-11-21,1399.86,EUR,1399.86,1,1399.86,0,0.0,,0,0.0,no_ticket,0,0.0
101153,2023-11-30,C0004,Electronics,NoiseCancel Headphones,"316,19 EUR",1,Paid,2023-11-30,316.19,EUR,316.19,1,316.19,0,0.0,,0,0.0,no_ticket,0,0.0
100168,2023-11-22,C0021,Accessories,USB-C Cable,"7,78 EUR",1,Paid,2023-11-22,7.78,EUR,7.78,1,7.78,0,0.0,,0,0.0,no_ticket,0,0.0
101185,2023-11-25,C0033,Electronics,Smartphone Z,948.32,1,Paid,2023-11-25,948.32,EUR,948.32,1,948.32,0,0.0,,1,-1.0,delivery,0,0.0
100902,2023-12-10,C0004,Electronics,Smartphone Z,$1084.69,1,Paid,2023-12-10,1084.69,USD,997.9148000000001,1,997.9148000000001,0,0.0,,0,0.0,no_ticket,0,0.0
100599,2023-12-04,C0001,Electronics,NoiseCancel Headphones,$308.58,1,Paid,2023-12-04,308.58,USD,283.8936,1,283.8936,1,308.58,Processed,0,0.0,no_ticket,1,1.0869565217391304
101055,2023-12-13,C0002,Smart Home,NordLock Pro,"246,13 EUR",1,Paid,2023-12-13,246.13,EUR,246.13,1,246.13,0,0.0,,0,0.0,no_ticket,0,0.0
101011,12/12/2023,C0002,Electronics,TV Pro,$1098.61,1,Paid,2023-12-12,1098.61,USD,1010.7212,1,1010.7212,0,0.0,,0,0.0,no_ticket,0,0.0
100557,2023-12-03,C0003,Electronics,NoiseCancel Headphones,186.46,1,Paid,2023-12-03,186.46,EUR,186.46,1,186.46,1,186.46,Processed,0,0.0,no_ticket,1,1.0
100687,05/12/2023,C0006,Accessories,Laptop Sleeve,"33,29 EUR",2,Paid,2023-12-05,33.29,EUR,33.29,2,66.58,0,0.0,,0,0.0,no_ticket,0,0.0
100302,26/11/2023,C0057,Smart Home,NordCam Mini,$96.99,1,Failed,2023-11-26,96.99,USD,89.2308,1,89.2308,0,0.0,,0,0.0,no_ticket,0,0.0
100400,29/11/2023,C0003,Accessories,Laptop Sleeve,36.68,2,Paid,2023-11-29,36.68,EUR,36.68,2,73.36,0,0.0,,0,0.0,no_ticket,0,0.0
100664,05/12/2023,C0012,Accessories,Charger,$47.42,1,Paid,2023-12-05,47.42,USD,43.626400000000004,1,43.626400000000004,0,0.0,,0,0.0,no_ticket,0,0.0
100817,08/12/2023,C0002,Accessories,Phone Case,16.73,2,Paid,2023-12-08,16.73,EUR,16.73,2,33.46,0,0.0,,0,0.0,no_ticket,0,0.0
100652,2023-12-05,C0011,Electronics,Tablet A,"314,93 EUR",1,Paid,2023-12-05,314.93,EUR,314.93,1,314.93,0,0.0,,0,0.0,no_ticket,0,0.0
100163,2023-11-22,C0004,Accessories,Screen Protector,10.08,2,Paid,2023-11-22,10.08,EUR,10.08,2,20.16,0,0.0,,0,0.0,no_ticket,0,0.0
100469,2023-11-30,C0001,Electronics,NoiseCancel Headphones,260.09,1,Paid,2023-11-30,260.09,EUR,260.09,1,260.09,0,0.0,,0,0.0,no_ticket,0,0.0
100762,2023-12-07,C0009,Electronics,NoiseCancel Headphones,"225,04 EUR",1,Paid,2023-12-07,225.04,EUR,225.04,1,225.04,0,0.0,,0,0.0,no_ticket,0,0.0
100598,2023-12-04,C0070,Accessories,Wireless Mouse,"22,02 EUR",1,Paid,2023-12-04,22.02,EUR,22.02,1,22.02,1,0.0,Rejected,1,-1.0,delivery,1,0.0
101044,13/12/2023,C0001,Smart Home,NordLock Pro,"185,80 EUR",1,Paid,2023-12-13,185.8,EUR,185.8,1,185.8,0,0.0,,0,0.0,no_ticket,0,0.0
100348,27/11/2023,C0220,Accessories,Phone Case,"31,01 EUR",4,Paid,2023-11-27,31.01,EUR,31.01,4,124.04,0,0.0,,0,0.0,no_ticket,0,0.0
100572,03/12/2023,C0002,Smart Home,NordLock Pro,"192,26 EUR",1,Paid,2023-12-03,192.26,EUR,192.26,1,192.26,0,0.0,,0,0.0,no_ticket,0,0.0
100281,2023-11-25,C0017,Smart Home,NordCam Mini,"91,10 EUR",1,Paid,2023-11-25,91.1,EUR,91.1,1,91.1,0,0.0,,0,0.0,no_ticket,0,0.0
100899,2023-12-10,C0001,Accessories,USB-C Cable,$8.25,1,Paid,2023-12-10,8.25,USD,7.590000000000001,1,7.590000000000001,0,0.0,,0,0.0,no_ticket,0,0.0
101070,13/12/2023,C0023,Smart Home,NordLock Pro,216.40,1,Paid,2023-12-13,216.4,EUR,216.4,1,216.4,0,0.0,,0,0.0,no_ticket,0,0.0
100716,06/12/2023,C0036,Accessories,Charger,"44,54 EUR",4,Paid,2023-12-06,44.54,EUR,44.54,4,178.16,0,0.0,,0,0.0,no_ticket,0,0.0
100010,2023-11-15,C0001,Accessories,Charger,"32,57 EUR",3,Paid,2023-11-15,32.57,EUR,32.57,3,97.71000000000001,0,0.0,,0,0.0,no_ticket,0,0.0
100764,2023-12-07,C0006,Electronics,Smartphone Z,"998,04 EUR",1,Paid,2023-12-07,998.04,EUR,998.04,1,998.04,0,0.0,,0,0.0,no_ticket,0,0.0
100271,2023-11-25,C0008,Electronics,Laptop X,1718.34,1,Paid,2023-11-25,1718.34,EUR,1718.34,1,1718.34,0,0.0,,0,0.0,no_ticket,0,0.0
100984,11/12/2023,C0124,Electronics,NoiseCancel Headphones,"247,73 EUR",1,Paid,2023-12-11,247.73,EUR,247.73,1,247.73,0,0.0,,0,0.0,no_ticket,0,0.0
100495,2023-12-01,C0004,Electronics,Smartphone Z,$795.93,1,Paid,2023-12-01,795.93,USD,732.2556,1,732.2556,0,0.0,,0,0.0,no_ticket,0,0.0
101022,2023-12-12,C0076,Electronics,Tablet A,"565,36 EUR",1,Paid,2023-12-12,565.36,EUR,565.36,1,565.36,0,0.0,,2,-2.0,app_connectivity,0,0.0
100286,2023-11-25,C0007,Electronics,Tablet A,732.66,1,Paid,2023-11-25,732.66,EUR,732.66,1,732.66,0,0.0,,0,0.0,no_ticket,0,0.0
100542,2023-12-02,C0077,Accessories,Laptop Sleeve,"41,10 EUR",1,Pending,2023-12-02,41.1,EUR,41.1,1,41.1,0,0.0,,0,0.0,no_ticket,0,0.0
100977,2023-12-11,C0017,Smart Home,NordLock Pro,183,1,Paid,2023-12-11,183.0,EUR,183.0,1,183.0,0,0.0,,3,0.3333333333333333,app_connectivity,0,0.0
100445,2023-11-30,C0001,Accessories,Accessory Bundle,"34,98 EUR",1,Paid,2023-11-30,34.98,EUR,34.98,1,34.98,0,0.0,,0,0.0,no_ticket,0,0.0
101180,04/12/2023,C0015,Accessories,Laptop Sleeve,33.86,3,Paid,2023-12-04,33.86,EUR,33.86,3,101.58,0,0.0,,0,0.0,no_ticket,0,0.0
100933,2023-12-11,C0003,Accessories,Laptop Sleeve,41.18,3,Paid,2023-12-11,41.18,EUR,41.18,3,123.53999999999999,0,0.0,,0,0.0,no_ticket,0,0.0
101073,2023-12-13,C0015,Smart Home,NordLock Pro,"214,13 EUR",1,Paid,2023-12-13,214.13,EUR,214.13,1,214.13,0,0.0,,2,-0.5,defect_quality,0,0.0
100100,2023-11-19,C0143,Accessories,Charger,21.14,1,Paid,2023-11-19,21.14,EUR,21.14,1,21.14,0,0.0,,0,0.0,no_ticket,0,0.0
100847,2023-12-09,C0136,Accessories,Laptop Sleeve,43.74,1,Paid,2023-12-09,43.74,EUR,43.74,1,43.74,0,0.0,,0,0.0,no_ticket,0,0.0
100496,2023-12-01,C0032,Electronics,NoiseCancel Headphones,282,1,Paid,2023-12-01,282.0,EUR,282.0,1,282.0,0,0.0,,0,0.0,no_ticket,0,0.0
100433,2023-11-29,C0027,Electronics,NoiseCancel Headphones,306.26,1,Paid,2023-11-29,306.26,EUR,306.26,1,306.26,0,0.0,,0,0.0,no_ticket,0,0.0
100143,21/11/2023,C0002,Accessories,USB-C Cable,7.06,1,Paid,2023-11-21,7.06,EUR,7.06,1,7.06,0,0.0,,0,0.0,no_ticket,0,0.0
101134,2023-12-14,C0002,Smart Home,NordLock Pro,"200,59 EUR",2,Paid,2023-12-14,200.59,EUR,200.59,2,401.18,0,0.0,,0,0.0,no_ticket,0,0.0
101197,2023-11-24,C0065,Smart Home,NordPlug,32.73,1,Paid,2023-11-24,32.73,EUR,32.73,1,32.73,0,0.0,,2,-2.5,defect_quality,0,0.0
100167,2023-11-22,C0001,Electronics,Tablet A,"499,07 EUR",1,Paid,2023-11-22,499.07,EUR,499.07,1,499.07,0,0.0,,0,0.0,no_ticket,0,0.0
100162,2023-11-22,C0081,Electronics,TV Pro,1615.87,1,Paid,2023-11-22,1615.87,EUR,1615.87,1,1615.87,0,0.0,,2,-1.0,app_connectivity,0,0.0
100643,2023-12-04,C0005,Smart Home,NordLock Pro,"244,97 EUR",1,Paid,2023-12-04,244.97,EUR,244.97,1,244.97,0,0.0,,1,-1.0,refund_return,0,0.0
100137,20/11/2023,C0001,Electronics,NoiseCancel Headphones,260.84,2,Paid,2023-11-20,260.84,EUR,260.84,2,521.68,0,0.0,,0,0.0,no_ticket,0,0.0
100878,09/12/2023,C0001,Accessories,Laptop Sleeve,"36,99 EUR",1,Paid,2023-12-09,36.99,EUR,36.99,1,36.99,0,0.0,,0,0.0,no_ticket,0,0.0
100017,2023-11-15,C0003,Accessories,Charger,"26,91 EUR",1,Paid,2023-11-15,26.91,EUR,26.91,1,26.91,0,0.0,,0,0.0,no_ticket,0,0.0
100114,2023-11-19,C0148,Electronics,Tablet A,"457,81 EUR",1,Paid,2023-11-19,457.81,EUR,457.81,1,457.81,0,0.0,,1,-3.0,defect_quality,0,0.0
100008,15/11/2023,C0001,Accessories,Charger,36.45,3,Paid,2023-11-15,36.45,EUR,36.45,3,109.35000000000001,0,0.0,,0,0.0,no_ticket,0,0.0
100196,2023-11-23,C0001,Electronics,Smartphone Z,"1016,16 EUR",1,Paid,2023-11-23,1016.16,EUR,1016.16,1,1016.16,0,0.0,,0,0.0,no_ticket,0,0.0
100866,2023-12-09,C0102,Electronics,NoiseCancel Headphones,"233,49 EUR",1,Paid,2023-12-09,233.49,EUR,233.49,1,233.49,0,0.0,,1,0.0,refund_return,0,0.0
100174,2023-11-22,C0001,Smart Home,NordLock Pro,"215,47 EUR",1,Paid,2023-11-22,215.47,EUR,215.47,1,215.47,0,0.0,,0,0.0,no_ticket,0,0.0
100447,2023-11-30,C0001,Accessories,Accessory Bundle,60,1,Paid,2023-11-30,60.0,EUR,60.0,1,60.0,0,0.0,,0,0.0,no_ticket,0,0.0
100101,2023-11-19,C0001,Accessories,Accessory Bundle,"49,17 EUR",1,Paid,2023-11-19,49.17,EUR,49.17,1,49.17,0,0.0,,0,0.0,no_ticket,0,0.0
101092,14/12/2023,C0244,Smart Home,NordTherm,"83,17 EUR",1,Paid,2023-12-14,83.17,EUR,83.17,1,83.17,0,0.0,,0,0.0,no_ticket,0,0.0
100580,03/12/2023,C0092,Accessories,Screen Protector,"7,07 EUR",2,Paid,2023-12-03,7.07,EUR,7.07,2,14.14,0,0.0,,0,0.0,no_ticket,0,0.0
100474,30/11/2023,C0002,Accessories,Charger,"17,37 EUR",2,Paid,2023-11-30,17.37,EUR,17.37,2,34.74,0,0.0,,0,0.0,no_ticket,0,0.0
100205,2023-11-23,C0024,Electronics,Laptop X,1339.22,1,Paid,2023-11-23,1339.22,EUR,1339.22,1,1339.22,0,0.0,,0,0.0,no_ticket,0,0.0
100581,2023-12-03,C0027,Electronics,NoiseCancel Headphones,"348,89 EUR",2,Paid,2023-12-03,348.89,EUR,348.89,2,697.78,0,0.0,,0,0.0,no_ticket,0,0.0
100157,2023-11-21,C0027,Electronics,Smartphone Z,$787.19,2,Paid,2023-11-21,787.19,USD,724.2148000000001,2,1448.4296000000002,0,0.0,,0,0.0,no_ticket,0,0.0
100894,10/12/2023,C0002,Smart Home,NordLock Pro,"221,02 EUR",1,Paid,2023-12-10,221.02,EUR,221.02,1,221.02,0,0.0,,0,0.0,no_ticket,0,0.0
101040,2023-12-12,C0015,Smart Home,NordLock Pro,"195,56 EUR",1,Paid,2023-12-12,195.56,EUR,195.56,1,195.56,0,0.0,,0,0.0,no_ticket,0,0.0
100486,2023-12-01,C0007,Smart Home,NordLock Pro,237,2,Paid,2023-12-01,237.0,EUR,237.0,2,474.0,0,0.0,,0,0.0,no_ticket,0,0.0
100645,2023-12-04,C0076,Smart Home,NordLock Pro,200.03,1,Paid,2023-12-04,200.03,EUR,200.03,1,200.03,1,200.03,Processed,0,0.0,no_ticket,1,1.0
101140,04/12/2023,C0042,Smart Home,NordLock Pro,"223,67 EUR",2,Paid,2023-12-04,223.67,EUR,223.67,2,447.34,0,0.0,,0,0.0,no_ticket,0,0.0
100712,2023-12-06,C0007,Accessories,Phone Case,"16,50 EUR",3,Paid,2023-12-06,16.5,EUR,16.5,3,49.5,0,0.0,,0,0.0,no_ticket,0,0.0
100928,2023-12-10,C0002,Smart Home,NordCam Mini,59.35,1,Paid,2023-12-10,59.35,EUR,59.35,1,59.35,0,0.0,,0,0.0,no_ticket,0,0.0
101006,2023-12-12,C0187,Electronics,Tablet A,661.51,1,Paid,2023-12-12,661.51,EUR,661.51,1,661.51,0,0.0,,0,0.0,no_ticket,0,0.0
100004,2023-11-15,C0019,Accessories,Phone Case,36.72,1,Paid,2023-11-15,36.72,EUR,36.72,1,36.72,1,36.72,Processed,0,0.0,no_ticket,1,1.0
100378,28/11/2023,C0229,Accessories,Charger,16.51,1,Paid,2023-11-28,16.51,EUR,16.51,1,16.51,0,0.0,,0,0.0,no_ticket,0,0.0
101021,2023-12-12,C0016,Smart Home,NordLock Pro,"182,28 EUR",1,Paid,2023-12-12,182.28,EUR,182.28,1,182.28,0,0.0,,0,0.0,no_ticket,0,0.0
100359,2023-11-28,C0029,Electronics,TV Pro,1552.56,1,Paid,2023-11-28,1552.56,EUR,1552.56,1,1552.56,0,0.0,,0,0.0,no_ticket,0,0.0
100429,29/11/2023,C0001,Accessories,Laptop Sleeve,26,1,Paid,2023-11-29,26.0,EUR,26.0,1,26.0,0,0.0,,0,0.0,no_ticket,0,0.0
100277,2023-11-25,C0008,Electronics,NoiseCancel Headphones,$172.79,1,Paid,2023-11-25,172.79,USD,158.9668,1,158.9668,0,0.0,,0,0.0,no_ticket,0,0.0
100267,2023-11-25,C0182,Smart Home,NordLock Pro,220.58,1,Paid,2023-11-25,220.58,EUR,220.58,1,220.58,0,0.0,,3,-0.6666666666666666,delivery,0,0.0
100860,2023-12-09,C0009,Accessories,USB-C Cable,"7,49 EUR",1,Paid,2023-12-09,7.49,EUR,7.49,1,7.49,0,0.0,,0,0.0,no_ticket,0,0.0
100943,11/12/2023,C0115,Accessories,Charger,15.61,1,Paid,2023-12-11,15.61,EUR,15.61,1,15.61,0,0.0,,0,0.0,no_ticket,0,0.0
100230,24/11/2023,C0003,Smart Home,NordPlug,"30,79 EUR",1,Paid,2023-11-24,30.79,EUR,30.79,1,30.79,0,0.0,,0,0.0,no_ticket,0,0.0
101038,12/12/2023,C0002,Electronics,Laptop X,"1674,10 EUR",1,Paid,2023-12-12,1674.1,EUR,1674.1,1,1674.1,0,0.0,,0,0.0,no_ticket,0,0.0
100719,2023-12-06,C0007,Electronics,NoiseCancel Headphones,"224,64 EUR",1,Paid,2023-12-06,224.64,EUR,224.64,1,224.64,0,0.0,,0,0.0,no_ticket,0,0.0
101009,2023-12-12,C0001,Electronics,NoiseCancel Headphones,"255,44 EUR",1,Pending,2023-12-12,255.44,EUR,255.44,1,255.44,0,0.0,,0,0.0,no_ticket,0,0.0
100446,2023-11-30,C0026,Smart Home,NordLock Pro,"219,40 EUR",1,Paid,2023-11-30,219.4,EUR,219.4,1,219.4,0,0.0,,1,0.0,defect_quality,0,0.0
100761,2023-12-07,C0120,Accessories,Charger,"49,62 EUR",3,Paid,2023-12-07,49.62,EUR,49.62,3,148.85999999999999,0,0.0,,0,0.0,no_ticket,0,0.0
100374,2023-11-28,C0001,Electronics,Tablet A,798.57,1,Paid,2023-11-28,798.57,EUR,798.57,1,798.57,1,798.57,Processed,0,0.0,no_ticket,1,1.0
100826,08/12/2023,C0001,Smart Home,NordLock Pro,$188.48,1,Paid,2023-12-08,188.48,USD,173.4016,1,173.4016,0,0.0,,0,0.0,no_ticket,0,0.0
100695,06/12/2023,C0260,Electronics,Laptop X,"1595,69 EUR",1,Paid,2023-12-06,1595.69,EUR,1595.69,1,1595.69,0,0.0,,0,0.0,no_ticket,0,0.0
100870,2023-12-09,C0005,Smart Home,NordLock Pro,"180,98 EUR",1,Paid,2023-12-09,180.98,EUR,180.98,1,180.98,0,0.0,,0,0.0,no_ticket,0,0.0
100117,19/11/2023,C0001,Electronics,Laptop X,1769.87,1,Pending,2023-11-19,1769.87,EUR,1769.87,1,1769.87,0,0.0,,0,0.0,no_ticket,0,0.0
100223,2023-11-24,C0114,Accessories,Laptop Sleeve,$15.24,1,Paid,2023-11-24,15.24,USD,14.020800000000001,1,14.020800000000001,0,0.0,,1,0.0,defect_quality,0,0.0
100459,2023-11-30,C0004,Accessories,Phone Case,13.42,1,Paid,2023-11-30,13.42,EUR,13.42,1,13.42,0,0.0,,1,0.0,app_connectivity,0,0.0
100618,2023-12-04,C0218,Accessories,Wireless Mouse,24.87,2,Paid,2023-12-04,24.87,EUR,24.87,2,49.74,0,0.0,,0,0.0,no_ticket,0,0.0
101193,2023-12-12,C0187,Electronics,Tablet A,661.51,1,Paid,2023-12-12,661.51,EUR,661.51,1,661.51,1,11.14,Rejected,0,0.0,no_ticket,1,0.01684025940650935
100201,2023-11-23,C0030,Accessories,Phone Case,"36,25 EUR",1,Paid,2023-11-23,36.25,EUR,36.25,1,36.25,0,0.0,,0,0.0,no_ticket,0,0.0
100550,2023-12-02,C0016,Accessories,Wireless Mouse,40.97,1,Paid,2023-12-02,40.97,EUR,40.97,1,40.97,0,0.0,,0,0.0,no_ticket,0,0.0
100654,2023-12-05,C0019,Electronics,Tablet A,466,1,Paid,2023-12-05,466.0,EUR,466.0,1,466.0,0,0.0,,0,0.0,no_ticket,0,0.0
100947,11/12/2023,C0177,Electronics,Laptop X,"1 501,09 EUR",1,Paid,2023-12-11,501.09,EUR,501.09,1,501.09,0,0.0,,0,0.0,no_ticket,0,0.0
100343,27/11/2023,C0060,Accessories,USB-C Cable,20,4,Paid,2023-11-27,20.0,EUR,20.0,4,80.0,0,0.0,,0,0.0,no_ticket,0,0.0
101083,13/12/2023,C0024,Accessories,USB-C Cable,7.31,2,Paid,2023-12-13,7.31,EUR,7.31,2,14.62,0,0.0,,0,0.0,no_ticket,0,0.0
100632,2023-12-04,C0021,Electronics,Tablet A,331.45,1,Paid,2023-12-04,331.45,EUR,331.45,1,331.45,0,0.0,,0,0.0,no_ticket,0,0.0
100006,2023-11-15,C0065,Electronics,Tablet A,"728,62 EUR",1,Paid,2023-11-15,728.62,EUR,728.62,1,728.62,0,0.0,,0,0.0,no_ticket,0,0.0
100109,19/11/2023,C0001,Electronics,NoiseCancel Headphones,"174,17 EUR",1,Paid,2023-11-19,174.17,EUR,174.17,1,174.17,0,0.0,,0,0.0,no_ticket,0,0.0
100502,01/12/2023,C0038,Accessories,Accessory Bundle,55.24,3,Paid,2023-12-01,55.24,EUR,55.24,3,165.72,0,0.0,,0,0.0,no_ticket,0,0.0
100392,2023-11-28,C0026,Accessories,Charger,"28,59 EUR",1,Paid,2023-11-28,28.59,EUR,28.59,1,28.59,0,0.0,,1,-2.0,defect_quality,0,0.0
100942,2023-12-11,C0018,Smart Home,NordLock Pro,"228,75 EUR",1,Paid,2023-12-11,228.75,EUR,228.75,1,228.75,1,228.75,Processed,0,0.0,no_ticket,1,1.0
100518,2023-12-02,C0003,Smart Home,NordTherm,$114.81,1,Paid,2023-12-02,114.81,USD,105.6252,1,105.6252,0,0.0,,0,0.0,no_ticket,0,0.0
100480,2023-11-30,C0001,Electronics,Laptop X,"1688,15 EUR",1,Paid,2023-11-30,1688.15,EUR,1688.15,1,1688.15,0,0.0,,0,0.0,no_ticket,0,0.0
100800,08/12/2023,C0130,Electronics,NoiseCancel Headphones,"218,36 EUR",1,Paid,2023-12-08,218.36,EUR,218.36,1,218.36,0,0.0,,0,0.0,no_ticket,0,0.0
100035,2023-11-16,C0103,Electronics,Laptop X,1462,1,Paid,2023-11-16,1462.0,EUR,1462.0,1,1462.0,0,0.0,,0,0.0,no_ticket,0,0.0
100920,2023-12-10,C0013,Electronics,Smartphone Z,"1052,91 EUR",2,Paid,2023-12-10,1052.91,EUR,1052.91,2,2105.82,0,0.0,,0,0.0,no_ticket,0,0.0
100009,15/11/2023,C0001,Electronics,NoiseCancel Headphones,"250,52 EUR",1,Paid,2023-11-15,250.52,EUR,250.52,1,250.52,0,0.0,,0,0.0,no_ticket,0,0.0
100790,2023-12-07,C0041,Accessories,Laptop Sleeve,25,1,Paid,2023-12-07,25.0,EUR,25.0,1,25.0,0,0.0,,1,0.0,delivery,0,0.0
100527,2023-12-02,C0028,Smart Home,NordLock Pro,"219,22 EUR",1,Failed,2023-12-02,219.22,EUR,219.22,1,219.22,0,0.0,,0,0.0,no_ticket,0,0.0
100232,24/11/2023,C0252,Smart Home,NordLock Pro,249,1,Paid,2023-11-24,249.0,EUR,249.0,1,249.0,0,0.0,,0,0.0,no_ticket,0,0.0
100320,27/11/2023,C0001,Accessories,Laptop Sleeve,$41.30,2,Failed,2023-11-27,41.3,USD,37.996,2,75.992,0,0.0,,0,0.0,no_ticket,0,0.0
100441,2023-11-30,C0303,Accessories,Wireless Mouse,23,1,Paid,2023-11-30,23.0,EUR,23.0,1,23.0,0,0.0,,0,0.0,no_ticket,0,0.0
100526,02/12/2023,C0010,Smart Home,NordLock Pro,196.94,1,Paid,2023-12-02,196.94,EUR,196.94,1,196.94,0,0.0,,0,0.0,no_ticket,0,0.0
100625,2023-12-04,C0001,Accessories,Accessory Bundle,"75,73 EUR",1,Paid,2023-12-04,75.73,EUR,75.73,1,75.73,0,0.0,,0,0.0,no_ticket,0,0.0
100611,2023-12-04,C0024,Accessories,Phone Case,"10,55 EUR",3,Paid,2023-12-04,10.55,EUR,10.55,3,31.650000000000002,0,0.0,,0,0.0,no_ticket,0,0.0
100073,2023-11-18,C0001,Smart Home,NordLock Pro,"230,39 EUR",1,Paid,2023-11-18,230.39,EUR,230.39,1,230.39,0,0.0,,0,0.0,no_ticket,0,0.0
100349,27/11/2023,C0044,Electronics,NoiseCancel Headphones,"157,01 EUR",2,Paid,2023-11-27,157.01,EUR,157.01,2,314.02,0,0.0,,0,0.0,no_ticket,0,0.0
100973,2023-12-11,C0001,Smart Home,NordLock Pro,$186.97,1,Paid,2023-12-11,186.97,USD,172.0124,1,172.0124,0,0.0,,0,0.0,no_ticket,0,0.0
100095,18/11/2023,C0028,Accessories,Phone Case,"27,74 EUR",1,Paid,2023-11-18,27.74,EUR,27.74,1,27.74,0,0.0,,0,0.0,no_ticket,0,0.0
100544,2023-12-02,C0001,Accessories,USB-C Cable,15.85,4,Paid,2023-12-02,15.85,EUR,15.85,4,63.4,0,0.0,,0,0.0,no_ticket,0,0.0
101169,2023-11-30,C0001,Accessories,Wireless Mouse,49.02,1,Paid,2023-11-30,49.02,EUR,49.02,1,49.02,0,0.0,,0,0.0,no_ticket,0,0.0
100210,23/11/2023,C0002,Electronics,Tablet A,367.82,1,Paid,2023-11-23,367.82,EUR,367.82,1,367.82,0,0.0,,0,0.0,no_ticket,0,0.0
100176,2023-11-22,C0007,Electronics,NoiseCancel Headphones,$163.31,1,Failed,2023-11-22,163.31,USD,150.2452,1,150.2452,0,0.0,,0,0.0,no_ticket,0,0.0
100481,2023-11-30,C0003,Accessories,Laptop Sleeve,22,1,Paid,2023-11-30,22.0,EUR,22.0,1,22.0,0,0.0,,0,0.0,no_ticket,0,0.0
100282,25/11/2023,C0035,Electronics,NoiseCancel Headphones,"176,84 EUR",1,Paid,2023-11-25,176.84,EUR,176.84,1,176.84,0,0.0,,0,0.0,no_ticket,0,0.0
100107,2023-11-19,C0001,Accessories,Accessory Bundle,$62.22,1,Paid,2023-11-19,62.22,USD,57.2424,1,57.2424,0,0.0,,0,0.0,no_ticket,0,0.0
101005,2023-12-12,C0003,Accessories,Wireless Mouse,"53,67 EUR",1,Paid,2023-12-12,53.67,EUR,53.67,1,53.67,0,0.0,,1,-1.0,delivery,0,0.0
100834,2023-12-08,C0001,Accessories,Charger,"39,15 EUR",2,Paid,2023-12-08,39.15,EUR,39.15,2,78.3,0,0.0,,0,0.0,no_ticket,0,0.0
100252,2023-11-24,C0312,Accessories,Charger,26,1,Paid,2023-11-24,26.0,EUR,26.0,1,26.0,0,0.0,,2,-0.5,defect_quality,0,0.0
101166,2023-11-17,C0003,Electronics,Tablet A,336.05,2,Paid,2023-11-17,336.05,EUR,336.05,2,672.1,0,0.0,,0,0.0,no_ticket,0,0.0
100390,2023-11-28,C0002,Accessories,Charger,30.55,2,Paid,2023-11-28,30.55,EUR,30.55,2,61.1,0,0.0,,0,0.0,no_ticket,0,0.0
100929,2023-12-10,C0083,Accessories,Phone Case,$22.44,1,Paid,2023-12-10,22.44,USD,20.644800000000004,1,20.644800000000004,0,0.0,,1,-1.0,delivery,0,0.0
100939,2023-12-11,C0001,Accessories,USB-C Cable,$11.22,1,Paid,2023-12-11,11.22,USD,10.322400000000002,1,10.322400000000002,0,0.0,,0,0.0,no_ticket,0,0.0
100328,2023-11-27,C0001,Accessories,Phone Case,10.00,3,Paid,2023-11-27,10.0,EUR,10.0,3,30.0,0,0.0,,0,0.0,no_ticket,0,0.0
100969,2023-12-11,C0006,Accessories,Screen Protector,$13.28,1,Paid,2023-12-11,13.28,USD,12.2176,1,12.2176,0,0.0,,1,0.0,app_connectivity,0,0.0
100013,15/11/2023,C0261,Accessories,Laptop Sleeve,$33.90,2,Paid,2023-11-15,33.9,USD,31.188,2,62.376,0,0.0,,0,0.0,no_ticket,0,0.0
101026,2023-12-12,C0001,Electronics,Smartphone Z,"829,05 EUR",1,Paid,2023-12-12,829.05,EUR,829.05,1,829.05,0,0.0,,0,0.0,no_ticket,0,0.0
100669,05/12/2023,C0002,Smart Home,NordPlug,"31,30 EUR",2,Paid,2023-12-05,31.3,EUR,31.3,2,62.6,0,0.0,,0,0.0,no_ticket,0,0.0
101074,13/12/2023,C0048,Smart Home,NordLock Pro,235.67,1,Paid,2023-12-13,235.67,EUR,235.67,1,235.67,0,0.0,,0,0.0,no_ticket,0,0.0
100937,11/12/2023,C0076,Electronics,Smartphone Z,$889.83,1,Paid,2023-12-11,889.83,USD,818.6436000000001,1,818.6436000000001,0,0.0,,0,0.0,no_ticket,0,0.0
101076,2023-12-13,C0005,Smart Home,NordLock Pro,$187.08,1,Paid,2023-12-13,187.08,USD,172.11360000000002,1,172.11360000000002,0,0.0,,1,-1.0,delivery,0,0.0
100934,2023-12-11,C0002,Accessories,Charger,"38,56 EUR",1,Paid,2023-12-11,38.56,EUR,38.56,1,38.56,0,0.0,,0,0.0,no_ticket,0,0.0
100989,12/12/2023,C0040,Smart Home,NordLock Pro,185.28,2,Paid,2023-12-12,185.28,EUR,185.28,2,370.56,0,0.0,,0,0.0,no_ticket,0,0.0
100214,23/11/2023,C0002,Smart Home,NordLock Pro,$212.69,1,Paid,2023-11-23,212.69,USD,195.6748,1,195.6748,0,0.0,,0,0.0,no_ticket,0,0.0
100217,2023-11-23,C0001,Electronics,Smartphone Z,"706,71 EUR",2,Paid,2023-11-23,706.71,EUR,706.71,2,1413.42,0,0.0,,0,0.0,no_ticket,0,0.0
100917,2023-12-10,C0007,Electronics,TV Pro,$1563.41,1,Paid,2023-12-10,1563.41,USD,1438.3372000000002,1,1438.3372000000002,0,0.0,,0,0.0,no_ticket,0,0.0
100614,2023-12-04,C0002,Accessories,Wireless Mouse,"28,43 EUR",1,Paid,2023-12-04,28.43,EUR,28.43,1,28.43,0,0.0,,0,0.0,no_ticket,0,0.0
100823,2023-12-08,C0001,Smart Home,NordLock Pro,"229,47 EUR",1,Paid,2023-12-08,229.47,EUR,229.47,1,229.47,0,0.0,,0,0.0,no_ticket,0,0.0
100423,29/11/2023,C0021,Accessories,Screen Protector,14.89,2,Paid,2023-11-29,14.89,EUR,14.89,2,29.78,0,0.0,,0,0.0,no_ticket,0,0.0
100999,2023-12-12,C0052,Smart Home,NordLock Pro,"207,41 EUR",1,Paid,2023-12-12,207.41,EUR,207.41,1,207.41,0,0.0,,1,0.0,defect_quality,0,0.0
100568,2023-12-03,C0083,Smart Home,NordCam Mini,63.87,1,Paid,2023-12-03,63.87,EUR,63.87,1,63.87,0,0.0,,1,-2.0,defect_quality,0,0.0
100422,29/11/2023,C0001,Electronics,Laptop X,1419.85,1,Paid,2023-11-29,1419.85,EUR,1419.85,1,1419.85,0,0.0,,0,0.0,no_ticket,0,0.0
100069,2023-11-17,C0006,Accessories,Phone Case,34.42,2,Paid,2023-11-17,34.42,EUR,34.42,2,68.84,0,0.0,,0,0.0,no_ticket,0,0.0
100554,2023-12-02,C0003,Accessories,Accessory Bundle,"84,79 EUR",4,Paid,2023-12-02,84.79,EUR,84.79,4,339.16,0,0.0,,0,0.0,no_ticket,0,0.0
100086,18/11/2023,C0001,Electronics,TV Pro,"1344,25 EUR",1,Paid,2023-11-18,1344.25,EUR,1344.25,1,1344.25,0,0.0,,0,0.0,no_ticket,0,0.0
100247,2023-11-24,C0005,Smart Home,NordLock Pro,229.97,1,Paid,2023-11-24,229.97,EUR,229.97,1,229.97,0,0.0,,0,0.0,no_ticket,0,0.0
100467,30/11/2023,C0001,Electronics,Tablet A,"359,78 EUR",1,Paid,2023-11-30,359.78,EUR,359.78,1,359.78,0,0.0,,0,0.0,no_ticket,0,0.0
100430,29/11/2023,C0099,Electronics,Smartphone Z,1003.81,2,Paid,2023-11-29,1003.81,EUR,1003.81,2,2007.62,0,0.0,,0,0.0,no_ticket,0,0.0
100418,2023-11-29,C0002,Electronics,Smartphone Z,$741.10,1,Paid,2023-11-29,741.1,USD,681.812,1,681.812,0,0.0,,0,0.0,no_ticket,0,0.0
100413,2023-11-29,C0094,Electronics,NoiseCancel Headphones,245,1,Paid,2023-11-29,245.0,EUR,245.0,1,245.0,0,0.0,,0,0.0,no_ticket,0,0.0
100647,2023-12-05,C0071,Electronics,Smartphone Z,"796,55 EUR",1,Paid,2023-12-05,796.55,EUR,796.55,1,796.55,0,0.0,,0,0.0,no_ticket,0,0.0
100197,23/11/2023,C0001,Electronics,Tablet A,"308,88 EUR",1,Paid,2023-11-23,308.88,EUR,308.88,1,308.88,0,0.0,,0,0.0,no_ticket,0,0.0
100226,2023-11-24,C0002,Electronics,TV Pro,1686.65,1,Paid,2023-11-24,1686.65,EUR,1686.65,1,1686.65,0,0.0,,0,0.0,no_ticket,0,0.0
100729,06/12/2023,C0003,Accessories,Charger,$21.85,2,Paid,2023-12-06,21.85,USD,20.102000000000004,2,40.20400000000001,0,0.0,,0,0.0,no_ticket,0,0.0
100285,2023-11-25,C0020,Electronics,TV Pro,"1544,21 EUR",1,Paid,2023-11-25,1544.21,EUR,1544.21,1,1544.21,0,0.0,,1,-2.0,defect_quality,0,0.0
100660,2023-12-05,C0014,Smart Home,NordCam Mini,$89.26,2,Paid,2023-12-05,89.26,USD,82.1192,2,164.2384,0,0.0,,0,0.0,no_ticket,0,0.0
100879,09/12/2023,C0030,Smart Home,NordLock Pro,$202.78,1,Paid,2023-12-09,202.78,USD,186.5576,1,186.5576,0,0.0,,0,0.0,no_ticket,0,0.0
100112,2023-11-19,C0042,Smart Home,NordLock Pro,194,1,Paid,2023-11-19,194.0,EUR,194.0,1,194.0,0,0.0,,0,0.0,no_ticket,0,0.0
100545,2023-12-02,C0032,Electronics,Laptop X,"1364,71 EUR",1,Paid,2023-12-02,1364.71,EUR,1364.71,1,1364.71,0,0.0,,0,0.0,no_ticket,0,0.0
101123,2023-12-14,C0002,Electronics,TV Pro,1327,1,Pending,2023-12-14,1327.0,EUR,1327.0,1,1327.0,0,0.0,,0,0.0,no_ticket,0,0.0
100993,2023-12-12,C0003,Electronics,Tablet A,654.25,1,Paid,2023-12-12,654.25,EUR,654.25,1,654.25,0,0.0,,0,0.0,no_ticket,0,0.0
100685,05/12/2023,C0034,Electronics,TV Pro,"1683,74 EUR",1,Paid,2023-12-05,1683.74,EUR,1683.74,1,1683.74,0,0.0,,0,0.0,no_ticket,0,0.0
100818,2023-12-08,C0033,Electronics,Smartphone Z,900.82,1,Paid,2023-12-08,900.82,EUR,900.82,1,900.82,0,0.0,,2,-1.5,app_connectivity,0,0.0
100381,2023-11-28,C0073,Electronics,Tablet A,"565,48 EUR",1,Paid,2023-11-28,565.48,EUR,565.48,1,565.48,0,0.0,,1,-1.0,refund_return,0,0.0
100500,2023-12-01,C0002,Smart Home,NordLock Pro,214,1,Paid,2023-12-01,214.0,EUR,214.0,1,214.0,0,0.0,,0,0.0,no_ticket,0,0.0
101042,13/12/2023,C0001,Smart Home,NordLock Pro,"245,35 EUR",1,Paid,2023-12-13,245.35,EUR,245.35,1,245.35,0,0.0,,0,0.0,no_ticket,0,0.0
100926,2023-12-10,C0229,Smart Home,NordTherm,$126.44,1,Paid,2023-12-10,126.44,USD,116.3248,1,116.3248,0,0.0,,1,-1.0,defect_quality,0,0.0
100780,2023-12-07,C0003,Accessories,Laptop Sleeve,"36,14 EUR",2,Paid,2023-12-07,36.14,EUR,36.14,2,72.28,0,0.0,,0,0.0,no_ticket,0,0.0
100291,2023-11-25,C0003,Electronics,Smartphone Z,1056.70,1,Paid,2023-11-25,1056.7,EUR,1056.7,1,1056.7,0,0.0,,0,0.0,no_ticket,0,0.0
100389,2023-11-28,C0001,Smart Home,NordLock Pro,210.88,1,Paid,2023-11-28,210.88,EUR,210.88,1,210.88,0,0.0,,0,0.0,no_ticket,0,0.0
100360,2023-11-28,C0001,Electronics,TV Pro,1020.44,1,Paid,2023-11-28,1020.44,EUR,1020.44,1,1020.44,0,0.0,,0,0.0,no_ticket,0,0.0
100407,2023-11-29,C0001,Electronics,Laptop X,$1506.44,1,Paid,2023-11-29,1506.44,USD,1385.9248,1,1385.9248,0,0.0,,0,0.0,no_ticket,0,0.0
100365,2023-11-28,C0023,Electronics,TV Pro,"1015,17 EUR",1,Paid,2023-11-28,1015.17,EUR,1015.17,1,1015.17,1,1015.17,Processed,0,0.0,no_ticket,1,1.0
100525,02/12/2023,C0001,Electronics,Smartphone Z,899,1,Paid,2023-12-02,899.0,EUR,899.0,1,899.0,0,0.0,,0,0.0,no_ticket,0,0.0
100575,2023-12-03,C0203,Electronics,TV Pro,1308.91,1,Paid,2023-12-03,1308.91,EUR,1308.91,1,1308.91,0,0.0,,1,-1.0,delivery,0,0.0
100683,2023-12-05,C0187,Accessories,Accessory Bundle,"87,50 EUR",1,Pending,2023-12-05,87.5,EUR,87.5,1,87.5,0,0.0,,0,0.0,no_ticket,0,0.0
101033,2023-12-12,C0002,Smart Home,NordLock Pro,208,2,Paid,2023-12-12,208.0,EUR,208.0,2,416.0,1,416.0,Processed,0,0.0,no_ticket,1,1.0
100694,2023-12-06,C0002,Electronics,Tablet A,"362,00 EUR",1,Paid,2023-12-06,362.0,EUR,362.0,1,362.0,0,0.0,,0,0.0,no_ticket,0,0.0
100705,06/12/2023,C0083,Smart Home,NordLock Pro,$203.62,1,Paid,2023-12-06,203.62,USD,187.33040000000003,1,187.33040000000003,0,0.0,,0,0.0,no_ticket,0,0.0
100702,2023-12-06,C0149,Electronics,NoiseCancel Headphones,203,1,Paid,2023-12-06,203.0,EUR,203.0,1,203.0,0,0.0,,0,0.0,no_ticket,0,0.0
100113,2023-11-19,C0003,Accessories,Laptop Sleeve,36.03,2,Paid,2023-11-19,36.03,EUR,36.03,2,72.06,0,0.0,,0,0.0,no_ticket,0,0.0
100103,19/11/2023,C0005,Electronics,Tablet A,647.19,1,Paid,2023-11-19,647.19,EUR,647.19,1,647.19,0,0.0,,0,0.0,no_ticket,0,0.0
100415,2023-11-29,C0015,Electronics,NoiseCancel Headphones,327.37,1,Pending,2023-11-29,327.37,EUR,327.37,1,327.37,0,0.0,,0,0.0,no_ticket,0,0.0
100590,2023-12-03,C0003,Electronics,Laptop X,"1488,81 EUR",1,Paid,2023-12-03,1488.81,EUR,1488.81,1,1488.81,0,0.0,,0,0.0,no_ticket,0,0.0
100191,2023-11-23,C0062,Electronics,Tablet A,"382,77 EUR",1,Paid,2023-11-23,382.77,EUR,382.77,1,382.77,0,0.0,,0,0.0,no_ticket,0,0.0
101137,2023-12-14,C0014,Electronics,Laptop X,"1653,81 EUR",1,Paid,2023-12-14,1653.81,EUR,1653.81,1,1653.81,0,0.0,,1,0.0,defect_quality,0,0.0
100957,2023-12-11,C0007,Accessories,Accessory Bundle,"44,45 EUR",1,Paid,2023-12-11,44.45,EUR,44.45,1,44.45,0,0.0,,0,0.0,no_ticket,0,0.0
100741,2023-12-07,C0015,Electronics,NoiseCancel Headphones,$163.13,1,Paid,2023-12-07,163.13,USD,150.0796,1,150.0796,0,0.0,,0,0.0,no_ticket,0,0.0
100053,2023-11-17,C0003,Electronics,NoiseCancel Headphones,"266,47 EUR",1,Paid,2023-11-17,266.47,EUR,266.47,1,266.47,0,0.0,,0,0.0,no_ticket,0,0.0
100029,16/11/2023,C0011,Accessories,Screen Protector,"8,60 EUR",1,Paid,2023-11-16,8.6,EUR,8.6,1,8.6,0,0.0,,0,0.0,no_ticket,0,0.0
100066,2023-11-17,C0048,Electronics,Laptop X,1460,1,Paid,2023-11-17,1460.0,EUR,1460.0,1,1460.0,0,0.0,,1,0.0,app_connectivity,0,0.0
100875,2023-12-09,C0016,Electronics,Tablet A,"496,60 EUR",1,Paid,2023-12-09,496.6,EUR,496.6,1,496.6,0,0.0,,0,0.0,no_ticket,0,0.0
100246,2023-11-24,C0017,Accessories,Phone Case,"34,84 EUR",1,Paid,2023-11-24,34.84,EUR,34.84,1,34.84,0,0.0,,0,0.0,no_ticket,0,0.0
100803,2023-12-08,C0241,Electronics,Tablet A,474.94,1,Paid,2023-12-08,474.94,EUR,474.94,1,474.94,0,0.0,,0,0.0,no_ticket,0,0.0
101078,13/12/2023,C0006,Accessories,Charger,"25,23 EUR",1,Paid,2023-12-13,25.23,EUR,25.23,1,25.23,0,0.0,,0,0.0,no_ticket,0,0.0
101127,14/12/2023,C0001,Accessories,Phone Case,"24,22 EUR",3,Paid,2023-12-14,24.22,EUR,24.22,3,72.66,0,0.0,,0,0.0,no_ticket,0,0.0
100844,2023-12-08,C0067,Electronics,TV Pro,1183.75,1,Paid,2023-12-08,1183.75,EUR,1183.75,1,1183.75,0,0.0,,0,0.0,no_ticket,0,0.0
100595,2023-12-03,C0023,Electronics,NoiseCancel Headphones,$265.61,1,Paid,2023-12-03,265.61,USD,244.36120000000003,1,244.36120000000003,0,0.0,,0,0.0,no_ticket,0,0.0
100309,2023-11-26,C0002,Accessories,Wireless Mouse,"54,66 EUR",4,Paid,2023-11-26,54.66,EUR,54.66,4,218.64,0,0.0,,0,0.0,no_ticket,0,0.0
100903,2023-12-10,C0001,Smart Home,NordLock Pro,228.51,1,Paid,2023-12-10,228.51,EUR,228.51,1,228.51,0,0.0,,0,0.0,no_ticket,0,0.0
100387,28/11/2023,C0001,Accessories,Phone Case,"39,44 EUR",2,Paid,2023-11-28,39.44,EUR,39.44,2,78.88,0,0.0,,0,0.0,no_ticket,0,0.0
100872,09/12/2023,C0003,Electronics,Tablet A,696,1,Paid,2023-12-09,696.0,EUR,696.0,1,696.0,0,0.0,,0,0.0,no_ticket,0,0.0
100355,2023-11-28,C0001,Electronics,Smartphone Z,917.35,2,Paid,2023-11-28,917.35,EUR,917.35,2,1834.7,0,0.0,,0,0.0,no_ticket,0,0.0
101023,2023-12-12,C0001,Accessories,Charger,18.52,1,Paid,2023-12-12,18.52,EUR,18.52,1,18.52,0,0.0,,0,0.0,no_ticket,0,0.0
100160,2023-11-21,C0001,Accessories,Screen Protector,13.38,1,Paid,2023-11-21,13.38,EUR,13.38,1,13.38,0,0.0,,0,0.0,no_ticket,0,0.0
100187,2023-11-22,C0245,Accessories,USB-C Cable,"7,37 EUR",3,Paid,2023-11-22,7.37,EUR,7.37,3,22.11,0,0.0,,0,0.0,no_ticket,0,0.0
100245,2023-11-24,C0041,Electronics,Laptop X,1469,1,Paid,2023-11-24,1469.0,EUR,1469.0,1,1469.0,0,0.0,,0,0.0,no_ticket,0,0.0
101056,2023-12-13,C0009,Electronics,Laptop X,"1 727,39 EUR",1,Paid,2023-12-13,727.39,EUR,727.39,1,727.39,0,0.0,,0,0.0,no_ticket,0,0.0
100076,2023-11-18,C0007,Electronics,Laptop X,1388.82,1,Paid,2023-11-18,1388.82,EUR,1388.82,1,1388.82,0,0.0,,0,0.0,no_ticket,0,0.0
100158,21/11/2023,C0228,Smart Home,NordCam Mini,93,1,Paid,2023-11-21,93.0,EUR,93.0,1,93.0,0,0.0,,0,0.0,no_ticket,0,0.0
100127,20/11/2023,C0064,Accessories,Charger,"21,16 EUR",1,Paid,2023-11-20,21.16,EUR,21.16,1,21.16,0,0.0,,0,0.0,no_ticket,0,0.0
100745,07/12/2023,C0004,Accessories,Screen Protector,10.85,2,Paid,2023-12-07,10.85,EUR,10.85,2,21.7,0,0.0,,0,0.0,no_ticket,0,0.0
100724,06/12/2023,C0002,Electronics,NoiseCancel Headphones,"172,37 EUR",1,Paid,2023-12-06,172.37,EUR,172.37,1,172.37,0,0.0,,0,0.0,no_ticket,0,0.0
100323,2023-11-27,C0006,Accessories,Charger,$34.90,1,Paid,2023-11-27,34.9,USD,32.108,1,32.108,0,0.0,,0,0.0,no_ticket,0,0.0
100874,2023-12-09,C0001,Electronics,Laptop X,"1451,05 EUR",1,Paid,2023-12-09,1451.05,EUR,1451.05,1,1451.05,0,0.0,,0,0.0,no_ticket,0,0.0
101054,2023-12-13,C0114,Electronics,Laptop X,1363.58,1,Paid,2023-12-13,1363.58,EUR,1363.58,1,1363.58,0,0.0,,0,0.0,no_ticket,0,0.0
100805,08/12/2023,C0060,Electronics,TV Pro,1323.10,1,Paid,2023-12-08,1323.1,EUR,1323.1,1,1323.1,0,0.0,,0,0.0,no_ticket,0,0.0
100213,2023-11-23,C0135,Electronics,Tablet A,522.41,1,Paid,2023-11-23,522.41,EUR,522.41,1,522.41,0,0.0,,1,1.0,app_connectivity,0,0.0
100778,07/12/2023,C0001,Accessories,Laptop Sleeve,"27,03 EUR",2,Paid,2023-12-07,27.03,EUR,27.03,2,54.06,0,0.0,,0,0.0,no_ticket,0,0.0
100104,2023-11-19,C0004,Electronics,Laptop X,1568.65,1,Paid,2023-11-19,1568.65,EUR,1568.65,1,1568.65,0,0.0,,0,0.0,no_ticket,0,0.0
100754,2023-12-07,C0006,Accessories,Charger,"30,68 EUR",2,Paid,2023-12-07,30.68,EUR,30.68,2,61.36,0,0.0,,1,-3.0,defect_quality,0,0.0
101110,2023-12-14,C0001,Electronics,Tablet A,386.48,1,Paid,2023-12-14,386.48,EUR,386.48,1,386.48,0,0.0,,0,0.0,no_ticket,0,0.0
100960,2023-12-11,C0001,Electronics,TV Pro,$969.19,1,Paid,2023-12-11,969.19,USD,891.6548000000001,1,891.6548000000001,0,0.0,,0,0.0,no_ticket,0,0.0
100846,2023-12-09,C0054,Accessories,Laptop Sleeve,"41,46 EUR",3,Paid,2023-12-09,41.46,EUR,41.46,3,124.38,0,0.0,,3,-1.6666666666666667,defect_quality,0,0.0
101194,14/12/2023,C0042,Electronics,TV Pro,1610.06,1,Paid,2023-12-14,1610.06,EUR,1610.06,1,1610.06,0,0.0,,0,0.0,no_ticket,0,0.0
100521,02/12/2023,C0002,Smart Home,NordPlug,"16,97 EUR",1,Paid,2023-12-02,16.97,EUR,16.97,1,16.97,0,0.0,,0,0.0,no_ticket,0,0.0
101136,2023-12-14,C0007,Electronics,Smartphone Z,"1070,71 EUR",2,Paid,2023-12-14,1070.71,EUR,1070.71,2,2141.42,0,0.0,,0,0.0,no_ticket,0,0.0
100771,07/12/2023,C0030,Accessories,Laptop Sleeve,20.44,2,Paid,2023-12-07,20.44,EUR,20.44,2,40.88,0,0.0,,0,0.0,no_ticket,0,0.0
100229,2023-11-24,C0002,Accessories,Phone Case,"10,91 EUR",2,Paid,2023-11-24,10.91,EUR,10.91,2,21.82,0,0.0,,0,0.0,no_ticket,0,0.0
100750,2023-12-07,C0003,Smart Home,NordLock Pro,"190,45 EUR",2,Paid,2023-12-07,190.45,EUR,190.45,2,380.9,1,380.9,Processed,0,0.0,no_ticket,1,1.0
100274,25/11/2023,C0012,Electronics,Laptop X,"1 700,98 EUR",1,Paid,2023-11-25,700.98,EUR,700.98,1,700.98,0,0.0,,0,0.0,no_ticket,0,0.0
100876,2023-12-09,C0007,Accessories,USB-C Cable,16.85,3,Paid,2023-12-09,16.85,EUR,16.85,3,50.550000000000004,0,0.0,,0,0.0,no_ticket,0,0.0
100183,22/11/2023,C0094,Smart Home,NordLock Pro,$221.01,1,Paid,2023-11-22,221.01,USD,203.32920000000001,1,203.32920000000001,0,0.0,,0,0.0,no_ticket,0,0.0
100975,11/12/2023,C0001,Smart Home,NordLock Pro,"187,04 EUR",1,Failed,2023-12-11,187.04,EUR,187.04,1,187.04,0,0.0,,0,0.0,no_ticket,0,0.0
101016,2023-12-12,C0001,Electronics,TV Pro,1462.11,1,Paid,2023-12-12,1462.11,EUR,1462.11,1,1462.11,0,0.0,,0,0.0,no_ticket,0,0.0
100198,2023-11-23,C0156,Electronics,NoiseCancel Headphones,"296,85 EUR",1,Paid,2023-11-23,296.85,EUR,296.85,1,296.85,0,0.0,,0,0.0,no_ticket,0,0.0
100794,07/12/2023,C0038,Electronics,Tablet A,$588.66,1,Paid,2023-12-07,588.66,USD,541.5672,1,541.5672,0,0.0,,0,0.0,no_ticket,0,0.0
100670,2023-12-05,C0024,Electronics,NoiseCancel Headphones,250.75,1,Paid,2023-12-05,250.75,EUR,250.75,1,250.75,0,0.0,,0,0.0,no_ticket,0,0.0
100463,2023-11-30,C0013,Accessories,USB-C Cable,"8,39 EUR",1,Paid,2023-11-30,8.39,EUR,8.39,1,8.39,0,0.0,,0,0.0,no_ticket,0,0.0
100452,30/11/2023,C0072,Electronics,Smartphone Z,983.68,1,Paid,2023-11-30,983.68,EUR,983.68,1,983.68,0,0.0,,0,0.0,no_ticket,0,0.0
100090,18/11/2023,C0003,Electronics,Smartphone Z,"717,75 EUR",1,Paid,2023-11-18,717.75,EUR,717.75,1,717.75,0,0.0,,0,0.0,no_ticket,0,0.0
101139,27/11/2023,C0044,Electronics,NoiseCancel Headphones,"157,01 EUR",2,Paid,2023-11-27,157.01,EUR,157.01,2,314.02,0,0.0,,0,0.0,no_ticket,0,0.0
101096,14/12/2023,C0086,Smart Home,NordCam Mini,"85,43 EUR",1,Paid,2023-12-14,85.43,EUR,85.43,1,85.43,0,0.0,,0,0.0,no_ticket,0,0.0
100487,2023-12-01,C0240,Accessories,Accessory Bundle,"27,89 EUR",1,Paid,2023-12-01,27.89,EUR,27.89,1,27.89,1,27.89,Processed,1,-2.0,defect_quality,1,1.0
100051,2023-11-17,C0006,Electronics,Tablet A,"740,00 EUR",1,Paid,2023-11-17,740.0,EUR,740.0,1,740.0,0,0.0,,0,0.0,no_ticket,0,0.0
100700,2023-12-06,C0001,Electronics,Tablet A,549.96,1,Failed,2023-12-06,549.96,EUR,549.96,1,549.96,0,0.0,,0,0.0,no_ticket,0,0.0
100854,2023-12-09,C0084,Accessories,Wireless Mouse,26,1,Paid,2023-12-09,26.0,EUR,26.0,1,26.0,0,0.0,,1,-1.0,defect_quality,0,0.0
100416,2023-11-29,C0125,Accessories,Laptop Sleeve,39.40,3,Paid,2023-11-29,39.4,EUR,39.4,3,118.19999999999999,0,0.0,,0,0.0,no_ticket,0,0.0
100677,05/12/2023,C0207,Electronics,Smartphone Z,"735,52 EUR",1,Paid,2023-12-05,735.52,EUR,735.52,1,735.52,0,0.0,,0,0.0,no_ticket,0,0.0
100367,28/11/2023,C0016,Electronics,Tablet A,"740,02 EUR",1,Paid,2023-11-28,740.02,EUR,740.02,1,740.02,0,0.0,,0,0.0,no_ticket,0,0.0
100535,02/12/2023,C0001,Smart Home,NordLock Pro,"220,39 EUR",1,Paid,2023-12-02,220.39,EUR,220.39,1,220.39,0,0.0,,0,0.0,no_ticket,0,0.0
100831,08/12/2023,C0042,Electronics,Laptop X,1620.72,1,Paid,2023-12-08,1620.72,EUR,1620.72,1,1620.72,0,0.0,,0,0.0,no_ticket,0,0.0
100235,2023-11-24,C0002,Electronics,Tablet A,386.12,1,Paid,2023-11-24,386.12,EUR,386.12,1,386.12,0,0.0,,0,0.0,no_ticket,0,0.0
100490,01/12/2023,C0001,Accessories,Laptop Sleeve,34.29,1,Paid,2023-12-01,34.29,EUR,34.29,1,34.29,0,0.0,,0,0.0,no_ticket,0,0.0
100681,2023-12-05,C0002,Electronics,Laptop X,$1495.01,1,Paid,2023-12-05,1495.01,USD,1375.4092,1,1375.4092,0,0.0,,0,0.0,no_ticket,0,0.0
101007,2023-12-12,C0008,Electronics,Tablet A,"332,54 EUR",1,Paid,2023-12-12,332.54,EUR,332.54,1,332.54,0,0.0,,0,0.0,no_ticket,0,0.0
100868,2023-12-09,C0002,Smart Home,NordLock Pro,187,2,Paid,2023-12-09,187.0,EUR,187.0,2,374.0,1,374.0,Processed,0,0.0,no_ticket,1,1.0
100582,2023-12-03,C0257,Electronics,Laptop X,1783.31,1,Failed,2023-12-03,1783.31,EUR,1783.31,1,1783.31,0,0.0,,0,0.0,no_ticket,0,0.0
100402,2023-11-29,C0022,Electronics,Laptop X,1456.95,2,Paid,2023-11-29,1456.95,EUR,1456.95,2,2913.9,0,0.0,,0,0.0,no_ticket,0,0.0
100699,06/12/2023,C0057,Accessories,Screen Protector,"6,05 EUR",1,Paid,2023-12-06,6.05,EUR,6.05,1,6.05,0,0.0,,0,0.0,no_ticket,0,0.0
100738,07/12/2023,C0138,Accessories,Charger,"34,63 EUR",1,Paid,2023-12-07,34.63,EUR,34.63,1,34.63,0,0.0,,0,0.0,no_ticket,0,0.0
100439,2023-11-30,C0001,Smart Home,NordLock Pro,"216,05 EUR",1,Paid,2023-11-30,216.05,EUR,216.05,1,216.05,0,0.0,,0,0.0,no_ticket,0,0.0
100528,02/12/2023,C0239,Accessories,Wireless Mouse,"33,63 EUR",2,Paid,2023-12-02,33.63,EUR,33.63,2,67.26,0,0.0,,0,0.0,no_ticket,0,0.0
100995,12/12/2023,C0041,Accessories,Accessory Bundle,"96,03 EUR",3,Paid,2023-12-12,96.03,EUR,96.03,3,288.09000000000003,0,0.0,,0,0.0,no_ticket,0,0.0
100369,28/11/2023,C0006,Electronics,Laptop X,1403.95,1,Paid,2023-11-28,1403.95,EUR,1403.95,1,1403.95,0,0.0,,0,0.0,no_ticket,0,0.0
100877,2023-12-09,C0002,Smart Home,NordLock Pro,"218,56 EUR",1,Paid,2023-12-09,218.56,EUR,218.56,1,218.56,0,0.0,,0,0.0,no_ticket,0,0.0
100718,2023-12-06,C0109,Smart Home,NordLock Pro,$195.57,1,Failed,2023-12-06,195.57,USD,179.9244,1,179.9244,0,0.0,,0,0.0,no_ticket,0,0.0
100864,2023-12-09,C0001,Accessories,Laptop Sleeve,23,1,Paid,2023-12-09,23.0,EUR,23.0,1,23.0,0,0.0,,0,0.0,no_ticket,0,0.0
100152,21/11/2023,C0056,Accessories,Laptop Sleeve,$19.03,1,Paid,2023-11-21,19.03,USD,17.5076,1,17.5076,0,0.0,,0,0.0,no_ticket,0,0.0
101171,06/12/2023,C0009,Smart Home,NordTherm,106.57,1,Failed,2023-12-06,106.57,EUR,106.57,1,106.57,0,0.0,,0,0.0,no_ticket,0,0.0
100133,20/11/2023,C0001,Accessories,USB-C Cable,$18.72,3,Paid,2023-11-20,18.72,USD,17.2224,3,51.6672,0,0.0,,0,0.0,no_ticket,0,0.0
100739,2023-12-07,C0061,Electronics,Smartphone Z,$1073.23,1,Paid,2023-12-07,1073.23,USD,987.3716000000001,1,987.3716000000001,0,0.0,,0,0.0,no_ticket,0,0.0
100030,2023-11-16,C0027,Accessories,USB-C Cable,$7.17,2,Paid,2023-11-16,7.17,USD,6.5964,2,13.1928,0,0.0,,0,0.0,no_ticket,0,0.0
100640,2023-12-04,C0257,Smart Home,NordLock Pro,"224,35 EUR",1,Paid,2023-12-04,224.35,EUR,224.35,1,224.35,0,0.0,,2,-1.0,defect_quality,0,0.0
100941,11/12/2023,C0004,Accessories,USB-C Cable,16,1,Paid,2023-12-11,16.0,EUR,16.0,1,16.0,0,0.0,,0,0.0,no_ticket,0,0.0
100239,2023-11-24,C0126,Accessories,USB-C Cable,"9,10 EUR",1,Paid,2023-11-24,9.1,EUR,9.1,1,9.1,0,0.0,,4,-1.0,defect_quality,0,0.0
100674,2023-12-05,C0002,Electronics,Laptop X,"1614,66 EUR",1,Paid,2023-12-05,1614.66,EUR,1614.66,1,1614.66,0,0.0,,0,0.0,no_ticket,0,0.0
101170,2023-11-17,C0157,Electronics,Tablet A,479,1,Paid,2023-11-17,479.0,EUR,479.0,1,479.0,0,0.0,,0,0.0,no_ticket,0,0.0
100774,2023-12-07,C0058,Smart Home,NordLock Pro,248.12,1,Paid,2023-12-07,248.12,EUR,248.12,1,248.12,0,0.0,,3,0.6666666666666666,defect_quality,0,0.0
101010,2023-12-12,C0016,Accessories,Laptop Sleeve,15.70,3,Paid,2023-12-12,15.7,EUR,15.7,3,47.099999999999994,0,0.0,,1,-1.0,defect_quality,0,0.0
100324,2023-11-27,C0002,Accessories,Screen Protector,12.57,4,Paid,2023-11-27,12.57,EUR,12.57,4,50.28,0,0.0,,0,0.0,no_ticket,0,0.0
100629,04/12/2023,C0002,Smart Home,NordTherm,"117,11 EUR",1,Paid,2023-12-04,117.11,EUR,117.11,1,117.11,0,0.0,,0,0.0,no_ticket,0,0.0
101144,2023-12-03,C0012,Accessories,Wireless Mouse,"51,21 EUR",1,Pending,2023-12-03,51.21,EUR,51.21,1,51.21,0,0.0,,0,0.0,no_ticket,0,0.0
100855,2023-12-09,C0005,Electronics,NoiseCancel Headphones,190.71,1,Paid,2023-12-09,190.71,EUR,190.71,1,190.71,0,0.0,,0,0.0,no_ticket,0,0.0
100770,07/12/2023,C0001,Accessories,Phone Case,27.76,1,Paid,2023-12-07,27.76,EUR,27.76,1,27.76,0,0.0,,0,0.0,no_ticket,0,0.0
100746,2023-12-07,C0198,Smart Home,NordLock Pro,"235,60 EUR",1,Paid,2023-12-07,235.6,EUR,235.6,1,235.6,0,0.0,,1,1.0,defect_quality,0,0.0
101165,2023-12-11,C0002,Accessories,Charger,"38,56 EUR",1,Paid,2023-12-11,38.56,EUR,38.56,1,38.56,1,10.75,Rejected,1,-1.0,delivery,1,0.2787863070539419
101138,2023-11-28,C0237,Smart Home,NordLock Pro,$208.61,2,Paid,2023-11-28,208.61,USD,191.92120000000003,2,383.84240000000005,0,0.0,,0,0.0,no_ticket,0,0.0
100380,28/11/2023,C0031,Electronics,TV Pro,$1095.55,1,Paid,2023-11-28,1095.55,USD,1007.906,1,1007.906,0,0.0,,0,0.0,no_ticket,0,0.0
100559,03/12/2023,C0001,Accessories,Wireless Mouse,35.34,3,Paid,2023-12-03,35.34,EUR,35.34,3,106.02000000000001,0,0.0,,0,0.0,no_ticket,0,0.0
100516,2023-12-02,C0003,Accessories,Screen Protector,12,2,Paid,2023-12-02,12.0,EUR,12.0,2,24.0,0,0.0,,0,0.0,no_ticket,0,0.0
100881,2023-12-09,C0267,Smart Home,NordLock Pro,"228,02 EUR",1,Paid,2023-12-09,228.02,EUR,228.02,1,228.02,0,0.0,,2,-1.0,delivery,0,0.0
100952,11/12/2023,C0001,Accessories,USB-C Cable,$13.80,2,Paid,2023-12-11,13.8,USD,12.696000000000002,2,25.392000000000003,0,0.0,,0,0.0,no_ticket,0,0.0
101008,12/12/2023,C0004,Smart Home,NordLock Pro,242.09,1,Paid,2023-12-12,242.09,EUR,242.09,1,242.09,0,0.0,,0,0.0,no_ticket,0,0.0
100748,2023-12-07,C0002,Accessories,Accessory Bundle,$84.53,1,Paid,2023-12-07,84.53,USD,77.7676,1,77.7676,0,0.0,,1,-1.0,app_connectivity,0,0.0
100031,16/11/2023,C0001,Accessories,Charger,"44,80 EUR",1,Failed,2023-11-16,44.8,EUR,44.8,1,44.8,0,0.0,,0,0.0,no_ticket,0,0.0
100667,2023-12-05,C0001,Accessories,Laptop Sleeve,"26,60 EUR",1,Paid,2023-12-05,26.6,EUR,26.6,1,26.6,0,0.0,,0,0.0,no_ticket,0,0.0
101186,2023-12-12,C0001,Accessories,USB-C Cable,13,3,Paid,2023-12-12,13.0,EUR,13.0,3,39.0,0,0.0,,0,0.0,no_ticket,0,0.0
100351,2023-11-27,C0002,Electronics,Laptop X,$1494.48,1,Paid,2023-11-27,1494.48,USD,1374.9216000000001,1,1374.9216000000001,0,0.0,,0,0.0,no_ticket,0,0.0
101172,22/11/2023,C0094,Smart Home,NordLock Pro,$221.01,1,Paid,2023-11-22,221.01,USD,203.32920000000001,1,203.32920000000001,0,0.0,,0,0.0,no_ticket,0,0.0
101036,2023-12-12,C0035,Accessories,Laptop Sleeve,28,1,Paid,2023-12-12,28.0,EUR,28.0,1,28.0,0,0.0,,0,0.0,no_ticket,0,0.0
100792,2023-12-07,C0003,Smart Home,NordLock Pro,$246.21,1,Paid,2023-12-07,246.21,USD,226.5132,1,226.5132,0,0.0,,0,0.0,no_ticket,0,0.0
100052,17/11/2023,C0003,Accessories,Screen Protector,12.69,1,Paid,2023-11-17,12.69,EUR,12.69,1,12.69,0,0.0,,0,0.0,no_ticket,0,0.0
100508,2023-12-01,C0001,Smart Home,NordLock Pro,$225.99,2,Pending,2023-12-01,225.99,USD,207.91080000000002,2,415.82160000000005,0,0.0,,0,0.0,no_ticket,0,0.0
100037,2023-11-16,C0055,Smart Home,NordLock Pro,"222,22 EUR",1,Paid,2023-11-16,222.22,EUR,222.22,1,222.22,0,0.0,,0,0.0,no_ticket,0,0.0
100610,2023-12-04,C0004,Smart Home,NordPlug,"32,97 EUR",2,Paid,2023-12-04,32.97,EUR,32.97,2,65.94,0,0.0,,0,0.0,no_ticket,0,0.0
100079,18/11/2023,C0011,Accessories,Laptop Sleeve,44,1,Paid,2023-11-18,44.0,EUR,44.0,1,44.0,0,0.0,,0,0.0,no_ticket,0,0.0
100014,2023-11-15,C0115,Accessories,Charger,19.07,1,Paid,2023-11-15,19.07,EUR,19.07,1,19.07,0,0.0,,0,0.0,no_ticket,0,0.0
100676,2023-12-05,C0025,Electronics,NoiseCancel Headphones,247,1,Failed,2023-12-05,247.0,EUR,247.0,1,247.0,0,0.0,,0,0.0,no_ticket,0,0.0
100059,2023-11-17,C0157,Electronics,Tablet A,479,1,Paid,2023-11-17,479.0,EUR,479.0,1,479.0,0,0.0,,1,-1.0,defect_quality,0,0.0
100576,03/12/2023,C0023,Electronics,Smartphone Z,976.35,1,Paid,2023-12-03,976.35,EUR,976.35,1,976.35,0,0.0,,0,0.0,no_ticket,0,0.0
100234,2023-11-24,C0003,Electronics,Tablet A,"525,74 EUR",1,Paid,2023-11-24,525.74,EUR,525.74,1,525.74,0,0.0,,0,0.0,no_ticket,0,0.0
100744,2023-12-07,C0001,Smart Home,NordCam Mini,"58,18 EUR",1,Failed,2023-12-07,58.18,EUR,58.18,1,58.18,0,0.0,,0,0.0,no_ticket,0,0.0
100479,2023-11-30,C0003,Accessories,Accessory Bundle,$92.28,1,Paid,2023-11-30,92.28,USD,84.89760000000001,1,84.89760000000001,0,0.0,,0,0.0,no_ticket,0,0.0
101000,12/12/2023,C0009,Smart Home,NordLock Pro,"191,58 EUR",1,Pending,2023-12-12,191.58,EUR,191.58,1,191.58,0,0.0,,0,0.0,no_ticket,0,0.0
100194,2023-11-23,C0055,Electronics,TV Pro,"965,81 EUR",1,Pending,2023-11-23,965.81,EUR,965.81,1,965.81,0,0.0,,0,0.0,no_ticket,0,0.0
100405,2023-11-29,C0204,Accessories,Phone Case,24,1,Paid,2023-11-29,24.0,EUR,24.0,1,24.0,0,0.0,,0,0.0,no_ticket,0,0.0
100884,09/12/2023,C0009,Electronics,TV Pro,1041.39,1,Paid,2023-12-09,1041.39,EUR,1041.39,1,1041.39,0,0.0,,0,0.0,no_ticket,0,0.0
100488,2023-12-01,C0003,Smart Home,NordTherm,"109,04 EUR",1,Paid,2023-12-01,109.04,EUR,109.04,1,109.04,0,0.0,,0,0.0,no_ticket,0,0.0
100472,2023-11-30,C0009,Accessories,Phone Case,26,1,Paid,2023-11-30,26.0,EUR,26.0,1,26.0,0,0.0,,0,0.0,no_ticket,0,0.0
100257,2023-11-24,C0013,Accessories,Accessory Bundle,40.65,3,Paid,2023-11-24,40.65,EUR,40.65,3,121.94999999999999,0,0.0,,2,0.0,delivery,0,0.0
100895,2023-12-10,C0014,Electronics,Laptop X,1779,1,Paid,2023-12-10,1779.0,EUR,1779.0,1,1779.0,0,0.0,,0,0.0,no_ticket,0,0.0
101091,2023-12-14,C0001,Electronics,NoiseCancel Headphones,$158.87,1,Paid,2023-12-14,158.87,USD,146.1604,1,146.1604,0,0.0,,0,0.0,no_ticket,0,0.0
100139,21/11/2023,C0198,Electronics,Smartphone Z,798.87,1,Paid,2023-11-21,798.87,EUR,798.87,1,798.87,0,0.0,,0,0.0,no_ticket,0,0.0
100492,01/12/2023,C0025,Electronics,TV Pro,1384.66,1,Paid,2023-12-01,1384.66,EUR,1384.66,1,1384.66,0,0.0,,0,0.0,no_ticket,0,0.0
100579,2023-12-03,C0045,Accessories,Accessory Bundle,86.12,2,Paid,2023-12-03,86.12,EUR,86.12,2,172.24,0,0.0,,0,0.0,no_ticket,0,0.0
100707,2023-12-06,C0029,Accessories,Wireless Mouse,41.44,1,Paid,2023-12-06,41.44,EUR,41.44,1,41.44,0,0.0,,0,0.0,no_ticket,0,0.0
100207,2023-11-23,C0244,Electronics,Laptop X,"1 442,20 EUR",1,Paid,2023-11-23,442.2,EUR,442.2,1,442.2,0,0.0,,2,0.0,app_connectivity,0,0.0
100849,09/12/2023,C0026,Accessories,Laptop Sleeve,"17,69 EUR",1,Paid,2023-12-09,17.69,EUR,17.69,1,17.69,0,0.0,,0,0.0,no_ticket,0,0.0
101179,2023-11-22,C0245,Accessories,USB-C Cable,"7,37 EUR",3,Paid,2023-11-22,7.37,EUR,7.37,3,22.11,0,0.0,,0,0.0,no_ticket,0,0.0
100001,15/11/2023,C0001,Accessories,Phone Case,$13.56,2,Paid,2023-11-15,13.56,USD,12.475200000000001,2,24.950400000000002,0,0.0,,0,0.0,no_ticket,0,0.0
100227,2023-11-24,C0015,Accessories,Screen Protector,"13,01 EUR",3,Paid,2023-11-24,13.01,EUR,13.01,3,39.03,0,0.0,,0,0.0,no_ticket,0,0.0
100250,2023-11-24,C0057,Smart Home,NordLock Pro,203.53,1,Paid,2023-11-24,203.53,EUR,203.53,1,203.53,0,0.0,,0,0.0,no_ticket,0,0.0
100890,2023-12-09,C0001,Smart Home,NordPlug,"31,47 EUR",1,Paid,2023-12-09,31.47,EUR,31.47,1,31.47,0,0.0,,0,0.0,no_ticket,0,0.0
100706,2023-12-06,C0010,Smart Home,NordLock Pro,$181.27,1,Paid,2023-12-06,181.27,USD,166.7684,1,166.7684,0,0.0,,0,0.0,no_ticket,0,0.0
100980,11/12/2023,C0145,Accessories,Screen Protector,"5,13 EUR",4,Paid,2023-12-11,5.13,EUR,5.13,4,20.52,0,0.0,,0,0.0,no_ticket,0,0.0
101030,12/12/2023,C0005,Electronics,Laptop X,"1456,47 EUR",1,Paid,2023-12-12,1456.47,EUR,1456.47,1,1456.47,0,0.0,,0,0.0,no_ticket,0,0.0
100284,2023-11-25,C0001,Electronics,Tablet A,$671.18,1,Paid,2023-11-25,671.18,USD,617.4856,1,617.4856,0,0.0,,0,0.0,no_ticket,0,0.0
100314,2023-11-26,C0004,Smart Home,NordCam Mini,$87.73,1,Paid,2023-11-26,87.73,USD,80.7116,1,80.7116,0,0.0,,0,0.0,no_ticket,0,0.0
100597,2023-12-04,C0176,Accessories,Phone Case,36.31,1,Paid,2023-12-04,36.31,EUR,36.31,1,36.31,0,0.0,,1,-2.0,defect_quality,0,0.0
100060,17/11/2023,C0048,Accessories,Phone Case,31.47,2,Paid,2023-11-17,31.47,EUR,31.47,2,62.94,0,0.0,,0,0.0,no_ticket,0,0.0
100048,2023-11-17,C0068,Electronics,Laptop X,1571,1,Pending,2023-11-17,1571.0,EUR,1571.0,1,1571.0,0,0.0,,0,0.0,no_ticket,0,0.0
101122,2023-12-14,C0082,Electronics,Smartphone Z,"700,68 EUR",1,Pending,2023-12-14,700.68,EUR,700.68,1,700.68,0,0.0,,0,0.0,no_ticket,0,0.0
101080,13/12/2023,C0158,Accessories,Accessory Bundle,61.58,1,Paid,2023-12-13,61.58,EUR,61.58,1,61.58,0,0.0,,0,0.0,no_ticket,0,0.0
100987,11/12/2023,C0028,Smart Home,NordLock Pro,188,1,Paid,2023-12-11,188.0,EUR,188.0,1,188.0,0,0.0,,0,0.0,no_ticket,0,0.0
100970,2023-12-11,C0001,Electronics,NoiseCancel Headphones,164.02,1,Paid,2023-12-11,164.02,EUR,164.02,1,164.02,0,0.0,,0,0.0,no_ticket,0,0.0
101157,2023-12-10,C0224,Accessories,Accessory Bundle,47.39,1,Paid,2023-12-10,47.39,EUR,47.39,1,47.39,0,0.0,,1,0.0,app_connectivity,0,0.0
101145,2023-11-30,C0008,Electronics,Tablet A,$355.20,1,Paid,2023-11-30,355.2,USD,326.784,1,326.784,0,0.0,,0,0.0,no_ticket,0,0.0
100759,2023-12-07,C0004,Electronics,Smartphone Z,$1086.15,2,Paid,2023-12-07,1086.15,USD,999.2580000000002,2,1998.5160000000003,0,0.0,,0,0.0,no_ticket,0,0.0
100979,11/12/2023,C0003,Accessories,Phone Case,13.89,1,Paid,2023-12-11,13.89,EUR,13.89,1,13.89,0,0.0,,0,0.0,no_ticket,0,0.0
101113,14/12/2023,C0074,Electronics,Laptop X,"1 396,43 EUR",1,Paid,2023-12-14,396.43,EUR,396.43,1,396.43,0,0.0,,0,0.0,no_ticket,0,0.0
100313,2023-11-26,C0003,Electronics,Smartphone Z,955.30,1,Paid,2023-11-26,955.3,EUR,955.3,1,955.3,0,0.0,,0,0.0,no_ticket,0,0.0
100092,18/11/2023,C0001,Electronics,TV Pro,$1264.20,1,Paid,2023-11-18,1264.2,USD,1163.064,1,1163.064,0,0.0,,0,0.0,no_ticket,0,0.0
100722,2023-12-06,C0007,Accessories,USB-C Cable,12.52,4,Paid,2023-12-06,12.52,EUR,12.52,4,50.08,0,0.0,,0,0.0,no_ticket,0,0.0
100735,2023-12-06,C0001,Electronics,NoiseCancel Headphones,"206,95 EUR",1,Paid,2023-12-06,206.95,EUR,206.95,1,206.95,0,0.0,,0,0.0,no_ticket,0,0.0
100812,2023-12-08,C0006,Electronics,Tablet A,$470.11,2,Paid,2023-12-08,470.11,USD,432.50120000000004,2,865.0024000000001,1,940.22,Processed,0,0.0,no_ticket,1,1.0869565217391304
100460,2023-11-30,C0002,Electronics,Smartphone Z,"1 062,04 EUR",1,Paid,2023-11-30,62.04,EUR,62.04,1,62.04,0,0.0,,0,0.0,no_ticket,0,0.0
101125,2023-12-14,C0023,Smart Home,NordLock Pro,226.29,1,Paid,2023-12-14,226.29,EUR,226.29,1,226.29,0,0.0,,0,0.0,no_ticket,0,0.0
100850,2023-12-09,C0005,Accessories,Screen Protector,"6,80 EUR",2,Paid,2023-12-09,6.8,EUR,6.8,2,13.6,0,0.0,,0,0.0,no_ticket,0,0.0
100384,2023-11-28,C0051,Electronics,Tablet A,770,1,Paid,2023-11-28,770.0,EUR,770.0,1,770.0,0,0.0,,2,-1.0,refund_return,0,0.0
100018,2023-11-15,C0009,Accessories,Wireless Mouse,57.97,1,Paid,2023-11-15,57.97,EUR,57.97,1,57.97,0,0.0,,0,0.0,no_ticket,0,0.0
100956,11/12/2023,C0014,Electronics,Tablet A,"743,70 EUR",1,Paid,2023-12-11,743.7,EUR,743.7,1,743.7,0,0.0,,0,0.0,no_ticket,0,0.0
101077,2023-12-13,C0001,Accessories,Charger,46.12,2,Paid,2023-12-13,46.12,EUR,46.12,2,92.24,0,0.0,,0,0.0,no_ticket,0,0.0
101067,13/12/2023,C0003,Accessories,Charger,$26.56,4,Paid,2023-12-13,26.56,USD,24.4352,4,97.7408,0,0.0,,0,0.0,no_ticket,0,0.0
100988,2023-12-11,C0001,Electronics,Smartphone Z,883,1,Paid,2023-12-11,883.0,EUR,883.0,1,883.0,0,0.0,,0,0.0,no_ticket,0,0.0
101015,12/12/2023,C0001,Smart Home,NordLock Pro,$232.09,1,Paid,2023-12-12,232.09,USD,213.52280000000002,1,213.52280000000002,0,0.0,,0,0.0,no_ticket,0,0.0
101161,23/11/2023,C0063,Electronics,Smartphone Z,1077.99,1,Paid,2023-11-23,1077.99,EUR,1077.99,1,1077.99,0,0.0,,0,0.0,no_ticket,0,0.0
101135,14/12/2023,C0004,Smart Home,NordCam Mini,"79,06 EUR",2,Pending,2023-12-14,79.06,EUR,79.06,2,158.12,0,0.0,,0,0.0,no_ticket,0,0.0
100126,2023-11-20,C0023,Electronics,Tablet A,"511,14 EUR",1,Paid,2023-11-20,511.14,EUR,511.14,1,511.14,0,0.0,,0,0.0,no_ticket,0,0.0
100512,2023-12-01,C0042,Electronics,TV Pro,1179,1,Paid,2023-12-01,1179.0,EUR,1179.0,1,1179.0,0,0.0,,10,-1.4545454545454546,defect_quality,0,0.0
100077,2023-11-18,C0004,Accessories,Wireless Mouse,57.30,1,Paid,2023-11-18,57.3,EUR,57.3,1,57.3,0,0.0,,0,0.0,no_ticket,0,0.0
100931,11/12/2023,C0049,Electronics,Tablet A,"554,07 EUR",1,Paid,2023-12-11,554.07,EUR,554.07,1,554.07,0,0.0,,0,0.0,no_ticket,0,0.0
100142,21/11/2023,C0004,Electronics,Tablet A,"599,07 EUR",1,Paid,2023-11-21,599.07,EUR,599.07,1,599.07,0,0.0,,0,0.0,no_ticket,0,0.0
100586,03/12/2023,C0001,Electronics,Smartphone Z,"860,95 EUR",1,Failed,2023-12-03,860.95,EUR,860.95,1,860.95,0,0.0,,0,0.0,no_ticket,0,0.0
100819,2023-12-08,C0087,Smart Home,NordPlug,17.09,1,Paid,2023-12-08,17.09,EUR,17.09,1,17.09,0,0.0,,0,0.0,no_ticket,0,0.0
101162,2023-11-20,C0271,Electronics,Laptop X,"1 394,09 EUR",1,Paid,2023-11-20,394.09,EUR,394.09,1,394.09,0,0.0,,0,0.0,no_ticket,0,0.0
100788,07/12/2023,C0151,Accessories,USB-C Cable,"8,71 EUR",2,Paid,2023-12-07,8.71,EUR,8.71,2,17.42,0,0.0,,0,0.0,no_ticket,0,0.0
100556,2023-12-03,C0005,Electronics,Laptop X,1382.75,1,Paid,2023-12-03,1382.75,EUR,1382.75,1,1382.75,0,0.0,,0,0.0,no_ticket,0,0.0
101057,2023-12-13,C0004,Smart Home,NordLock Pro,"223,76 EUR",1,Paid,2023-12-13,223.76,EUR,223.76,1,223.76,1,223.76,Processed,0,0.0,no_ticket,1,1.0
100016,2023-11-15,C0023,Electronics,TV Pro,"1449,46 EUR",1,Paid,2023-11-15,1449.46,EUR,1449.46,1,1449.46,0,0.0,,0,0.0,no_ticket,0,0.0
100436,2023-11-30,C0001,Electronics,Smartphone Z,759.36,1,Failed,2023-11-30,759.36,EUR,759.36,1,759.36,0,0.0,,0,0.0,no_ticket,0,0.0
100499,2023-12-01,C0068,Electronics,Tablet A,"461,35 EUR",1,Paid,2023-12-01,461.35,EUR,461.35,1,461.35,0,0.0,,0,0.0,no_ticket,0,0.0
100620,04/12/2023,C0013,Accessories,Charger,$30.37,2,Pending,2023-12-04,30.37,USD,27.940400000000004,2,55.88080000000001,0,0.0,,0,0.0,no_ticket,0,0.0
100451,2023-11-30,C0001,Electronics,Laptop X,"1369,47 EUR",1,Failed,2023-11-30,1369.47,EUR,1369.47,1,1369.47,0,0.0,,0,0.0,no_ticket,0,0.0
100767,2023-12-07,C0028,Accessories,Phone Case,"11,57 EUR",4,Paid,2023-12-07,11.57,EUR,11.57,4,46.28,0,0.0,,2,-2.0,defect_quality,0,0.0
100036,2023-11-16,C0063,Accessories,Laptop Sleeve,"26,31 EUR",1,Pending,2023-11-16,26.31,EUR,26.31,1,26.31,0,0.0,,0,0.0,no_ticket,0,0.0
100948,2023-12-11,C0013,Electronics,Tablet A,635,1,Paid,2023-12-11,635.0,EUR,635.0,1,635.0,0,0.0,,0,0.0,no_ticket,0,0.0
100982,2023-12-11,C0009,Electronics,Tablet A,646,1,Paid,2023-12-11,646.0,EUR,646.0,1,646.0,0,0.0,,0,0.0,no_ticket,0,0.0
100242,2023-11-24,C0276,Smart Home,NordLock Pro,205.21,1,Paid,2023-11-24,205.21,EUR,205.21,1,205.21,0,0.0,,0,0.0,no_ticket,0,0.0
100530,2023-12-02,C0005,Accessories,USB-C Cable,18.78,1,Paid,2023-12-02,18.78,EUR,18.78,1,18.78,0,0.0,,0,0.0,no_ticket,0,0.0
100344,2023-11-27,C0013,Electronics,Tablet A,$691.81,1,Paid,2023-11-27,691.81,USD,636.4652,1,636.4652,0,0.0,,0,0.0,no_ticket,0,0.0
100887,09/12/2023,C0001,Accessories,USB-C Cable,14,1,Paid,2023-12-09,14.0,EUR,14.0,1,14.0,0,0.0,,0,0.0,no_ticket,0,0.0
100507,2023-12-01,C0196,Electronics,Tablet A,"376,91 EUR",1,Paid,2023-12-01,376.91,EUR,376.91,1,376.91,0,0.0,,0,0.0,no_ticket,0,0.0
101190,2023-11-27,C0001,Accessories,Phone Case,"12,21 EUR",2,Paid,2023-11-27,12.21,EUR,12.21,2,24.42,0,0.0,,0,0.0,no_ticket,0,0.0
100216,2023-11-23,C0006,Smart Home,NordLock Pro,218.70,1,Paid,2023-11-23,218.7,EUR,218.7,1,218.7,0,0.0,,0,0.0,no_ticket,0,0.0
100209,2023-11-23,C0007,Accessories,USB-C Cable,$13.23,1,Paid,2023-11-23,13.23,USD,12.171600000000002,1,12.171600000000002,0,0.0,,0,0.0,no_ticket,0,0.0
100946,2023-12-11,C0052,Accessories,USB-C Cable,16.38,1,Paid,2023-12-11,16.38,EUR,16.38,1,16.38,0,0.0,,0,0.0,no_ticket,0,0.0
100065,2023-11-17,C0039,Accessories,Phone Case,$30.02,2,Paid,2023-11-17,30.02,USD,27.6184,2,55.2368,0,0.0,,0,0.0,no_ticket,0,0.0
100011,2023-11-15,C0002,Electronics,Laptop X,1491.63,1,Paid,2023-11-15,1491.63,EUR,1491.63,1,1491.63,0,0.0,,0,0.0,no_ticket,0,0.0
100253,2023-11-24,C0294,Accessories,Wireless Mouse,"25,96 EUR",1,Paid,2023-11-24,25.96,EUR,25.96,1,25.96,0,0.0,,0,0.0,no_ticket,0,0.0
100604,2023-12-04,C0001,Electronics,Tablet A,327.65,1,Paid,2023-12-04,327.65,EUR,327.65,1,327.65,0,0.0,,0,0.0,no_ticket,0,0.0
100806,08/12/2023,C0001,Electronics,NoiseCancel Headphones,$333.30,1,Paid,2023-12-08,333.3,USD,306.636,1,306.636,0,0.0,,0,0.0,no_ticket,0,0.0
100315,2023-11-26,C0001,Smart Home,NordLock Pro,"247,46 EUR",1,Paid,2023-11-26,247.46,EUR,247.46,1,247.46,1,247.46,Processed,0,0.0,no_ticket,1,1.0
100519,02/12/2023,C0001,Accessories,USB-C Cable,"9,35 EUR",3,Paid,2023-12-02,9.35,EUR,9.35,3,28.049999999999997,0,0.0,,0,0.0,no_ticket,0,0.0
100466,2023-11-30,C0002,Electronics,Smartphone Z,"916,13 EUR",1,Paid,2023-11-30,916.13,EUR,916.13,1,916.13,0,0.0,,0,0.0,no_ticket,0,0.0
100932,2023-12-11,C0132,Accessories,USB-C Cable,"7,40 EUR",3,Paid,2023-12-11,7.4,EUR,7.4,3,22.200000000000003,0,0.0,,0,0.0,no_ticket,0,0.0
100964,11/12/2023,C0003,Smart Home,NordLock Pro,227.48,1,Paid,2023-12-11,227.48,EUR,227.48,1,227.48,0,0.0,,0,0.0,no_ticket,0,0.0
100843,08/12/2023,C0006,Accessories,Accessory Bundle,27.11,1,Paid,2023-12-08,27.11,EUR,27.11,1,27.11,0,0.0,,0,0.0,no_ticket,0,0.0
100368,2023-11-28,C0029,Smart Home,NordLock Pro,"231,33 EUR",1,Paid,2023-11-28,231.33,EUR,231.33,1,231.33,0,0.0,,0,0.0,no_ticket,0,0.0
100146,21/11/2023,C0001,Accessories,Screen Protector,"12,09 EUR",1,Paid,2023-11-21,12.09,EUR,12.09,1,12.09,0,0.0,,0,0.0,no_ticket,0,0.0
100363,2023-11-28,C0020,Electronics,NoiseCancel Headphones,$263.87,1,Paid,2023-11-28,263.87,USD,242.7604,1,242.7604,0,0.0,,1,0.0,delivery,0,0.0
100631,2023-12-04,C0002,Electronics,NoiseCancel Headphones,328,1,Paid,2023-12-04,328.0,EUR,328.0,1,328.0,0,0.0,,0,0.0,no_ticket,0,0.0
100091,18/11/2023,C0001,Accessories,Laptop Sleeve,"16,45 EUR",3,Paid,2023-11-18,16.45,EUR,16.45,3,49.349999999999994,0,0.0,,0,0.0,no_ticket,0,0.0
100322,2023-11-27,C0011,Electronics,Laptop X,$1704.39,1,Paid,2023-11-27,1704.39,USD,1568.0388000000003,1,1568.0388000000003,0,0.0,,0,0.0,no_ticket,0,0.0
100186,22/11/2023,C0041,Electronics,NoiseCancel Headphones,"191,23 EUR",1,Paid,2023-11-22,191.23,EUR,191.23,1,191.23,0,0.0,,0,0.0,no_ticket,0,0.0
100925,2023-12-10,C0003,Accessories,Wireless Mouse,51.07,1,Pending,2023-12-10,51.07,EUR,51.07,1,51.07,0,0.0,,0,0.0,no_ticket,0,0.0
100869,09/12/2023,C0056,Smart Home,NordLock Pro,"192,27 EUR",1,Paid,2023-12-09,192.27,EUR,192.27,1,192.27,0,0.0,,0,0.0,no_ticket,0,0.0
100757,07/12/2023,C0047,Electronics,NoiseCancel Headphones,"229,65 EUR",2,Paid,2023-12-07,229.65,EUR,229.65,2,459.3,0,0.0,,0,0.0,no_ticket,0,0.0
100120,19/11/2023,C0138,Electronics,Tablet A,"374,99 EUR",1,Paid,2023-11-19,374.99,EUR,374.99,1,374.99,0,0.0,,0,0.0,no_ticket,0,0.0
101063,2023-12-13,C0037,Accessories,Charger,36,4,Paid,2023-12-13,36.0,EUR,36.0,4,144.0,0,0.0,,0,0.0,no_ticket,0,0.0
100841,08/12/2023,C0016,Smart Home,NordLock Pro,224.32,1,Paid,2023-12-08,224.32,EUR,224.32,1,224.32,0,0.0,,0,0.0,no_ticket,0,0.0
100494,01/12/2023,C0059,Accessories,Wireless Mouse,"46,58 EUR",1,Paid,2023-12-01,46.58,EUR,46.58,1,46.58,0,0.0,,0,0.0,no_ticket,0,0.0
100444,2023-11-30,C0001,Accessories,Wireless Mouse,49.02,1,Paid,2023-11-30,49.02,EUR,49.02,1,49.02,0,0.0,,0,0.0,no_ticket,0,0.0
100339,27/11/2023,C0002,Smart Home,NordTherm,142.29,2,Paid,2023-11-27,142.29,EUR,142.29,2,284.58,0,0.0,,0,0.0,no_ticket,0,0.0
101109,2023-12-14,C0183,Smart Home,NordLock Pro,228.56,1,Paid,2023-12-14,228.56,EUR,228.56,1,228.56,1,228.56,Processed,1,-3.0,defect_quality,1,1.0
100225,2023-11-24,C0240,Accessories,Screen Protector,14.17,2,Paid,2023-11-24,14.17,EUR,14.17,2,28.34,0,0.0,,0,0.0,no_ticket,0,0.0
100020,2023-11-15,C0001,Electronics,Laptop X,$1645.89,1,Paid,2023-11-15,1645.89,USD,1514.2188,1,1514.2188,0,0.0,,0,0.0,no_ticket,0,0.0
101097,14/12/2023,C0276,Accessories,Phone Case,$22.51,1,Paid,2023-12-14,22.51,USD,20.709200000000003,1,20.709200000000003,0,0.0,,0,0.0,no_ticket,0,0.0
100419,29/11/2023,C0002,Electronics,Laptop X,"1724,19 EUR",1,Paid,2023-11-29,1724.19,EUR,1724.19,1,1724.19,0,0.0,,0,0.0,no_ticket,0,0.0
101100,2023-12-14,C0007,Accessories,Charger,19.64,1,Paid,2023-12-14,19.64,EUR,19.64,1,19.64,0,0.0,,0,0.0,no_ticket,0,0.0
100992,12/12/2023,C0001,Accessories,Wireless Mouse,50.82,1,Paid,2023-12-12,50.82,EUR,50.82,1,50.82,0,0.0,,0,0.0,no_ticket,0,0.0
100386,28/11/2023,C0069,Smart Home,NordPlug,"21,62 EUR",1,Paid,2023-11-28,21.62,EUR,21.62,1,21.62,0,0.0,,0,0.0,no_ticket,0,0.0
100930,2023-12-10,C0037,Accessories,Phone Case,"30,63 EUR",1,Paid,2023-12-10,30.63,EUR,30.63,1,30.63,0,0.0,,0,0.0,no_ticket,0,0.0
100453,2023-11-30,C0005,Electronics,NoiseCancel Headphones,247.94,1,Paid,2023-11-30,247.94,EUR,247.94,1,247.94,0,0.0,,1,-3.0,defect_quality,0,0.0
100265,2023-11-25,C0001,Electronics,Tablet A,662.20,1,Paid,2023-11-25,662.2,EUR,662.2,1,662.2,0,0.0,,0,0.0,no_ticket,0,0.0
101065,2023-12-13,C0001,Smart Home,NordLock Pro,"237,74 EUR",1,Paid,2023-12-13,237.74,EUR,237.74,1,237.74,1,237.74,Processed,0,0.0,no_ticket,1,1.0
100161,21/11/2023,C0318,Electronics,Smartphone Z,$852.83,1,Paid,2023-11-21,852.83,USD,784.6036,1,784.6036,0,0.0,,0,0.0,no_ticket,0,0.0
100111,2023-11-19,C0188,Electronics,NoiseCancel Headphones,298,1,Paid,2023-11-19,298.0,EUR,298.0,1,298.0,0,0.0,,0,0.0,no_ticket,0,0.0
100304,26/11/2023,C0008,Electronics,Laptop X,"1545,42 EUR",1,Paid,2023-11-26,1545.42,EUR,1545.42,1,1545.42,0,0.0,,0,0.0,no_ticket,0,0.0
100049,17/11/2023,C0003,Accessories,Laptop Sleeve,$24.43,1,Paid,2023-11-17,24.43,USD,22.4756,1,22.4756,0,0.0,,0,0.0,no_ticket,0,0.0
100510,01/12/2023,C0001,Accessories,Laptop Sleeve,"30,16 EUR",2,Paid,2023-12-01,30.16,EUR,30.16,2,60.32,0,0.0,,0,0.0,no_ticket,0,0.0
100019,2023-11-15,C0034,Smart Home,NordLock Pro,"181,24 EUR",2,Paid,2023-11-15,181.24,EUR,181.24,2,362.48,0,0.0,,0,0.0,no_ticket,0,0.0
101068,2023-12-13,C0052,Electronics,Laptop X,"1467,19 EUR",1,Paid,2023-12-13,1467.19,EUR,1467.19,1,1467.19,0,0.0,,1,1.0,defect_quality,0,0.0
100935,11/12/2023,C0002,Accessories,USB-C Cable,$15.08,1,Paid,2023-12-11,15.08,USD,13.873600000000001,1,13.873600000000001,0,0.0,,0,0.0,no_ticket,0,0.0
101115,2023-12-14,C0307,Electronics,NoiseCancel Headphones,$222.14,1,Paid,2023-12-14,222.14,USD,204.3688,1,204.3688,0,0.0,,3,-2.0,defect_quality,0,0.0
100886,09/12/2023,C0016,Accessories,Screen Protector,$6.71,3,Paid,2023-12-09,6.71,USD,6.1732000000000005,3,18.5196,0,0.0,,0,0.0,no_ticket,0,0.0
100276,25/11/2023,C0098,Accessories,Wireless Mouse,"47,71 EUR",2,Paid,2023-11-25,47.71,EUR,47.71,2,95.42,0,0.0,,0,0.0,no_ticket,0,0.0
100115,19/11/2023,C0005,Accessories,Screen Protector,9.78,3,Paid,2023-11-19,9.78,EUR,9.78,3,29.339999999999996,0,0.0,,0,0.0,no_ticket,0,0.0
100728,2023-12-06,C0052,Smart Home,NordLock Pro,209.66,1,Paid,2023-12-06,209.66,EUR,209.66,1,209.66,0,0.0,,1,-1.0,defect_quality,0,0.0
101156,2023-11-24,C0002,Electronics,Tablet A,386.12,1,Paid,2023-11-24,386.12,EUR,386.12,1,386.12,0,0.0,,0,0.0,no_ticket,0,0.0
100002,2023-11-15,C0002,Electronics,Tablet A,"488,25 EUR",1,Paid,2023-11-15,488.25,EUR,488.25,1,488.25,0,0.0,,0,0.0,no_ticket,0,0.0
100228,2023-11-24,C0147,Electronics,Smartphone Z,1055.64,1,Paid,2023-11-24,1055.64,EUR,1055.64,1,1055.64,0,0.0,,0,0.0,no_ticket,0,0.0
100134,20/11/2023,C0001,Electronics,Smartphone Z,"970,64 EUR",1,Pending,2023-11-20,970.64,EUR,970.64,1,970.64,0,0.0,,0,0.0,no_ticket,0,0.0
100249,24/11/2023,C0060,Electronics,NoiseCancel Headphones,315.48,1,Paid,2023-11-24,315.48,EUR,315.48,1,315.48,0,0.0,,0,0.0,no_ticket,0,0.0
100497,01/12/2023,C0224,Electronics,TV Pro,1627.15,1,Paid,2023-12-01,1627.15,EUR,1627.15,1,1627.15,0,0.0,,0,0.0,no_ticket,0,0.0
100961,2023-12-11,C0003,Electronics,Smartphone Z,"832,85 EUR",1,Paid,2023-12-11,832.85,EUR,832.85,1,832.85,0,0.0,,0,0.0,no_ticket,0,0.0
100336,2023-11-27,C0002,Accessories,Charger,22.85,4,Paid,2023-11-27,22.85,EUR,22.85,4,91.4,0,0.0,,0,0.0,no_ticket,0,0.0
100440,30/11/2023,C0012,Accessories,USB-C Cable,$12.61,1,Paid,2023-11-30,12.61,USD,11.6012,1,11.6012,0,0.0,,0,0.0,no_ticket,0,0.0
101167,2023-12-11,C0001,Electronics,TV Pro,$969.19,1,Paid,2023-12-11,969.19,USD,891.6548000000001,1,891.6548000000001,0,0.0,,0,0.0,no_ticket,0,0.0
100813,2023-12-08,C0010,Electronics,NoiseCancel Headphones,$150.46,2,Paid,2023-12-08,150.46,USD,138.4232,2,276.8464,0,0.0,,3,-1.5,defect_quality,0,0.0
101052,13/12/2023,C0137,Accessories,Screen Protector,10.44,1,Paid,2023-12-13,10.44,EUR,10.44,1,10.44,0,0.0,,0,0.0,no_ticket,0,0.0
100442,2023-11-30,C0001,Electronics,NoiseCancel Headphones,"153,00 EUR",2,Paid,2023-11-30,153.0,EUR,153.0,2,306.0,0,0.0,,0,0.0,no_ticket,0,0.0
101163,07/12/2023,C0047,Electronics,Smartphone Z,712.48,1,Paid,2023-12-07,712.48,EUR,712.48,1,712.48,0,0.0,,0,0.0,no_ticket,0,0.0
101114,14/12/2023,C0002,Accessories,Laptop Sleeve,32.82,1,Paid,2023-12-14,32.82,EUR,32.82,1,32.82,0,0.0,,0,0.0,no_ticket,0,0.0
100839,08/12/2023,C0011,Accessories,Phone Case,"24,43 EUR",1,Paid,2023-12-08,24.43,EUR,24.43,1,24.43,0,0.0,,0,0.0,no_ticket,0,0.0
101048,2023-12-13,C0014,Smart Home,NordLock Pro,183.01,1,Paid,2023-12-13,183.01,EUR,183.01,1,183.01,0,0.0,,0,0.0,no_ticket,0,0.0
101104,2023-12-14,C0013,Accessories,Accessory Bundle,"83,54 EUR",1,Paid,2023-12-14,83.54,EUR,83.54,1,83.54,0,0.0,,0,0.0,no_ticket,0,0.0
101150,12/12/2023,C0040,Smart Home,NordLock Pro,185.28,2,Paid,2023-12-12,185.28,EUR,185.28,2,370.56,0,0.0,,0,0.0,no_ticket,0,0.0
100243,2023-11-24,C0026,Electronics,Laptop X,$1554.67,1,Paid,2023-11-24,1554.67,USD,1430.2964000000002,1,1430.2964000000002,0,0.0,,0,0.0,no_ticket,0,0.0
100684,2023-12-05,C0001,Electronics,Tablet A,587.10,1,Paid,2023-12-05,587.1,EUR,587.1,1,587.1,0,0.0,,0,0.0,no_ticket,0,0.0
100658,2023-12-05,C0002,Electronics,NoiseCancel Headphones,"151,84 EUR",1,Paid,2023-12-05,151.84,EUR,151.84,1,151.84,0,0.0,,0,0.0,no_ticket,0,0.0
100505,2023-12-01,C0007,Electronics,TV Pro,$1619.06,1,Paid,2023-12-01,1619.06,USD,1489.5352,1,1489.5352,0,0.0,,0,0.0,no_ticket,0,0.0
100409,2023-11-29,C0001,Smart Home,NordPlug,21,1,Paid,2023-11-29,21.0,EUR,21.0,1,21.0,0,0.0,,0,0.0,no_ticket,0,0.0
101199,24/11/2023,C0001,Electronics,NoiseCancel Headphones,"182,17 EUR",2,Paid,2023-11-24,182.17,EUR,182.17,2,364.34,0,0.0,,0,0.0,no_ticket,0,0.0
101106,2023-12-14,C0008,Electronics,Tablet A,"635,65 EUR",1,Paid,2023-12-14,635.65,EUR,635.65,1,635.65,0,0.0,,0,0.0,no_ticket,0,0.0
101062,2023-12-13,C0019,Electronics,Smartphone Z,"799,82 EUR",1,Failed,2023-12-13,799.82,EUR,799.82,1,799.82,0,0.0,,0,0.0,no_ticket,0,0.0
100141,2023-11-21,C0007,Accessories,Phone Case,$23.73,1,Paid,2023-11-21,23.73,USD,21.8316,1,21.8316,0,0.0,,0,0.0,no_ticket,0,0.0
100547,2023-12-02,C0038,Accessories,Charger,"24,90 EUR",2,Paid,2023-12-02,24.9,EUR,24.9,2,49.8,0,0.0,,0,0.0,no_ticket,0,0.0
100901,10/12/2023,C0036,Accessories,Phone Case,"23,08 EUR",3,Paid,2023-12-10,23.08,EUR,23.08,3,69.24,0,0.0,,0,0.0,no_ticket,0,0.0
100638,04/12/2023,C0005,Accessories,Phone Case,"19,42 EUR",1,Paid,2023-12-04,19.42,EUR,19.42,1,19.42,0,0.0,,0,0.0,no_ticket,0,0.0
100689,2023-12-06,C0166,Electronics,Smartphone Z,$963.43,1,Paid,2023-12-06,963.43,USD,886.3556,1,886.3556,0,0.0,,1,-3.0,defect_quality,0,0.0
100622,04/12/2023,C0135,Accessories,Accessory Bundle,66.41,2,Paid,2023-12-04,66.41,EUR,66.41,2,132.82,0,0.0,,0,0.0,no_ticket,0,0.0
100851,2023-12-09,C0022,Accessories,USB-C Cable,"15,85 EUR",3,Pending,2023-12-09,15.85,EUR,15.85,3,47.55,0,0.0,,0,0.0,no_ticket,0,0.0
100584,2023-12-03,C0013,Electronics,Tablet A,"524,49 EUR",2,Paid,2023-12-03,524.49,EUR,524.49,2,1048.98,0,0.0,,0,0.0,no_ticket,0,0.0
100333,2023-11-27,C0165,Smart Home,NordTherm,83.95,1,Failed,2023-11-27,83.95,EUR,83.95,1,83.95,0,0.0,,0,0.0,no_ticket,0,0.0
101116,2023-12-14,C0002,Accessories,Screen Protector,9.56,1,Paid,2023-12-14,9.56,EUR,9.56,1,9.56,1,9.56,Processed,0,0.0,no_ticket,1,1.0
101105,2023-12-14,C0218,Smart Home,NordLock Pro,$221.88,1,Paid,2023-12-14,221.88,USD,204.1296,1,204.1296,0,0.0,,3,0.3333333333333333,app_connectivity,0,0.0
